title_name,realease_date,price,description,title_review,title_rating,developer,publisher,game_tags
"Sid Meier’s Civilization® VI","Oct 21 2016","5999.0","Civilization VI offers new ways to interact with your world, expand your empire across the map, advance your culture, and compete against history’s greatest leaders to build a civilization that will stand the test of time. Play as one of 20 historical leaders including Roosevelt (America) and Victoria (England).","Very Positive","(3,118)","Firaxis Games, Aspyr (Mac), Aspyr (Linux)","2K, Aspyr (Mac), Aspyr (Linux)","Strategy,Turn-Based Strategy,Multiplayer,Historical,Singleplayer,Turn-Based,Grand Strategy,4X,War,Simulation,City Builder,Tactical,Great Soundtrack,Building,Moddable,Management,Online Co-Op,Co-op,Hex Grid,Atmospheric,+"
"Space Engineers","Feb 28 2019","1999.0","Space Engineers is a sandbox game about engineering, construction, exploration and survival in space and on planets. Players build space ships, space stations, planetary outposts of various sizes and uses, pilot ships and travel through space to explore planets and gather resources to survive.","Very Positive","(80,619)","Keen Software House","Keen Software House","Space,Sandbox,Building,Multiplayer,Open World Survival Craft,Simulation,Survival,Open World,Physics,Crafting,Destruction,Co-op,Indie,Futuristic,Sci-fi,Singleplayer,Action,Strategy,Adventure,Early Access,+"
"Planet Zoo: Australia Pack","Aug 25 2020","549.0","None","Mostly Positive","(164)","Frontier Developments","Frontier Developments","Simulation,Strategy,Sandbox,+"
"New World","Sep 28 2021","2399.0","Explore a thrilling, open-world MMO filled with danger and opportunity where you'll forge a new destiny on the supernatural island of Aeternum.","Mixed","(2,255)","Amazon Games","Amazon Games","Massively Multiplayer,Open World,MMORPG,RPG,Adventure,Action,PvP,PvE,Multiplayer,Walking Simulator,Fantasy,Character Customization,Crafting,Third Person,Co-op,Open World Survival Craft,Sandbox,Violent,Sexual Content,Souls-like,+"
"Diplomacy is Not an Option","Feb 9 2022","2499.0","You were born a feudal lord. Sounds good, right? But you're bored of hunting, executions and tournaments. Even of feasts with beautiful maidens. The only dream left - your castle surrounded by hordes of enemies. You would waste no time on negotiation. This is your chance to show'em who is in charge.","Mostly Positive","(380)","Door 407","Door 407","City Builder,Tower Defense,Strategy,Sandbox,Building,Survival,Base Building,RTS,Procedural Generation,Colorful,Stylized,Singleplayer,Combat,Medieval,3D,Early Access,Action RTS,Indie,Violent,Action,+"
"The Sims™ 4 Deluxe + Cats & Dogs Bundle","","5938.0","NA","NA","NA","NA","NA","NA"
"Pummel Party","Sep 20 2018","1499.0","Pummel Party is a 4-8 player online and local-multiplayer party game. Pummel friends or AI using a wide array of absurd items in the board mode and compete to destroy friendships in the unique collection of minigames.","Very Positive","(595)","Rebuilt Games","Rebuilt Games","Multiplayer,Funny,Online Co-Op,4 Player Local,Board Game,Casual,Co-op,Local Multiplayer,Minigames,Indie,Action,Local Co-Op,Party,Party Game,Comedy,Tabletop,Controller,Colorful,Gore,Singleplayer,+"
"HITMAN 3","Jan 20 2022","5999.0","Death Awaits. Agent 47 returns in HITMAN 3, the dramatic conclusion to the World of Assassination trilogy.","Mostly Positive","(426)","IO Interactive A/S","IO Interactive A/S","Action,Adventure,Stealth,Sandbox,Shooter,Assassin,Third-Person Shooter,Singleplayer,Violent,VR,Third Person,Cinematic,Realistic,Funny,Gore,Puzzle,Capitalism,Multiplayer,+"
"Demon Slayer -Kimetsu no Yaiba- The Hinokami Chronicles","Oct 15 2021","5999.0","Become the Blade that Destroys Demons!","Very Positive","(443)","CyberConnect2","SEGA","Anime,Action,Adventure,3D Fighter,Action-Adventure,3D,2D Fighter,Demons,Cartoon,Cinematic,Colorful,Comic Book,PvP,Drama,Emotional,Combat,Multiplayer,Foreign,Controller,Quick-Time Events,+"
"ASTRONEER","Feb 6 2019","2999.0","A game of aerospace industry and interplanetary exploration.","Very Positive","(846)","System Era Softworks","System Era Softworks","Multiplayer,Open World,Open World Survival Craft,Space,Survival,Exploration,Base Building,Co-op,Sandbox,Adventure,Building,Crafting,Sci-fi,Colorful,Singleplayer,Simulation,Third Person,Automation,Atmospheric,Indie,+"
"Astral Ascent","Apr 12 2022","2249.0","Choose one of four heroes and explore the Garden, an astral prison guarded by 12 powerful mystical bosses: the Zodiacs. Challenge them with dozens of unique spells and faithful friends by your side to unfold the story of this platform roguelite with lightning fast combat.","Very Positive","(161)","Hibernian Workshop","Hibernian Workshop, Maple Whispering Limited","Action Roguelike,Roguelite,Pixel Graphics,Hack and Slash,2D Platformer,Platformer,Action,Roguelike,Solitaire,2D,Fantasy,Magic,Adventure,Co-op,Local Co-Op,Singleplayer,Multiplayer,Local Multiplayer,Early Access,Indie,+"
"Borderlands 2 Game of the Year","Oct 8 2013","799.0","NA","NA","NA","NA","NA","NA"
"Hades","Sep 17 2020","2499.0","Defy the god of the dead as you hack and slash out of the Underworld in this rogue-like dungeon crawler from the creators of Bastion, Transistor, and Pyre.","Overwhelmingly Positive","(2,318)","Supergiant Games","Supergiant Games","Action Roguelike,Indie,Roguelite,Action,Hack and Slash,RPG,Mythology,Roguelike,Great Soundtrack,Singleplayer,Dungeon Crawler,Story Rich,Replay Value,Difficult,Isometric,Action RPG,Hand-drawn,Atmospheric,Perma Death,Souls-like,+"
"Monster Hunter: World","Aug 9 2018","2999.0","Welcome to a new world! In Monster Hunter: World, the latest installment in the series, you can enjoy the ultimate hunting experience, using everything at your disposal to hunt monsters in a new world teeming with surprises and excitement.","Very Positive","(1,642)","CAPCOM Co., Ltd.","CAPCOM Co., Ltd.","Co-op,Multiplayer,Action,Open World,RPG,Third Person,Character Customization,Adventure,Fantasy,Singleplayer,Difficult,Action RPG,Exploration,Great Soundtrack,Replay Value,Atmospheric,Hack and Slash,JRPG,Souls-like,MMORPG,+"
"Destiny 2: Beyond Light","Nov 10 2020","2999.0","NA","NA","NA","NA","NA","NA"
"A Dance of Fire and Ice","Jan 24 2019","599.0","A Dance of Fire and Ice is a strict rhythm game. Keep your focus as you guide two orbiting planets along a winding path without breaking their perfect equilibrium.","Very Positive","(1,152)","7th Beat Games","7th Beat Games, indienova","Rhythm,Music,Indie,Difficult,Great Soundtrack,Singleplayer,2D,Level Editor,Action,Psychological Horror,Casual,+"
"DEVOUR","Jan 28 2021","499.0","DEVOUR is a co-op horror survival game for 1-4 players. Stop possessed cultists before they drag you to hell. Run. Scream. Hide. Just don't get caught.","Very Positive","(3,113)","Straight Back Games","Straight Back Games","Horror,Online Co-Op,Multiplayer,Survival Horror,Co-op,Survival,Dark,First-Person,Indie,Psychological Horror,Atmospheric,Difficult,Sexual Content,Singleplayer,Puzzle,Stealth,Gore,Action,Violent,FPS,+"
"Destiny 2: The Witch Queen Deluxe Edition Upgrade","Feb 22 2022","3999.0","None","Positive","(14)","Bungie","Bungie","Action,Adventure,Free to Play,+"
"Deadside","Apr 14 2020","1999.0","Deadside is a hardcore multiplayer shooter with survival elements. Post-Apocalypse, PvP, PvE, open world, realistic weapons, craft, base building","Very Positive","(583)","Bad Pixel","Bad Pixel","Survival,Open World,Multiplayer,Massively Multiplayer,Open World Survival Craft,Action,Adventure,Base Building,Crafting,Post-apocalyptic,Shooter,Early Access,PvP,Indie,FPS,Realistic,Singleplayer,Violent,Gore,First-Person,+"
"CRIMESIGHT","Apr 14 2022","1999.0","Whodunnit... or who will do it?! A new mystery simulation game with player-vs.-player action arrives on the crime scene! In CRIMESIGHT, players will face off against each other in a battle of wits. In this clash of good and evil, who can outsmart their opponent and come up on top?!","Very Positive","(163)","Konami Digital Entertainment","Konami Digital Entertainment","Simulation,PvP,Social Deduction,Strategy,Multiplayer,Turn-Based Strategy,Online Co-Op,Detective,Survival,Logic,Top-Down,Grid-Based Movement,Futuristic,Sci-fi,Tabletop,Turn-Based Tactics,Mystery,Board Game,Turn-Based,Tactical,+"
"Jurassic World Evolution: Premium Edition","","3459.0","NA","NA","NA","NA","NA","NA"
"Age of Empires II: Definitive Edition","Nov 14 2019","1999.0","Age of Empires II: Definitive Edition features “The Last Khans” with 3 new campaigns and 4 new Civilizations. Frequent updates include events, additional content, new game modes, and enhanced features with the recent addition of Co-Op mode!","Overwhelmingly Positive","(1,500)","Forgotten Empires, Tantalus Media, Wicked Witch","Xbox Game Studios","Strategy,RTS,City Builder,Multiplayer,Base Building,Historical,Medieval,Singleplayer,Classic,Resource Management,Real-Time,Tactical,Remake,Co-op,Action,Replay Value,Isometric,2D,Adventure,Great Soundtrack,+"
"Fallout New Vegas Ultimate","Feb 7 2012","1999.0","NA","NA","NA","NA","NA","NA"
"Madden NFL 22","Aug 20 2021","5999.0","Madden NFL 22 is where gameday happens. All-new features in Franchise include staff management, an enhanced scenario engine, and weekly strategy. Share avatar progress and player class between Face of The Franchise and The Yard with unified progression.","Mixed","(260)","Tiburon","Electronic Arts","Sports,Football,Controller,PvP,Realistic,Casual,Immersive Sim,eSports,Third Person,Physics,Team-Based,Strategy,Cinematic,Simulation,America,Local Co-Op,Local Multiplayer,Multiplayer,Online Co-Op,Singleplayer,+"
"Fallout 1st","Apr 14 2020","1299.0","None","Mostly Negative","(11)","Bethesda Game Studios","Bethesda Softworks","Capitalism,Dark Comedy,Comedy,Dark Humor,Horror,Crime,Funny,Parody,Hentai,Illuminati,Sexual Content,Gore,Early Access,Nudity,RPG,Violent,Post-apocalyptic,Pixel Graphics,Female Protagonist,Free to Play,+"
"Stellaris","May 9 2016","3999.0","Explore a galaxy full of wonders in this sci-fi grand strategy game from Paradox Development Studios. Interact with diverse alien races, discover strange new worlds with unexpected events and expand the reach of your empire. Each new adventure holds almost limitless possibilities.","Very Positive","(1,091)","Paradox Development Studio","Paradox Interactive","Space,Grand Strategy,Strategy,Sci-fi,Exploration,4X,Sandbox,Simulation,Real-Time with Pause,Moddable,Multiplayer,Singleplayer,Diplomacy,Management,Futuristic,Military,Replay Value,Great Soundtrack,Procedural Generation,Atmospheric,+"
"F1® 2021","Jul 15 2021","5999.0","Every story has a beginning in F1® 2021, the official videogame of the 2021 FIA FORMULA ONE WORLD CHAMPIONSHIP™. Enjoy the stunning new features of F1® 2021, including the thrilling story experience ‘Braking Point’, two-player Career, and get even closer to the grid with ‘Real-Season Start’.","Very Positive","(2,348)","Codemasters","Electronic Arts","Racing,Driving,Sports,Immersive Sim,Automobile Sim,PvP,Controller,eSports,Split Screen,Simulation,3D,Realistic,Multiplayer,Co-op,Local Multiplayer,Cinematic,VR,Online Co-Op,Singleplayer,Arcade,+"
"Space Engineers Ultimate Edition","","5429.0","NA","NA","NA","NA","NA","NA"
"CHRONO CROSS: THE RADICAL DREAMERS EDITION","Apr 7 2022","1999.0","CHRONO CROSS is an RPG that transcends time and space, unfolding across two interlinked parallel worlds. With over 40 party members to meet, people and dimensions will intertwine in this epic drama about the planet itself.","Mixed","(836)","Square Enix, D4Enterprise Co.,Ltd.","Square Enix","JRPG,RPG,Exploration,Party-Based RPG,Story Rich,Adventure,Puzzle,Fantasy,Singleplayer,Magic,Sci-fi,Text-Based,Time Travel,Drama,Nostalgia,Great Soundtrack,Soundtrack,Anime,Classic,Turn-Based Combat,+"
"RollerCoaster Tycoon® 3: Complete Edition","Sep 24 2020","799.0","Build the park of a lifetime and rediscover the critically acclaimed rollercoaster simulation bestseller. Feel the thrill of a genre-defining classic, complete with two huge expansion packs.","Mostly Positive","(45)","Frontier Developments, Aspyr (Mac)","Frontier Foundry, Aspyr (Mac)","Strategy,Management,Building,Simulation,City Builder,Casual,Sandbox,Family Friendly,Resource Management,3D,Cartoony,Colorful,Stylized,Funny,Singleplayer,Base Building,Cinematic,Multiplayer,+"
"SCUM","Aug 29 2018","3499.0","SCUM aims to evolve the multiplayer open world survival game with unprecedented levels of character customization, control and progression, where knowledge and skills are the ultimate weapons for long-term survival.","Mostly Positive","(1,274)","Gamepires","Gamepires","Survival,Open World Survival Craft,Multiplayer,Open World,Zombies,Massively Multiplayer,Action,Early Access,Adventure,Crafting,Nudity,Realistic,Singleplayer,FPS,Violent,PvP,Third Person,Gore,Indie,RPG,+"
"Stormworks: Build and Rescue","Sep 17 2020","2499.0","Join a world where you design, create and pilot your own air sea rescue service. Release your inner hero as you battle fierce storms out at sea to rescue those in need.","Very Positive","(732)","Geometa","Geometa","Sandbox,Flight,Open World,Building,Exploration,Programming,Sailing,Open World Survival Craft,Immersive Sim,Base Building,Survival,PvP,Character Customization,Tutorial,First-Person,Naval,Trains,Physics,Automation,Crafting,+"
"Planet Zoo: South America Pack","Apr 7 2020","549.0","None","Mixed","(304)","Frontier Developments","Frontier Developments","Simulation,Strategy,Management,City Builder,Sandbox,Economy,Cute,Nature,Funny,Realistic,Singleplayer,Relaxing,Great Soundtrack,Family Friendly,Resource Management,+"
"Pacific Northwest","","4404.0","NA","NA","NA","NA","NA","NA"
"Farming Simulator 22 - Year 1 Bundle","","8728.0","NA","NA","NA","NA","NA","NA"
"Gunfire Reborn","Nov 18 2021","1999.0","Gunfire Reborn is a level-based adventure game featuring FPS, Roguelite and RPG. Players can control heroes with various abilities to experience diverse Build gameplay, use various weapons to explore procedurally-generated levels. You can play the game alone, or join 4-player coop.","Very Positive","(672)","Duoyi Games","Duoyi Games","FPS,Roguelite,Co-op,Online Co-Op,Roguelike,Multiplayer,Indie,Action,Looter Shooter,Adventure,RPG,Shooter,Early Access,Action Roguelike,First-Person,Dungeon Crawler,Replay Value,Singleplayer,Fast-Paced,Souls-like,+"
"Hot Dogs, Horseshoes & Hand Grenades","Apr 5 2016","1999.0","Do you like hot dogs? How about horseshoes? Hand grenades? (everyone likes hand grenades) Anyway, we've got all that, and guns. SO MANY GUNS. So if you like ordnance, meat, and far too many groan-worthy puns, this is the VR sandbox game for you.","Overwhelmingly Positive","(306)","RUST LTD.","RUST LTD.","VR,Simulation,Gun Customization,Sandbox,Shooter,Action,FPS,Realistic,Funny,Early Access,Physics,Singleplayer,Indie,America,First-Person,Destruction,Atmospheric,Family Friendly,Psychological Horror,Horror,+"
"Weird West","Mar 31 2022","3999.0","Survive and unveil the mysteries of the Weird West through the intertwined destinies of its unusual heroes in an immersive sim from the co-creators of Dishonored and Prey.","Mostly Positive","(1,159)","WolfEye Studios","Devolver Digital","Western,Isometric,RPG,Story Rich,Immersive Sim,Atmospheric,Tactical RPG,Action,Multiple Endings,Dark Fantasy,Supernatural,Stealth,Action RPG,Indie,Violent,Choices Matter,Top-Down,Adventure,Singleplayer,Dark,+"
"Shadows of Forbidden Gods","Nov 1 2021","1999.0","Take on the role of a Dark Elder God and lead your agents to bring about an apocalypse in a fantasy world. Work in the shadows, avoiding the heroes who will try to stop you, as you bring about plague and famine, ice age and volcanic destruction, madness and never ending night.","Very Positive","(33)","Bobby Two Hands","Bobby Two Hands","Early Access,Strategy,Simulation,God Game,Grand Strategy,Turn-Based Strategy,Outbreak Sim,Political Sim,2D,Top-Down,Conspiracy,Crime,Dark,Dark Fantasy,Destruction,Dystopian,Economy,Fantasy,Gothic,Horror,+"
"One Hour One Life","Nov 8 2018","1499.0","A multiplayer survival game of parenting and civilization building. Get born to another player as your mother. Live an entire life in one hour. Have babies of your own in the form of other players. Leave a legacy for the next generation as you help to rebuild civilization from scratch.","Very Positive","(46)","Jason Rohrer","Jason Rohrer","Indie,Survival,Simulation,Massively Multiplayer,Open World Survival Craft,Crafting,Multiplayer,Open World,2D,Early Access,Funny,Sandbox,Nudity,Casual,PvP,Cute,Online Co-Op,Exploration,+"
"Monster Energy Supercross - The Official Videogame 5","Mar 17 2022","4999.0","Hold on fast to the handlebar of your bike because a new chapter of the series has finally arrived. Try Monster Energy Supercross - The Official Videogame 5 and discover the quintessence of indoor supercross!","Mixed","(102)","Milestone S.r.l.","Milestone S.r.l.","Racing,Simulation,Sports,eSports,Bikes,Motocross,Motorbike,PvP,Multiplayer,Singleplayer,Split Screen,+"
"The Flipper Bundle","","5846.0","NA","NA","NA","NA","NA","NA"
"Stranded Deep","Jan 23 2015","1499.0","Take the role of a plane crash survivor stranded somewhere in the Pacific Ocean. Come face to face with some of the most life threatening scenarios that will result in a different experience each time you play. Scavenge. Discover. Survive.","Mostly Positive","(416)","Beam Team Games","Beam Team Publishing","Open World Survival Craft,Survival,Multiplayer,Open World,Crafting,First-Person,Adventure,Exploration,Realistic,Singleplayer,Building,Sandbox,Co-op,Simulation,Early Access,Underwater,Action,Atmospheric,Indie,Strategy,+"
"Iron Harvest Deluxe Edition","","1849.0","NA","NA","NA","NA","NA","NA"
"Nightmare Reaper","Mar 28 2022","2499.0","Progress through the cursed depths of a nightmare while finding an arsenal of powerful weapons and improving your abilities along the way. This retro-inspired FPS with looter shooter and rogue-lite elements breaches the wall between classic and modern gameplay.","Very Positive","(638)","Blazing Bit Games","Blazing Bit Games","FPS,Looter Shooter,Retro,Violent,Roguelite,Shooter,Loot,First-Person,Old School,Action,Pixel Graphics,Female Protagonist,Horror,Atmospheric,Dark,1990's,Surreal,Psychological Horror,Combat,Singleplayer,+"
"Iron Lung","Mar 10 2022","599.0","A short horror game where you pilot a tiny submarine through an ocean of blood on an alien moon.","Very Positive","(977)","David Szymanski","David Szymanski","Horror,Submarine,Atmospheric,Underwater,Short,Pixel Graphics,Indie,Psychological Horror,Minimalist,Adventure,First-Person,Abstract,Sci-fi,Walking Simulator,3D,Exploration,Dark,Mystery,Dystopian,Surreal,+"
"The Sims™ 4 Seasons","Jun 18 2020","3999.0","None","Mixed","(235)","Maxis","Electronic Arts","Simulation,Character Customization,Singleplayer,Funny,Classic,+"
"Car Detailing Simulator","Apr 13 2022","1439.0","Car Detailing Simulator, you get a chance to renew any car and restore its splendor at the request of demanding customers! A nice and well-groomed vehicle can be the pride of every human being! Clean, polish and marvel at your creations in this highly realistic game where every little detail counts!","Very Positive","(146)","Games Incubator, GameFormatic S.A.","Games Incubator, PlayWay S.A.","Simulation,Automobile Sim,Singleplayer,Realistic,Design & Illustration,Racing,Indie,Casual,3D,Driving,Experimental,Building,Immersive Sim,Management,Education,Colorful,First-Person,Family Friendly,Retro,Stylized,+"
"Hero's Hour","Mar 1 2022","1799.0","A fast turn-based strategy RPG with real-time combat. Develop your cities and armies, level up your heroes to gain new, powerful spells and skills, and explore the wonders and dangers of the procedurally generated maps as you aim to conquer your enemies before they do the same to you.","Mostly Positive","(365)","Benjamin "ThingOnItsOwn" Hauer","Goblinz Publishing, Maple Whispering Limited","Local Co-Op,Strategy,Auto Battler,Turn-Based Strategy,Pixel Graphics,Fantasy,RPG,Turn-Based Tactics,Procedural Generation,Multiplayer,Singleplayer,Tactical,2D,Level Editor,Strategy RPG,PvP,Atmospheric,4X,Turn-Based,Grand Strategy,+"
"Tom Clancy's Ghost Recon® Wildlands","Mar 7 2017","4999.0","Create a team with up to 3 friends in Tom Clancy’s Ghost Recon® Wildlands and enjoy the ultimate military shooter experience set in a massive, dangerous, and responsive open world.","Very Positive","(1,116)","Ubisoft Paris, Ubisoft Annecy, Ubisoft Bucharest, Ubisoft Montpellier, Ubisoft Milan, Reflections, Ubisoft Belgrade","Ubisoft","Open World,Shooter,Multiplayer,Co-op,Action,Stealth,Tactical,Singleplayer,Third-Person Shooter,Military,FPS,Online Co-Op,Adventure,Third Person,Survival,Strategy,Sandbox,First-Person,Atmospheric,PvP,+"
"ULTRAKILL","Sep 3 2020","1999.0","ULTRAKILL is a fast-paced ultraviolent retro FPS combining the skill-based style scoring from character action games with unadulterated carnage inspired by the best shooters of the '90s. Rip apart your foes with varied destructive weapons and shower in their blood to regain your health.","Overwhelmingly Positive","(796)","Arsi "Hakita" Patala","New Blood Interactive","Early Access,FPS,Arena Shooter,Spectacle fighter,Character Action Game,Blood,Singleplayer,Retro,Shooter,First-Person,Difficult,Action,Old School,Robots,Silent Protagonist,3D,Sci-fi,Stylized,Cyberpunk,Colorful,+"
"Forgive Me Father","Apr 7 2022","1999.0","Forgive Me Father is a dark retro horror FPS set in a comic book style world inspired by the novels of H.P. Lovecraft. As the only one left with full senses, you begin a journey in search of answers and relief. How long can you last?","Mostly Positive","(247)","Byte Barrel","1C Entertainment","Action,FPS,Lovecraftian,Shooter,3D,First-Person,Cartoony,Stylized,Indie,Psychedelic,Gore,Atmospheric,Retro,Violent,Dark Fantasy,Supernatural,Mystery,Character Customization,Combat,Singleplayer,+"
"Call of Duty®: Modern Warfare® Remastered","Jul 27 2017","1999.0","One of the most critically-acclaimed games in history, Call of Duty: Modern Warfare is back, remastered in true high-definition, featuring improved textures, physically based rendering, high-dynamic range lighting and much more.","Mixed","(267)","Raven Software, Beenox","Activision","FPS,Action,Multiplayer,Shooter,Singleplayer,War,First-Person,Military,Violent,Controller,Remake,Story Rich,Co-op,Classic,Casual,Stealth,Gore,World War II,Zombies,Nudity,+"
"WARNO","Jan 20 2022","3999.0","Realistic, immersive, breathtaking. WARNO is the ultimate World War III battle simulator from the masters of strategy, Eugen Systems. A Cold War turns decisively hot as you command hundreds of units on a beautiful and brutal battlefield. Outsmart, outfight, and lead your forces to total victory.","Very Positive","(334)","Eugen Systems","Eugen Systems","Early Access,Wargame,Real Time Tactics,Military,Cold War,War,RTS,Artificial Intelligence,Tanks,PvP,Real-Time,Strategy,Turn-Based Strategy,Alternate History,Historical,Bullet Time,Simulation,Team-Based,Tactical,Realistic,+"
"ROUNDS","Apr 1 2021","599.0","Rounds is a 1v1 rogue-lite shooter where each round gets more intense. The losing player of each round unlocks clever upgrades to create a better build to counter their opponent.","Overwhelmingly Positive","(563)","Landfall","Landfall","Multiplayer,Fighting,Local Multiplayer,2D Fighter,Deckbuilding,Indie,Action,Physics,Card Battler,Roguelite,2D,Roguelike Deckbuilder,Card Game,Side Scroller,Platformer,PvP,Arcade,2D Platformer,Party Game,Twin Stick Shooter,+"
"Have a Nice Death","Mar 8 2022","1499.0","Have a Nice Death is a 2D action roguelike where you play as an overworked Death, whose employees have run rampant, completely throwing off the balance of souls - and his vacation plans. In order to restore order, you'll have to grab your trusty scythe and show your employees who's boss.","Very Positive","(887)","Magic Design Studios","Gearbox Publishing","Singleplayer,Action Roguelike,2D Platformer,Action,2D,Dark Humor,Controller,Cartoony,Cartoon,Early Access,Gothic,Hack and Slash,Comedy,Combat,Metroidvania,Arcade,Platformer,Roguelike,Funny,Indie,+"
"Microsoft Flight Simulator Game of the Year Edition","Apr 18 2020","5999.0","Thank you to our fans – new and old! Microsoft Flight Simulator Game of the Year (GOTY) Edition offers 5 all-new aircrafts, 8 new handcrafted airports, 6 new Discovery Flights, new tutorials, and updates to the weather system. GOTY Edition is free for existing users. The sky is calling!","Mostly Positive","(818)","Asobo Studio","Xbox Game Studios","Simulation,Flight,Open World,Realistic,Multiplayer,Singleplayer,Atmospheric,VR,Real-Time,Physics,Adventure,Colorful,Family Friendly,TrackIR,Logic,Life Sim,Surreal,Beautiful,Short,Boxing,+"
"Green Hell","Sep 5 2019","2499.0","Plunge into the open world survival simulation set in the extreme conditions of the uncharted Amazon jungle. Use real-life survival techniques to craft, hunt, fight and gather resources, set a makeshift shelter or raise a fortress. Tend your wounds and maintain mental health - alone or with friends.","Very Positive","(826)","Creepy Jar","Creepy Jar","Survival,Open World Survival Craft,Open World,Online Co-Op,Crafting,Simulation,Singleplayer,Base Building,Survival Horror,Realistic,Sandbox,Exploration,First-Person,Building,Adventure,Atmospheric,Action-Adventure,Resource Management,Immersive Sim,Indie,+"
"Fallout 76: Atoms","Apr 14 2020","499.0","None","['No user reviews']","0","Bethesda Game Studios","Bethesda Softworks","Psychological Horror,Capitalism,Dark Comedy,Horror,Memes,Dystopian,Sexual Content,Gore,Hentai,Violent,Gambling,Illuminati,Dark Humor,Comedy,RPG,LGBTQ+,Nudity,Dating Sim,Walking Simulator,Story Rich,+"
"Monster Hunter Rise: Sunbreak","Jun 30 2022","3999.0","None","['No user reviews']","0","CAPCOM Co., Ltd.","CAPCOM Co., Ltd.","Action,Multiplayer,+"
