title_name,realease_date,price,description,title_review,title_rating,developer,publisher,game_tags
"Chorus","Dec 3 2021","2999.0","Take control of Nara on a quest to destroy the dark cult that created her. Unlock devastating weapons & mind-bending abilities in an evolution of the space-combat shooter. Along with Forsaken, her sentient starfighter, explore ancient temples, engage in zero-g combat & venture beyond waking reality.","Very Positive","(83)","Deep Silver Fishlabs","Deep Silver","Action,Adventure,Indie,Space,Female Protagonist,Sci-fi,Shooter,Spaceships,Singleplayer,Space Sim,Flight,Third Person,Open World,Story Rich,Arcade,+"
"Titanfall® 2","Jun 18 2020","749.0","Respawn Entertainment gives you the most advanced titan technology in its new, single player campaign & multiplayer experience. Combine & conquer with new titans & pilots, deadlier weapons, & customization and progression systems that help you and your titan flow as one unstoppable killing force.","Very Positive","(1,796)","Respawn Entertainment","Electronic Arts","FPS,Multiplayer,Shooter,Action,Mechs,Singleplayer,Sci-fi,Parkour,First-Person,Futuristic,PvP,Military,Combat,Team-Based,Fast-Paced,Time Travel,Hero Shooter,Violent,Gore,Co-op,+"
"Overcooked! 2","Aug 7 2018","2499.0","Overcooked returns with a brand-new helping of chaotic cooking action! Journey back to the Onion Kingdom and assemble your team of chefs in classic couch co-op or online play for up to four players. Hold onto your aprons… it’s time to save the world again!","Very Positive","(862)","Ghost Town Games Ltd., Team17","Team17","Multiplayer,Online Co-Op,Local Co-Op,Casual,Co-op,Funny,Indie,Action,4 Player Local,Local Multiplayer,Family Friendly,Cute,Controller,Comedy,Cooking,Singleplayer,Difficult,Simulation,Colorful,Strategy,+"
"Batman™: Arkham Knight","Jun 23 2015","1999.0","Batman™: Arkham Knight brings the award-winning Arkham trilogy from Rocksteady Studios to its epic conclusion. Developed exclusively for New-Gen platforms, Batman: Arkham Knight introduces Rocksteady's uniquely designed version of the Batmobile.","Very Positive","(1,262)","Rocksteady Studios","Warner Bros. Interactive Entertainment","Action,Open World,Superhero,Stealth,Adventure,Third Person,Singleplayer,Detective,Fighting,Story Rich,Atmospheric,Dark,Comic Book,Beat 'em up,Puzzle,Mature,Strategy,Sandbox,Horror,Epic,+"
"STAR WARS™: The Old Republic™  - Subscriptions","Jul 21 2020","1499.0","None","Overwhelmingly Negative","(135)","BioWare","Electronic Arts","Massively Multiplayer,MMORPG,+"
"Fallout New Vegas Ultimate","Feb 7 2012","1999.0","NA","NA","NA","NA","NA","NA"
"The Sims™ 4 Get Together","Jun 18 2020","1999.0","None","Mixed","(47)","Maxis","Electronic Arts","Simulation,+"
"DayZ Livonia Edition","","5308.0","NA","NA","NA","NA","NA","NA"
"Car Mechanic Simulator 2021","Aug 11 2021","2499.0","Work your way to a service empire. Get your hands dirty in a highly realistic simulation game that pays major attention to details. Pay a visit to a new Auction house and buy cars in various conditions. Expand your range of services by investing in a new work space and equipment.","Overwhelmingly Positive","(509)","Red Dot Games","PlayWay S.A.","Simulation,Automobile Sim,Sandbox,Racing,Realistic,Moddable,3D,Immersive Sim,Driving,First-Person,Puzzle,Education,Singleplayer,Atmospheric,Adventure,Open World,Minigames,Strategy,Indie,Great Soundtrack,+"
"Resident Evil 5","Sep 15 2009","499.0","This game is a port of the Games for Windows - Live version that was released in 2009. If you buy the Untold Stories Bundle here on Steam, it will be the same as upgrading to Resident Evil 5 Gold Edition.","Very Positive","(250)","Capcom","Capcom","Action,Zombies,Co-op,Third-Person Shooter,Horror,Co-op Campaign,Online Co-Op,Adventure,Multiplayer,Third Person,Survival Horror,Shooter,Singleplayer,Local Co-Op,Female Protagonist,Quick-Time Events,Survival,Gore,Atmospheric,3D Vision,+"
"Age of Empires II: Definitive Edition","Nov 14 2019","1999.0","Age of Empires II: Definitive Edition features “The Last Khans” with 3 new campaigns and 4 new Civilizations. Frequent updates include events, additional content, new game modes, and enhanced features with the recent addition of Co-Op mode!","Overwhelmingly Positive","(1,309)","Forgotten Empires, Tantalus Media, Wicked Witch","Xbox Game Studios","Strategy,RTS,City Builder,Multiplayer,Base Building,Historical,Medieval,Singleplayer,Classic,Resource Management,Tactical,Real-Time,Remake,Co-op,Action,Replay Value,Isometric,2D,Adventure,Great Soundtrack,+"
"Demon Slayer -Kimetsu no Yaiba- The Hinokami Chronicles","Oct 15 2021","5999.0","Become the Blade that Destroys Demons!","Very Positive","(725)","CyberConnect2","SEGA","Anime,Action,Adventure,3D Fighter,Action-Adventure,3D,2D Fighter,Demons,Cartoon,Cinematic,Colorful,Comic Book,PvP,Drama,Emotional,Combat,Foreign,Multiplayer,Controller,Quick-Time Events,+"
"South Park™: The Fractured But Whole™","Oct 16 2017","1249.0","From the creators of South Park, Trey Parker and Matt Stone, comes South Park: The Fractured But Whole, a sequel to 2014's award-winning South Park: The Stick of Truth.","Very Positive","(233)","Ubisoft San Francisco","Ubisoft","RPG,Comedy,Dark Humor,Funny,Superhero,Singleplayer,Mature,Turn-Based,Memes,Cartoon,Adventure,Story Rich,Nudity,Open World,Satire,Action,2D,Sexual Content,Illuminati,Atmospheric,+"
"Remnant: From the Ashes","Aug 20 2019","1599.0","The world has been thrown into chaos by an ancient evil from another dimension. As one of the last remnants of humanity, you must set out alone or alongside up to two other survivors to face down hordes of deadly enemies to try to carve a foothold, rebuild, and retake what was lost.","Very Positive","(186)","Gunfire Games","Perfect World Entertainment","Souls-like,Action,RPG,Adventure,Co-op,Third-Person Shooter,Multiplayer,Online Co-Op,Shooter,Post-apocalyptic,Survival,Difficult,Singleplayer,Lovecraftian,Violent,Dark Fantasy,Replay Value,Horror,Procedural Generation,Atmospheric,+"
"Subnautica: Below Zero","May 14 2021","2999.0","Dive into a freezing underwater adventure on an alien planet. Below Zero is set two years after the original Subnautica. Return to Planet 4546B to uncover the truth behind a deadly cover-up. Survive by building habitats, crafting tools, & diving deeper into the world of Subnautica.","Very Positive","(820)","Unknown Worlds Entertainment","Unknown Worlds Entertainment","Open World Survival Craft,Survival,Underwater,Open World,Singleplayer,Exploration,Adventure,Base Building,Horror,Crafting,First-Person,Aliens,Survival Horror,Sci-fi,Early Access,Story Rich,Atmospheric,Great Soundtrack,Sandbox,Multiplayer,+"
"The Legend of Heroes: Trails of Cold Steel II","Feb 14 2018","1999.0","Civil war has broken out across Erebonia. After his narrow escape from Trista, Rean will take up his sword again on a journey with his Divine Knight, Valimar, in search of his friends from Class VII and a way to end the conflict before its price becomes far too dear...","Very Positive","(17)","Nihon Falcom","XSEED Games, Marvelous USA, Inc.","JRPG,RPG,Anime,Story Rich,Great Soundtrack,Turn-Based,Singleplayer,Mechs,Fantasy,Romance,Turn-Based Combat,Adventure,+"
"Among Us","Nov 16 2018","499.0","An online and local party game of teamwork and betrayal for 4-15 players...in space!","Very Positive","(4,374)","Innersloth","Innersloth","Multiplayer,Social Deduction,Online Co-Op,Space,Survival,2D,Funny,Psychological,Co-op,Cartoony,Party Game,Local Multiplayer,Casual,Action,Sci-fi,PvP,Colorful,Minigames,Aliens,Top-Down,+"
"Gunfire Reborn","Nov 18 2021","1999.0","Gunfire Reborn is a level-based adventure game featuring FPS, Roguelite and RPG. Players can control heroes with various abilities to experience diverse Build gameplay, use various weapons to explore procedurally-generated levels. You can play the game alone, or join 4-player coop.","Very Positive","(747)","Duoyi Games","Duoyi Games","FPS,Co-op,Roguelite,Online Co-Op,Roguelike,Multiplayer,Indie,Action,Looter Shooter,Adventure,RPG,Early Access,Shooter,Action Roguelike,First-Person,Dungeon Crawler,Replay Value,Singleplayer,Fast-Paced,Souls-like,+"
"L.A. Noire","Nov 8 2011","599.0","L.A. Noire is a violent crime thriller that blends breathtaking action with true detective work to deliver an unprecedented interactive experience. This complete edition of L.A. Noire includes the complete original game and all previously released downloadable content.","Mostly Positive","(333)","Team Bondi, Rockstar Leeds","Rockstar Games","Detective,Crime,Open World,Noir,Adventure,Story Rich,Mystery,Third Person,Investigation,Cinematic,Singleplayer,Action,Atmospheric,Mature,Nudity,Strategy,Puzzle,Third-Person Shooter,Thriller,3D Vision,+"
"Persona 4 Golden","Jun 13 2020","1999.0","A coming of age story that sets the protagonist and his friends on a journey kickstarted by a chain of serial murders.","Overwhelmingly Positive","(571)","ATLUS","SEGA","JRPG,Great Soundtrack,Story Rich,Anime,Turn-Based Combat,RPG,Singleplayer,Party-Based RPG,Mystery,Turn-Based Strategy,Emotional,Multiple Endings,Detective,Colorful,Dating Sim,Adventure,Strategy,Visual Novel,Violent,Sexual Content,+"
"Escape Simulator","Oct 19 2021","1499.0","First-person puzzler you can play solo or in an online co-op (best with 2-3 players, but playable with more). Explore a set of highly interactive escape rooms. Move furniture, pick up and examine everything, smash pots and break locks! Supports community rooms through the level editor.","Very Positive","(406)","Pine Studio","Pine Studio","Puzzle,Co-op,Multiplayer,Escape Room,Mystery,First-Person,Exploration,Singleplayer,Point & Click,Investigation,Simulation,Online Co-Op,Story Rich,Level Editor,Indie,Walking Simulator,Atmospheric,Casual,Character Customization,Controller,+"
"Yakuza 5 Remastered","Jan 28 2021","1299.0","Get ready for a Yakuza experience of unprecedented scale! Follow five characters across five Japanese cities, each trying to achieve their dream. The connections between them bring them together, but the conflict that unfolds is nothing any of them could have predicted.","Very Positive","(87)","Ryu Ga Gotoku Studio","SEGA","Action,Adventure,Beat 'em up,Open World,RPG,Action RPG,Crime,Third Person,Drama,Comedy,Story Rich,JRPG,Violent,Funny,Sexual Content,Singleplayer,Anime,Combat,Great Soundtrack,Rhythm,+"
"Back 4 Blood","Oct 12 2021","5999.0","Back 4 Blood is a thrilling cooperative first-person shooter from the creators of the critically acclaimed Left 4 Dead franchise. Experience the intense 4 player co-op narrative campaign, competitive multiplayer as human or Ridden, and frenetic gameplay that keeps you in the action.","Mixed","(661)","Turtle Rock Studios","Warner Bros. Games, Warner Bros. Interactive Entertainment","Zombies,Online Co-Op,Action,Multiplayer,Shooter,FPS,Co-op,Gore,First-Person,Horror,Singleplayer,Blood,Violent,Survival,Adventure,PvP,Survival Horror,PvE,Roguelite,Replay Value,+"
"Slime Rancher","Aug 1 2017","1999.0","Slime Rancher is the tale of Beatrix LeBeau, a plucky, young rancher who sets out for a life a thousand light years away from Earth on the ‘Far, Far Range’ where she tries her hand at making a living wrangling slimes.","Overwhelmingly Positive","(1,363)","Monomi Park","Monomi Park","Cute,Exploration,Adventure,Singleplayer,Open World,First-Person,Colorful,Funny,Sandbox,Simulation,Casual,Fantasy,Management,Indie,Family Friendly,Great Soundtrack,Female Protagonist,Early Access,Action,FPS,+"
"Planet Zoo","Nov 5 2019","4499.0","Build a world for wildlife in Planet Zoo. From the developers of Planet Coaster and Zoo Tycoon comes the ultimate zoo sim. Construct detailed habitats, manage your zoo, and meet authentic living animals who think, feel and explore the world you create around them.","Very Positive","(788)","Frontier Developments","Frontier Developments","Management,Simulation,Building,Sandbox,Nature,City Builder,Economy,Realistic,Family Friendly,Singleplayer,Resource Management,Cute,Great Soundtrack,Strategy,Relaxing,Open World,Funny,Casual,Multiplayer,Horses,+"
"DCS: AH-64D","Mar 31 2022","5599.0","None","['No user reviews']","0","Eagle Dynamics SA","Eagle Dynamics SA","Simulation,Free to Play,Flight,Realistic,+"
"Fallout 4","Nov 10 2015","1999.0","Bethesda Game Studios, the award-winning creators of Fallout 3 and The Elder Scrolls V: Skyrim, welcome you to the world of Fallout 4 – their most ambitious game ever, and the next generation of open-world gaming.","Very Positive","(1,894)","Bethesda Game Studios","Bethesda Softworks","Open World,Post-apocalyptic,Exploration,Singleplayer,RPG,Atmospheric,Adventure,Shooter,First-Person,Story Rich,Action,Sci-fi,FPS,Action RPG,Sandbox,Great Soundtrack,Third Person,Survival,Third-Person Shooter,Casual,+"
"Space Engineers","Feb 28 2019","1999.0","Space Engineers is a sandbox game about engineering, construction, exploration and survival in space and on planets. Players build space ships, space stations, planetary outposts of various sizes and uses, pilot ships and travel through space to explore planets and gather resources to survive.","Very Positive","(412)","Keen Software House","Keen Software House","Space,Sandbox,Building,Multiplayer,Open World Survival Craft,Simulation,Survival,Open World,Physics,Crafting,Destruction,Co-op,Indie,Futuristic,Sci-fi,Singleplayer,Action,Strategy,Adventure,Early Access,+"
"Ravenfield","May 18 2017","1499.0","Fight upon the Ravenfield together with your Blue allies! Take down those pesky Reds using helicopters, tanks, guns, and active ragdoll physics!","Overwhelmingly Positive","(1,116)","SteelRaven7","SteelRaven7","FPS,War,Singleplayer,Shooter,Action,Military,First-Person,Early Access,Sandbox,Funny,Team-Based,Strategy,Indie,Tactical,Physics,Simulation,Moddable,Realistic,Atmospheric,Adventure,+"
"Sid Meier's Civilization® VI: Gathering Storm","Feb 14 2019","3999.0","None","Mixed","(20)","Firaxis Games, Aspyr (Mac), Aspyr (Linux)","2K, Aspyr (Mac), Aspyr (Linux)","Strategy,Turn-Based,Grand Strategy,City Builder,Multiplayer,Turn-Based Strategy,4X,Historical,Singleplayer,Simulation,+"
"Jurassic World Evolution 2: Camp Cretaceous Dinosaur Pack","Mar 8 2022","999.0","None","Mostly Positive","(48)","Frontier Developments","Frontier Developments","Simulation,Strategy,Action,Casual,Dinosaurs,Building,Singleplayer,Survival,Open World,Sandbox,Sci-fi,Historical,Atmospheric,City Builder,Violent,Economy,Sequel,Management,Resource Management,+"
"Resident Evil 7 - Season Pass","Jan 24 2017","1199.0","NA","NA","NA","NA","NA","NA"
"SPORE™","Dec 19 2008","499.0","Be the architect of your own universe with Spore, an exciting single-player adventure. From Single Cell to Galactic God, evolve your creature in a universe of your own creations.","Very Positive","(756)","Maxis™","Electronic Arts","God Game,Open World,Exploration,Casual,Colony Sim,Sandbox,Cute,Simulation,Space,Science,Funny,Sci-fi,Aliens,Colorful,Cartoony,Family Friendly,Adventure,Comedy,Resource Management,Cartoon,+"
"Cities: Skylines - Airports","Jan 25 2022","1299.0","None","Mixed","(34)","Colossal Order Ltd.","Paradox Interactive","Simulation,Strategy,City Builder,+"
"The Sims™ 4 Vampires","Jun 18 2020","1399.0","None","Mixed","(116)","Maxis","Electronic Arts","Simulation,Casual,Singleplayer,Life Sim,Experience,Gaming,Funny,Character Customization,Building,Story Rich,Colorful,Atmospheric,Realistic,Cute,Emotional,Vampire,+"
"Warhammer: Vermintide 2 - Content Bundle","","4354.0","NA","NA","NA","NA","NA","NA"
"The Isle","Dec 2 2015","1999.0","Experience fierce open world survival gameplay as you attempt to stay alive on an unforgiving island inhabited by dinosaurs! Hunt. Grow. Survive.","Very Positive","(899)","Afterthought LLC","Afterthought LLC","Dinosaurs,Survival,Open World,Multiplayer,Simulation,Hunting,Massively Multiplayer,Adventure,Realistic,Early Access,Action,Third Person,Co-op,Sandbox,Walking Simulator,Indie,Strategy,Team-Based,Horror,RPG,+"
"Days Gone","May 18 2021","4999.0","Ride and fight into a deadly, post pandemic America. Play as Deacon St. John, a drifter and bounty hunter who rides the broken road, fighting to survive while searching for a reason to live in this open-world action-adventure game.","Very Positive","(724)","Bend Studio","PlayStation PC LLC","Open World,Zombies,Post-apocalyptic,Singleplayer,Survival,Action,Action-Adventure,Third Person,Multiplayer,Adventure,Horror,Open World Survival Craft,Motorbike,Story Rich,Crafting,Survival Horror,Third-Person Shooter,Cinematic,Gore,Violent,+"
"Yakuza 4 Remastered","Jan 28 2021","1299.0","When a dark secret brings a loan shark, a death-row inmate, a corrupt cop and the legendary yakuza Kazuma Kiryu together the resulting war in Kamurocho might level the district to the ground.","Very Positive","(66)","Ryu Ga Gotoku Studio","SEGA","Action,Adventure,RPG,Open World,Beat 'em up,Action RPG,Third Person,Comedy,Crime,Drama,JRPG,Violent,Singleplayer,Story Rich,Sexual Content,Funny,Anime,Combat,Great Soundtrack,+"
"Pummel Party","Sep 20 2018","1499.0","Pummel Party is a 4-8 player online and local-multiplayer party game. Pummel friends or AI using a wide array of absurd items in the board mode and compete to destroy friendships in the unique collection of minigames.","Very Positive","(508)","Rebuilt Games","Rebuilt Games","Multiplayer,Funny,Online Co-Op,4 Player Local,Board Game,Casual,Co-op,Local Multiplayer,Minigames,Indie,Action,Local Co-Op,Party,Party Game,Comedy,Tabletop,Controller,Colorful,Gore,Singleplayer,+"
"NEBULOUS: Fleet Command","Feb 11 2022","1999.0","Take command of your hand-tailored fleet of space warships and use realistic radar, electronic warfare, advanced movement controls in 3D space, and precision targeting to outmaneuver and outwit your opponents in a simulation-heavy tactical space game like no other.","Overwhelmingly Positive","(598)","Eridanus Industries","Eridanus Industries","Early Access,Strategy,Simulation,Real Time Tactics,Space,Naval,3D,RTS,Sci-fi,Military,Futuristic,Tactical,PvP,Naval Combat,Multiplayer,Singleplayer,Stealth,Atmospheric,Submarine,Team-Based,+"
"Across the Obelisk","Apr 8 2021","1599.0","Across the Obelisk is a coop RPG deckbuilding roguelite. Play solo or with your friends, choose your heroes, unlock items and cards, craft your deck and face powerful enemies in deep tactical combat. Would you dare to go across the obelisk?","Very Positive","(48)","Dreamsite Games","Dreamsite Games","Early Access,Roguelike Deckbuilder,Card Battler,Co-op,Card Game,Roguelike,RPG,Deckbuilding,Roguelite,Difficult,Turn-Based,Turn-Based Combat,Fantasy,Choices Matter,Replay Value,Turn-Based Tactics,Singleplayer,Procedural Generation,2D,Strategy,+"
"Utawarerumono: Mask of Deception","Jan 23 2020","999.0","You awaken in a field of snow with no memory of even your name. The local monstrosities nearly devour you before you meet your rescuer, a beautiful girl named Kuon—who has animal ears and a tail. She names you Haku⸺ The Japanese hit tactics-RPG visual novel series returns to PC at last!","Very Positive","(16)","AQUAPLUS","DMM GAMES, Shiravune","Visual Novel,RPG,Strategy,Anime,Adventure,Sexual Content,Nudity,Simulation,Great Soundtrack,Turn-Based Tactics,Tactical RPG,JRPG,Gore,Violent,Mature,3D,Story Rich,+"
"Resident Evil 6","Mar 21 2013","749.0","Blending action and survival horror, Resident Evil 6 promises to be the dramatic horror experience of 2013.","Very Positive","(504)","Capcom","Capcom","Action,Zombies,Co-op,Third-Person Shooter,Horror,Co-op Campaign,Adventure,Online Co-Op,Multiplayer,Third Person,Shooter,Quick-Time Events,Split Screen,Local Co-Op,Survival Horror,Survival,Singleplayer,Atmospheric,Female Protagonist,Casual,+"
"Don't Starve Together","Apr 21 2016","1499.0","Fight, Farm, Build and Explore Together in the standalone multiplayer expansion to the uncompromising wilderness survival game, Don't Starve.","Overwhelmingly Positive","(3,009)","Klei Entertainment","Klei Entertainment","Survival,Open World Survival Craft,Multiplayer,Co-op,Open World,Adventure,Crafting,Online Co-Op,Sandbox,Difficult,Indie,2D,Funny,Atmospheric,Survival Horror,Strategy,Singleplayer,Horror,Action,Simulation,+"
"Dragon Age: Origins - Ultimate Edition","Oct 27 2010","479.0","Dragon Age: Origins - Ultimate Edition includes Dragon Age: Origins, Dragon Age: Origins - Awakening and all nine content packs.","Very Positive","(205)","BioWare","Electronic Arts","RPG,Fantasy,Story Rich,Singleplayer,Choices Matter,Party-Based RPG,Real-Time with Pause,Mature,Character Customization,Adventure,Multiple Endings,Well-Written,Strategy,Dark Fantasy,Dragons,Female Protagonist,Classic,Open World,Tactical,Moddable,+"
"GRANDIA HD Remaster","Oct 15 2019","999.0","GRANDIA HD Remaster brings enhanced visuals to both gameplay and cinematic videos.","Very Positive","(10)","GAME ARTS, Sickhead Games, LLC","GungHo Online Entertainment America, Inc.","Adventure,RPG,JRPG,Classic,Anime,Turn-Based Combat,Story Rich,Great Soundtrack,Singleplayer,+"
"Who's Your Daddy?!","May 13 2016","499.0","Who's Your Daddy is a casual multiplayer game featuring a clueless father attempting to prevent his infant son from certain death. Play with up to 7 of your friends, and test your parenting skills in a competitive setup with wacky physics and over 67 potentially ominous household items.","Very Positive","(459)","Evil Tortilla Games","Evil Tortilla Games","Funny,Multiplayer,First-Person,Comedy,Simulation,Strategy,Online Co-Op,Dark Humor,Casual,Co-op,Indie,Action,Early Access,Split Screen,Difficult,Survival,Sandbox,Third Person,Adventure,Singleplayer,+"
"Assetto Corsa","Dec 19 2014","1999.0","Assetto Corsa v1.16 introduces the new "Laguna Seca" laser-scanned track, 7 new cars among which the eagerly awaited Alfa Romeo Giulia Quadrifoglio! Check the changelog for further info!","Very Positive","(1,118)","Kunos Simulazioni","Kunos Simulazioni","Racing,Automobile Sim,Simulation,Driving,Realistic,Multiplayer,VR,Sports,Moddable,Controller,Physics,Singleplayer,Open World,First-Person,Indie,Replay Value,Action,3D Vision,TrackIR,Artificial Intelligence,+"
"Fallout 1st","Apr 14 2020","1299.0","None","Mostly Negative","(23)","Bethesda Game Studios","Bethesda Softworks","Capitalism,Dark Comedy,Comedy,Dark Humor,Horror,Crime,Funny,Parody,Hentai,Illuminati,Sexual Content,Gore,Early Access,Nudity,RPG,Violent,Post-apocalyptic,Pixel Graphics,Female Protagonist,Free to Play,+"
"Capcom Arcade Stadium Packs 1, 2, and 3 – Mini-Album Bundle","May 25 2021","3630.0","NA","NA","NA","NA","NA","NA"
"Valve Index® Replacement Right Controller","Jun 28 2019","14900.0","NA","NA","NA","NA","NA","NA"
"XCOM: Ultimate Collection","","1992.0","NA","NA","NA","NA","NA","NA"
"Stranded Deep","Jan 23 2015","1499.0","Take the role of a plane crash survivor stranded somewhere in the Pacific Ocean. Come face to face with some of the most life threatening scenarios that will result in a different experience each time you play. Scavenge. Discover. Survive.","Mostly Positive","(393)","Beam Team Games","Beam Team Publishing","Open World Survival Craft,Survival,Multiplayer,Open World,Crafting,First-Person,Adventure,Exploration,Realistic,Singleplayer,Building,Sandbox,Co-op,Simulation,Early Access,Underwater,Action,Atmospheric,Indie,Strategy,+"
"World War 3 - Lieutenant upgrade","Nov 24 2021","2000.0","None","Mixed","(32)","The Farm 51","MY.GAMES, The 4 Winds","Action,Indie,Early Access,+"
"DOOM Eternal Standard Edition","Mar 20 2020","3999.0","NA","NA","NA","NA","NA","NA"
"Stick Fight: The Game","Sep 28 2017","499.0","Stick Fight is a physics-based couch/online fighting game where you battle it out as the iconic stick figures from the golden age of the internet.","Overwhelmingly Positive","(1,421)","Landfall West","Landfall","Multiplayer,Funny,Fighting,Action,Local Multiplayer,2D Fighter,4 Player Local,PvP,2D,Casual,Physics,Indie,Online Co-Op,Shooter,Local Co-Op,Controller,Co-op,Great Soundtrack,Split Screen,Strategy,+"
"Shin Megami Tensei III Nocturne HD Remaster","May 21 2021","2999.0","Reawaken your inner demon in a modernized version of the acclaimed ATLUS classic, Shin Megami Tensei III Nocturne HD Remaster.","Very Positive","(42)","ATLUS","SEGA","JRPG,RPG,Creature Collector,Party-Based RPG,Demons,Atmospheric,Dark,Turn-Based Strategy,Strategy RPG,Post-apocalyptic,Anime,Mythology,Dystopian,Choices Matter,Fantasy,Multiple Endings,Turn-Based Combat,Controller,Conversation,Story Rich,+"
"Destiny 2: Shadowkeep","Oct 1 2019","2499.0","None","Very Negative","(63)","Bungie","Bungie","Adventure,Action,Looter Shooter,FPS,First-Person,MMORPG,Loot,Lore-Rich,Online Co-Op,Space,Great Soundtrack,Shooter,Co-op,Massively Multiplayer,Sci-fi,Atmospheric,Singleplayer,Open World,Competitive,Multiplayer,+"
"Utawarerumono: Mask of Truth","Jan 23 2020","999.0","Haku has sacrificed a lot to inherit a mask. With his natural wiles and the reputation of his departed friend, he strikes out on the path to a new future. The curtains rise on an era of strife that will shake Yamato to its very foundations.","Very Positive","(23)","AQUAPLUS","DMM GAMES, Shiravune","RPG,Strategy,Adventure,Simulation,Visual Novel,Anime,Turn-Based Tactics,Great Soundtrack,Sexual Content,Nudity,Tactical RPG,Story Rich,Violent,JRPG,Gore,3D,+"
"Cities: Skylines Collection","","24900.0","NA","NA","NA","NA","NA","NA"
"TaleSpire","Apr 15 2021","2499.0","TaleSpire is a beautiful way to play pen and paper RPGs online. Bring your stories to life and embark upon campaigns together with your friends, regardless of where you are in the world.","Very Positive","(88)","Bouncyrock Entertainment","Bouncyrock Entertainment","Tabletop,RPG,Dungeons & Dragons,Level Editor,Online Co-Op,Building,Board Game,Simulation,Indie,Early Access,Multiplayer,CRPG,Sandbox,Fantasy,Party-Based RPG,3D,Exploration,Third Person,Atmospheric,Dark Fantasy,+"
"Assetto Corsa Ultimate Edition","","3988.0","NA","NA","NA","NA","NA","NA"
