title_name,realease_date,price,description,title_review,title_rating,developer,publisher,game_tags
"Unpacking","Nov 2 2021","1999.0","Unpacking is a zen puzzle game about the familiar experience of pulling possessions out of boxes and fitting them into a new home. Part block-fitting puzzle, part home decoration, you are invited to create a satisfying living space while learning clues about the life you’re unpacking.","Very Positive","(1,094)","Witch Beam","Humble Games","Relaxing,Story Rich,Pixel Graphics,Cute,Casual,Simulation,Life Sim,Puzzle,Indie,Atmospheric,Singleplayer,Isometric,Female Protagonist,Family Friendly,Point & Click,Colorful,Inventory Management,Hidden Object,Experimental,2D,+"
"Wallpaper Engine","Nov 2018Nov 2018","399.0","Use stunning live wallpapers on your desktop. Animate your own images to create new wallpapers or import videos/websites and share them on the Steam Workshop!","Overwhelmingly Positive","(11,432)","Wallpaper Engine Team","Wallpaper Engine Team","Mature,Utilities,Software,Anime,Design & Illustration,Animation & Modeling,Casual,Memes,Indie,Cute,Early Access,Action,Funny,NSFW,Singleplayer,Music,Sandbox,Photo Editing,Game Development,Horror,+"
"Spellcaster University","Jun 15 2021","2499.0","Develop a prestigious university of mages. Build rooms, train your students, fight orcs, slay the bureaucrats, manage your budget... a director's life is not a quiet one.","Very Positive","(42)","Sneaky Yak Studio","Sneaky Yak Studio, WhisperGames","Simulation,Strategy,Magic,Management,Fantasy,Singleplayer,Card Game,Indie,Cute,Medieval,Building,Economy,Replay Value,Crowdfunded,3D,Kickstarter,Early Access,+"
"Destiny 2: The Witch Queen Deluxe Edition Upgrade","Feb 22 2022","3999.0","None","Positive","(13)","Bungie","Bungie","Action,Adventure,Free to Play,Hentai,+"
"Sid Meier's Civilization VI : Platinum Edition","","1503.0","NA","NA","NA","NA","NA","NA"
"FINAL FANTASY XV EPISODE ARDYN COMPLETE EDITION","","1998.0","NA","NA","NA","NA","NA","NA"
"Hearts of Iron IV","Jun 6 2016","3999.0","Victory is at your fingertips! Your ability to lead your nation is your supreme weapon, the strategy game Hearts of Iron IV lets you take command of any nation in World War II; the most engaging conflict in world history.","Very Positive","(3,710)","Paradox Development Studio","Paradox Interactive","Strategy,World War II,Grand Strategy,Historical,War,Military,Alternate History,Multiplayer,Simulation,Tactical,Real-Time with Pause,RTS,Singleplayer,Diplomacy,Sandbox,Co-op,Great Soundtrack,Open World,Action,Casual,+"
"Hunt: Showdown - Moonrise Bundle","","2965.0","NA","NA","NA","NA","NA","NA"
"FINAL FANTASY X/X-2 HD Remaster","May 12 2016","1499.0","FINAL FANTASY X/X-2 HD Remaster celebrates two of the most cherished and beloved entries to the world-renowned franchise, completely remastered in gorgeous High Definition & now available on PC / Windows!","Very Positive","(128)","Square Enix","Square Enix","JRPG,Story Rich,RPG,Turn-Based Combat,Great Soundtrack,Fantasy,Singleplayer,Classic,Adventure,Turn-Based,Atmospheric,Romance,Female Protagonist,Anime,Action,Open World,Remake,Linear,Sports,Puzzle,+"
"GTFO","Dec 10 2021","3999.0","GTFO is an extreme cooperative horror shooter that throws you from gripping suspense to explosive action in a heartbeat. Stealth, strategy, and teamwork are necessary to survive in your deadly, underground prison. Work together or die together.","Very Positive","(299)","10 Chambers","10 Chambers","Online Co-Op,Horror,Co-op,FPS,Shooter,Difficult,Survival Horror,Multiplayer,Action,Stealth,Tactical,Team-Based,Gore,First-Person,Character Customization,Violent,PvE,Zombies,Atmospheric,Replay Value,+"
"Prison Architect - Total Lockdown","","3332.0","NA","NA","NA","NA","NA","NA"
"Apex Legends™ - Champion Edition","Nov 5 2020","2799.0","None","Very Positive","(21)","Respawn Entertainment","Electronic Arts","Action,Adventure,Battle Royale,Multiplayer,FPS,Shooter,First-Person,+"
"Cities: Skylines - Mass Transit","May 18 2017","649.0","None","Very Positive","(795)","Colossal Order Ltd.","Paradox Interactive","Simulation,Strategy,City Builder,Sandbox,+"
"The Elder Scrolls V: Skyrim Special Edition","Oct 28 2016","3999.0","Winner of more than 200 Game of the Year Awards, Skyrim Special Edition brings the epic fantasy to life in stunning detail. The Special Edition includes the critically acclaimed game and add-ons with all-new features like remastered art and effects, volumetric god rays, dynamic depth of field, screen-space reflections, and more.","Very Positive","(1,772)","Bethesda Game Studios","Bethesda Softworks","Open World,RPG,Adventure,Singleplayer,Fantasy,Character Customization,Dragons,Moddable,Story Rich,Magic,First-Person,Action,Atmospheric,Great Soundtrack,Third Person,Stealth,Classic,Remake,Female Protagonist,Walking Simulator,+"
"Forts - High Seas","Mar 25 2022","799.0","NA","NA","NA","NA","NA","NA"
"The Elder Scrolls V: Skyrim Anniversary Edition","Nov 11 2021","4999.0","NA","NA","NA","NA","NA","NA"
"Shadow of the Tomb Raider: Definitive Edition","","1305.0","NA","NA","NA","NA","NA","NA"
"The Jackbox Party Pack 8","Oct 14 2021","2999.0","Plan your next game night! Jackbox Games is back with 5 hilarious new party games including Drawful Animate, Job Job, The Poll Mine, Weapons Drawn, and The Wheel of Enormous Proportions.","Very Positive","(22)","Jackbox Games, Inc.","Jackbox Games, Inc.","Party Game,Comedy,Family Friendly,Trivia,Colorful,Indie,Word Game,Funny,Cartoon,2D,Local Multiplayer,Local Co-Op,Team-Based,Casual,Multiplayer,+"
"BONEWORKS","Dec 10 2019","2999.0","BONEWORKS is an Experimental Physics VR Adventure. Use found physics weapons, tools, and objects to fight across dangerous playscapes and mysterious architecture.","Very Positive","(562)","Stress Level Zero","Stress Level Zero","VR,Physics,Action,Sandbox,Shooter,Adventure,Singleplayer,Puzzle,Great Soundtrack,First-Person,Simulation,Realistic,Indie,FPS,Violent,Parkour,Horror,Sci-fi,Gore,Funny,+"
"Inscryption","Oct 19 2021","1999.0","Inscryption is an inky black card-based odyssey that blends the deckbuilding roguelike, escape-room style puzzles, and psychological horror into a blood-laced smoothie. Darker still are the secrets inscrybed upon the cards...","Overwhelmingly Positive","(3,014)","Daniel Mullins Games","Devolver Digital","Card Battler,Card Game,Story Rich,Deckbuilding,Horror,Dark,Puzzle,Psychological,Roguelite,Strategy,Surreal,Roguelike,Experimental,Point & Click,First-Person,3D,2D,FMV,Pixel Graphics,Adventure,+"
"Cities: Skylines - Airports","Jan 25 2022","1299.0","None","Mostly Negative","(26)","Colossal Order Ltd.","Paradox Interactive","Simulation,Strategy,City Builder,+"
"METAL GEAR RISING: REVENGEANCE","Jan 9 2014","2999.0","Developed by Kojima Productions and PlatinumGames, METAL GEAR RISING: REVENGEANCE takes the renowned METAL GEAR franchise into exciting new territory with an all-new action experience. The game seamlessly melds pure action and epic story-telling that surrounds Raiden – a child soldier transformed into a half-human, half-cyborg ninja who...","Overwhelmingly Positive","(1,410)","PlatinumGames","Konami Digital Entertainment","Great Soundtrack,Action,Hack and Slash,Spectacle fighter,Swordplay,Character Action Game,Third Person,Singleplayer,Ninja,Fast-Paced,Cyberpunk,Gore,Sci-fi,Difficult,Story Rich,Replay Value,Mechs,Adventure,Beat 'em up,Stealth,+"
"Bloons TD 6","Dec 18 2018","999.0","The Bloons are back and better than ever! Get ready for a massive 3D tower defense game designed to give you hours and hours of the best strategy gaming available.","Overwhelmingly Positive","(5,144)","Ninja Kiwi","Ninja Kiwi","Tower Defense,Strategy,Multiplayer,Singleplayer,Co-op,Online Co-Op,Family Friendly,Casual,3D,Cartoony,Sandbox,Funny,Difficult,Great Soundtrack,Cute,Survival,Action,Indie,2D,Adventure,+"
"Persona 4 Arena Ultimax","Mar 17 2022","2999.0","A Persona 4 Smackdown!","Mostly Positive","(1,402)","Arc System Works, ATLUS","SEGA","Action,2D Fighter,Anime,Fighting,Story Rich,2D,Multiplayer,Great Soundtrack,Visual Novel,Singleplayer,JRPG,Sexual Content,+"
"VTOL VR","Aug 3 2017","2999.0","VTOL VR is a near-futuristic combat flight game built for Virtual Reality. Pilot advanced multi-role jets, using your hands to flip switches, press buttons, and manipulate the virtual flight controls.","Overwhelmingly Positive","(303)","Boundless Dynamics, LLC","Boundless Dynamics, LLC","Flight,VR,Combat,Simulation,Jet,Military,War,Action,Realistic,Physics,Vehicular Combat,Artificial Intelligence,Naval Combat,6DOF,Level Editor,Singleplayer,Futuristic,First-Person,Sandbox,Indie,+"
"Shredders","Mar 16 2022","2999.0","Break into the snowboarding event of the year in the hope of scoring a wildcard entry to an exclusive invitational. To prove you’re up to the challenge, master the art of park riding, buttering, rails and massive kickers and earn your place in the world of snowboarding.","Very Positive","(427)","FoamPunch","FoamPunch","Sports,Snowboarding,Multiplayer,Character Customization,Simulation,3D,Open World,Realistic,Online Co-Op,Singleplayer,Arcade,Controller,Co-op,Action,+"
"Batman: Arkham Collection","Nov 28 2018","5999.0","NA","NA","NA","NA","NA","NA"
"Sid Meier's Civilization® VI: Gathering Storm","Feb 14 2019","999.0","None","Mixed","(20)","Firaxis Games, Aspyr (Mac), Aspyr (Linux)","2K, Aspyr (Mac), Aspyr (Linux)","Strategy,Turn-Based,Grand Strategy,City Builder,Multiplayer,Turn-Based Strategy,4X,Historical,Singleplayer,Simulation,+"
"DEVOUR","Jan 28 2021","399.0","DEVOUR is a co-op horror survival game for 1-4 players. Stop possessed cultists before they drag you to hell. Run. Scream. Hide. Just don't get caught.","Very Positive","(1,721)","Straight Back Games","Straight Back Games","Horror,Online Co-Op,Multiplayer,Survival Horror,Co-op,Survival,Dark,First-Person,Indie,Atmospheric,Psychological Horror,Difficult,Singleplayer,Sexual Content,Puzzle,Stealth,Gore,Action,Violent,FPS,+"
"NBA 2K22","Sep 10 2021","5999.0","NBA 2K22 puts the entire basketball universe in your hands. Anyone, anywhere can hoop in NBA 2K22.","Mixed","(2,009)","Visual Concepts","2K","Sports,Basketball,Simulation,Realistic,eSports,Multiplayer,3D,Singleplayer,Team-Based,Management,Character Customization,Controller,Deckbuilding,Trading,4 Player Local,Co-op,Gambling,Local Co-Op,Local Multiplayer,Online Co-Op,+"
"FINAL FANTASY XIV Online - Complete Edition","","5598.0","NA","NA","NA","NA","NA","NA"
"Stellaris: Ultimate Bundle","","20235.0","NA","NA","NA","NA","NA","NA"
"CS:GO Prime Status Upgrade","Aug 21 2012","1499.0","Counter-Strike: Global Offensive (CS: GO) expands upon the team-based action gameplay that it pioneered when it was launched 19 years ago. CS: GO features new maps, characters, weapons, and game modes, and delivers updated versions of the classic CS content (de_dust2, etc.).","Very Positive","(75,764)","Valve, Hidden Path Entertainment","Valve","FPS,Shooter,Multiplayer,Competitive,Action,Team-Based,eSports,Tactical,First-Person,PvP,Online Co-Op,Co-op,Strategy,Military,War,Difficult,Trading,Realistic,Fast-Paced,Moddable,+"
"Sid Meier’s Civilization® VI: Rise and Fall","Feb 8 2018","989.0","None","Mixed","(10)","Firaxis Games, Aspyr (Mac), Aspyr (Linux)","2K, Aspyr (Mac), Aspyr (Linux)","Strategy,Turn-Based,4X,Multiplayer,Singleplayer,City Builder,+"
"The Elder Scrolls V: Skyrim VR","Apr 3 2018","5999.0","A true, full-length open-world game for VR has arrived from Bethesda Game Studios. Skyrim VR reimagines the complete epic fantasy masterpiece with an unparalleled sense of scale, depth, and immersion. Skyrim VR also includes all official add-ons.","Very Positive","(70)","Bethesda Game Studios","Bethesda Softworks","Open World,RPG,VR,Singleplayer,Adventure,Fantasy,Magic,First-Person,Action,Memes,Dragons,Moddable,Exploration,Great Soundtrack,Character Customization,Story Rich,Sexual Content,Atmospheric,Stealth,Walking Simulator,+"
"Insurgency: Sandstorm","Dec 12 2018","2999.0","Insurgency: Sandstorm is a team-based, tactical FPS based on lethal close quarters combat and objective-oriented multiplayer gameplay. Experience the intensity of modern combat where skill is rewarded, and teamwork wins the fight.","Very Positive","(1,189)","New World Interactive","Focus Home Interactive","FPS,Realistic,Shooter,Military,Multiplayer,Tactical,Action,First-Person,Online Co-Op,War,Co-op,Violent,Gore,Atmospheric,Difficult,Simulation,Open World,Massively Multiplayer,Indie,Choices Matter,+"
"Battlefield V","Oct 22 2020","1249.0","This is the ultimate Battlefield V experience. Enter mankind’s greatest conflict with the complete arsenal of weapons, vehicles, and gadgets plus the best customization content of Year 1 and 2.","Mixed","(3,423)","DICE","Electronic Arts","FPS,World War II,Shooter,Multiplayer,Singleplayer,War,Military,First-Person,PvP,Combat,Open World,Massively Multiplayer,Action,Historical,Destruction,Atmospheric,Battle Royale,Violent,Sexual Content,Female Protagonist,+"
"RimWorld - Ideology","Jul 20 2021","1999.0","None","Mostly Positive","(44)","Ludeon Studios","Ludeon Studios","Strategy,Indie,Simulation,Colony Sim,Base Building,Survival,+"
"Fallout 4: Game of the Year Edition","Nov 10 2015","3999.0","NA","NA","NA","NA","NA","NA"
"Blade and Sorcery","Dec 11 2018","1999.0","Blade & Sorcery is a built-for-VR medieval fantasy sandbox with full physics driven melee, ranged and magic combat. Become a powerful warrior, ranger or sorcerer and devastate your enemies.","Overwhelmingly Positive","(909)","WarpFrog","WarpFrog","VR,Action,Swordplay,Violent,Gore,Moddable,Simulation,Magic,Sandbox,Physics,Fighting,Adventure,Medieval,Singleplayer,Indie,RPG,Early Access,First-Person,Fantasy,Games Workshop,+"
"FINAL FANTASY XII THE ZODIAC AGE","Feb 1 2018","2499.0","FINAL FANTASY XII THE ZODIAC AGE - This revered classic returns, now fully remastered for the first time for PC, featuring all new and enhanced gameplay.","Very Positive","(66)","Square Enix","Square Enix","RPG,JRPG,Fantasy,Story Rich,Singleplayer,Great Soundtrack,Open World,Adventure,Exploration,Classic,Remake,Action,Turn-Based,Third Person,Female Protagonist,Anime,Atmospheric,Real-Time with Pause,Strategy,Party-Based RPG,+"
"The Sims™ 4 Cottage Living Expansion Pack","Jul 22 2021","1999.0","None","Very Positive","(11)","Maxis","Electronic Arts","Simulation,Casual,+"
"Crusader Kings III","Sep 1 2020","4999.0","Love, fight, scheme, and claim greatness. Determine your noble house’s legacy in the sprawling grand strategy of Crusader Kings III. Death is only the beginning as you guide your dynasty’s bloodline in the rich and larger-than-life simulation of the Middle Ages.","Very Positive","(1,082)","Paradox Development Studio","Paradox Interactive","Strategy,RPG,Simulation,Grand Strategy,Medieval,Historical,Political,War,Management,Singleplayer,Character Customization,Choices Matter,Multiplayer,Sandbox,Real-Time with Pause,Moddable,Sexual Content,PvP,Nudity,Dating Sim,+"
"F1® 2021","Jul 15 2021","1499.0","Every story has a beginning in F1® 2021, the official videogame of the 2021 FIA FORMULA ONE WORLD CHAMPIONSHIP™. Enjoy the stunning new features of F1® 2021, including the thrilling story experience ‘Braking Point’, two-player Career, and get even closer to the grid with ‘Real-Season Start’.","Very Positive","(1,633)","Codemasters","Electronic Arts","Racing,Sports,Immersive Sim,Driving,Automobile Sim,PvP,Controller,eSports,Split Screen,Simulation,3D,Realistic,Multiplayer,Co-op,Local Multiplayer,Cinematic,VR,Online Co-Op,Singleplayer,Arcade,+"
"Hero's Hour","Mar 1 2022","1799.0","A fast turn-based strategy RPG with real-time combat. Develop your cities and armies, level up your heroes to gain new, powerful spells and skills, and explore the wonders and dangers of the procedurally generated maps as you aim to conquer your enemies before they do the same to you.","Very Positive","(1,481)","Benjamin "ThingOnItsOwn" Hauer","Goblinz Publishing, Maple Whispering Limited","Local Co-Op,Strategy,Auto Battler,Turn-Based Strategy,Pixel Graphics,Fantasy,RPG,Turn-Based Tactics,Procedural Generation,Multiplayer,Singleplayer,Tactical,2D,Level Editor,PvP,Strategy RPG,Atmospheric,4X,Turn-Based,Grand Strategy,+"
"Surviving Mars","Mar 15 2018","599.0","There will be challenges to overcome. Execute your strategy and improve your colony’s chances of survival while unlocking the mysteries of this alien world. Are you ready? Mars is waiting for you.","Very Positive","(111)","Haemimont Games, Abstraction","Paradox Interactive","Colony Sim,City Builder,Strategy,Survival,Space,Base Building,Mars,Simulation,Sci-fi,Resource Management,Singleplayer,Building,Management,Sandbox,Space Sim,Futuristic,RTS,Open World,Great Soundtrack,Moddable,+"
"OUTRIDERS","Apr 1 2021","1979.0","Outriders’ brutal and bloody combat combines frenetic gunplay, violent powers and deep RPG systems to create a true genre hybrid.","Mixed","(168)","People Can Fly","Square Enix","RPG,Looter Shooter,Action,Co-op,Third-Person Shooter,Adventure,Multiplayer,Loot,Shooter,Gore,Singleplayer,Sci-fi,Online Co-Op,Violent,Open World,Character Customization,Third Person,Post-apocalyptic,Sexual Content,Souls-like,+"
"Prison Architect","Oct 6 2015","599.0","Only the world’s most ruthless Warden can contain the world’s most ruthless inmates. Design and develop your personalized penitentiary in Prison Architect.","Very Positive","(288)","Double Eleven, Introversion Software","Paradox Interactive","Simulation,Building,Sandbox,Strategy,Base Building,Colony Sim,Management,City Builder,2D,Top-Down,Economy,Resource Management,Singleplayer,Capitalism,Moddable,Funny,Multiplayer,Replay Value,Indie,Casual,+"
"Pummel Party","Sep 20 2018","1499.0","Pummel Party is a 4-8 player online and local-multiplayer party game. Pummel friends or AI using a wide array of absurd items in the board mode and compete to destroy friendships in the unique collection of minigames.","Very Positive","(526)","Rebuilt Games","Rebuilt Games","Multiplayer,Funny,Online Co-Op,4 Player Local,Board Game,Casual,Co-op,Local Multiplayer,Minigames,Indie,Action,Local Co-Op,Party,Party Game,Comedy,Tabletop,Controller,Colorful,Gore,Singleplayer,+"
"The Elder Scrolls V: Skyrim Anniversary Upgrade","Nov 11 2021","1999.0","None","Mixed","(70)","Bethesda Game Studios","Bethesda Softworks","RPG,Dystopian,Open World,Violent,Singleplayer,Fantasy,Illuminati,Great Soundtrack,Gore,Comedy,Adventure,Nudity,Horror,First-Person,Atmospheric,Story Rich,Sexual Content,Walking Simulator,Character Customization,Third Person,+"
"Forts","Apr 19 2017","749.0","Forts is a physics-based RTS where foes design and build custom bases, arm them to the teeth and blast their opponent's creations to rubble.","Very Positive","(320)","EarthWork Games","EarthWork Games","Base Building,Physics,Building,Multiplayer,Destruction,Strategy,Moddable,Sandbox,Memes,Action,2D,Funny,Level Editor,Military,Retro,Pixel Graphics,Singleplayer,Tactical,Indie,Lemmings,+"
"Fall Guys: Ultimate Knockout","Aug 4 2020","1999.0","NA","NA","NA","NA","NA","NA"
"Back 4 Blood","Oct 12 2021","5999.0","Back 4 Blood is a thrilling cooperative first-person shooter from the creators of the critically acclaimed Left 4 Dead franchise. Experience the intense 4 player co-op narrative campaign, competitive multiplayer as human or Ridden, and frenetic gameplay that keeps you in the action.","Mixed","(505)","Turtle Rock Studios","Warner Bros. Games, Warner Bros. Interactive Entertainment","Zombies,Online Co-Op,Multiplayer,Action,Shooter,FPS,Co-op,Gore,Horror,First-Person,Blood,Singleplayer,Violent,Survival,Adventure,PvP,Survival Horror,PvE,Roguelite,Replay Value,+"
"Portal 2","Apr 19 2011","999.0","The "Perpetual Testing Initiative" has been expanded to allow you to design co-op puzzles for you and your friends!","Overwhelmingly Positive","(3,347)","Valve","Valve","Platformer,Puzzle,Dark Humor,First-Person,Puzzle Platformer,Story Rich,Funny,Female Protagonist,3D Platformer,Action-Adventure,Action,FPS,Co-op,Physics,Level Editor,Sci-fi,Science,Comedy,Atmospheric,Adventure,+"
"Hunt: Showdown - Collector's Edition","","13016.0","NA","NA","NA","NA","NA","NA"
"Left 4 Dead 2","Nov 17 2009","999.0","Set in the zombie apocalypse, Left 4 Dead 2 (L4D2) is the highly anticipated sequel to the award-winning Left 4 Dead, the #1 co-op game of 2008. This co-operative action horror FPS takes you and your friends through the cities, swamps and cemeteries of the Deep South, from Savannah to New Orleans across five expansive campaigns.","Overwhelmingly Positive","(6,205)","Valve","Valve","Zombies,Co-op,FPS,Multiplayer,Shooter,Action,Online Co-Op,Survival,Horror,First-Person,Gore,Team-Based,Moddable,Survival Horror,Post-apocalyptic,Singleplayer,Adventure,Local Co-Op,Replay Value,Tactical,+"
"Surviving Mars: Complete Colony Bundle","","5165.0","NA","NA","NA","NA","NA","NA"
"Gang Beasts","Dec 12 2017","1999.0","Gang Beasts is a silly multiplayer party game with surly gelatinous characters, brutal slapstick fight sequences, and absurd hazardous environments, set in the mean streets of Beef City.","Very Positive","(548)","Boneloaf, Coatsink","Boneloaf","Funny,Physics,Multiplayer,Colorful,Party Game,Party,Local Multiplayer,Fighting,Comedy,3D Fighter,Casual,Soundtrack,4 Player Local,Co-op,Family Friendly,Beat 'em up,Memes,Third Person,Indie,Singleplayer,+"
"No Man's Sky","Aug 12 2016","5999.0","No Man's Sky is a game about exploration and survival in an infinite procedurally generated universe.","Very Positive","(1,178)","Hello Games","Hello Games","Open World,Open World Survival Craft,Space,Exploration,Sci-fi,Survival,Procedural Generation,Adventure,First-Person,Sandbox,Singleplayer,Multiplayer,Atmospheric,Crafting,Space Sim,Indie,Action,Simulation,FPS,Great Soundtrack,+"
"Oblivity - Find your perfect Sensitivity","Mar 24 2022","999.0","Oblivity is an advanced aim training software that provides everything you need to improve your aim! Find your perfect, intuitive mouse sensitivity with Oblivity's sensitivity finder. Or detect your bad aiming habits in the extensive analysis and replay space.","Mostly Positive","(194)","Poly Games","Poly Games","Action,Simulation,FPS,Indie,Shooter,Software Training,First-Person,eSports,Casual,Score Attack,Action-Adventure,Artificial Intelligence,Singleplayer,3D,Tutorial,Fast-Paced,Software,Competitive,Sniper,Arena Shooter,+"
"ARK: Genesis Season Pass","Aug 8 2019","2999.0","None","Mostly Positive","(34)","Studio Wildcard, Instinct Games, Efecto Studios, Virtual Basement LLC","Snail Games USA, Studio Wildcard","Adventure,Massively Multiplayer,Survival,Action,RPG,Open World,Indie,Dinosaurs,Multiplayer,Crafting,Base Building,Violent,Singleplayer,Sandbox,Building,Sci-fi,Open World Survival Craft,Co-op,Dragons,First-Person,+"
"Destiny 2: Beyond Light","Nov 10 2020","2999.0","NA","NA","NA","NA","NA","NA"
"BRAVELY DEFAULT II","Sep 2 2021","3599.0","A new entry in the “Bravely" series! Four new Heroes of Light emerge in a new world and story!","Mostly Positive","(51)","Square Enix, Claytechworks","Square Enix","RPG,JRPG,Turn-Based Combat,3D,Adventure,Cute,Linear,Story Rich,Fantasy,Singleplayer,Drama,Anime,Great Soundtrack,Female Protagonist,Class-Based,+"
"Totally Accurate Battle Simulator","Apr 1 2021","1999.0","Be the leader of wobblers from ancient lands, spooky places, and fantasy worlds. Watch them fight in simulations made with the wobbliest physics system ever created, make your own wobblers in the unit creator and send your army off to fight your friends in multiplayer.","Overwhelmingly Positive","(1,555)","Landfall","Landfall","Sandbox,Funny,Simulation,Physics,Singleplayer,Indie,Adventure,Realistic,War,Strategy,3D,Colorful,Fantasy,Comedy,Action,Memes,Casual,Historical,Medieval,Cute,+"
"Diplomacy is Not an Option","Feb 9 2022","2499.0","You were born a feudal lord. Sounds good, right? But you're bored of hunting, executions and tournaments. Even of feasts with beautiful maidens. The only dream left - your castle surrounded by hordes of enemies. You would waste no time on negotiation. This is your chance to show'em who is in charge.","Very Positive","(584)","Door 407","Door 407","City Builder,Tower Defense,Sandbox,Strategy,Building,Survival,RTS,Base Building,Procedural Generation,Colorful,Stylized,Singleplayer,Combat,Medieval,3D,Early Access,Action RTS,Indie,Violent,Action,+"
"Crusader Kings III: Royal Court","Sep 1 2020","2999.0","None","Mixed","(143)","Paradox Development Studio, Paradox Thalassic","Paradox Interactive","Strategy,Simulation,RPG,Medieval,+"
"The Binding of Isaac: Rebirth Complete Bundle","","5096.0","NA","NA","NA","NA","NA","NA"
"CHRONO CROSS: THE RADICAL DREAMERS EDITION","Apr 7 2022","1999.0","CHRONO CROSS is an RPG that transcends time and space, unfolding across two interlinked parallel worlds. With over 40 party members to meet, people and dimensions will intertwine in this epic drama about the planet itself.","['No user reviews']","0","Square Enix, D4Enterprise Co.,Ltd.","Square Enix","RPG,JRPG,Exploration,Party-Based RPG,Adventure,Story Rich,Puzzle,Fantasy,Magic,Sci-fi,Text-Based,Time Travel,Singleplayer,Drama,Nostalgia,Soundtrack,Great Soundtrack,Anime,Visual Novel,Classic,+"
"DayZ Livonia Edition","","5308.0","NA","NA","NA","NA","NA","NA"
"Need for Speed™ Heat","Jun 4 2020","1399.0","Hustle by day and risk it all at night in Need for Speed™ Heat Deluxe Edition, a white-knuckle street racer, where the lines of the law fade as the sun starts to set.","Very Positive","(808)","Ghost Games","Electronic Arts","Racing,Open World,Multiplayer,Driving,Action,Adventure,Singleplayer,Co-op,Atmospheric,Combat Racing,Third Person,Arcade,Online Co-Op,Sports,First-Person,PvP,Split Screen,Character Customization,Destruction,Sexual Content,+"
