title_name,realease_date,price,description,title_review,title_rating,developer,publisher,game_tags
"Horizon Zero Dawn™ Complete Edition","Aug 7 2020","4999.0","Experience Aloy’s legendary quest to unravel the mysteries of a future Earth ruled by Machines. Use devastating tactical attacks against your prey and explore a majestic open world in this award-winning action RPG!","Very Positive","(1,830)","Guerrilla","PlayStation PC LLC","Open World,Adventure,Singleplayer,Female Protagonist,Action,RPG,Story Rich,Post-apocalyptic,Robots,Sci-fi,Third Person,Exploration,Beautiful,Atmospheric,Action RPG,Great Soundtrack,Archery,Hunting,Dinosaurs,Stealth,+"
"The Sims™ 4 City Living","Jun 18 2020","1999.0","None","Mixed","(114)","Maxis","Electronic Arts","Simulation,Singleplayer,Character Customization,Funny,Classic,+"
"The Elder Scrolls V: Skyrim Anniversary Edition","Nov 11 2021","4999.0","NA","NA","NA","NA","NA","NA"
"The Last Spell","Jun 3 2021","1599.0","Defend the last bastion of humanity with your squad of heroes! Exterminate fiendish monsters with magic and brute force by night and re-build your battered city defenses by day in this tactical RPG with rogue-lite mechanics.","Very Positive","(77)","Ishtar Games","The Arcade Crew, Gamera Game","Early Access,Turn-Based Combat,Base Building,Replay Value,2D,Roguelite,Pixel Graphics,Strategy RPG,Turn-Based Tactics,Tactical RPG,Dark Fantasy,Perma Death,Tower Defense,Fantasy,Turn-Based,Action,Post-apocalyptic,Turn-Based Strategy,RPG,Tactical,+"
"Destiny 2: Beyond Light","Nov 10 2020","2999.0","NA","NA","NA","NA","NA","NA"
"Devil May Cry 4 Special Edition","Jun 23 2015","999.0","The smash-hit stylish action game DMC4 is back and better than ever, boasting new playable characters and game modes!","Very Positive","(74)","CAPCOM Co., Ltd.","CAPCOM Co., Ltd.","Action,Hack and Slash,Character Action Game,Great Soundtrack,Singleplayer,Spectacle fighter,Third Person,Stylized,Difficult,Classic,Story Rich,Anime,Atmospheric,Adventure,Beat 'em up,Replay Value,Controller,Female Protagonist,Remake,RPG,+"
"Resident Evil 2","Jan 24 2019","1599.0","A deadly virus engulfs the residents of Raccoon City in September of 1998, plunging the city into chaos as flesh eating zombies roam the streets for survivors. An unparalleled adrenaline rush, gripping storyline, and unimaginable horrors await you. Witness the return of Resident Evil 2.","Overwhelmingly Positive","(621)","CAPCOM Co., Ltd.","CAPCOM Co., Ltd.","Zombies,Survival Horror,Horror,Remake,Singleplayer,Third Person,Gore,Action,Atmospheric,Puzzle,Violent,Story Rich,Classic,Survival,Female Protagonist,Dark,Multiplayer,Adventure,Shooter,Difficult,+"
"Yakuza: Like a Dragon","Nov 10 2020","3299.0","Become Ichiban Kasuga, a low-ranking yakuza grunt left on the brink of death by the man he trusted most. Take up your legendary bat and get ready to crack some underworld skulls in dynamic RPG combat set against the backdrop of modern-day Japan.","Very Positive","(251)","Ryu Ga Gotoku Studio","SEGA","RPG,Adventure,Action,JRPG,Turn-Based Combat,Story Rich,Turn-Based,Open World,Singleplayer,Sexual Content,Funny,Crime,Great Soundtrack,Violent,Comedy,Minigames,Drama,Nudity,Anime,Third Person,+"
"SCARLET NEXUS","Jun 24 2021","2399.0","Choose between Yuito and Kasane, elite psionics each armed with a talent in psychokinesis and their own reason to fight. Complete both of their stories to unlock all the mysteries of a Brain Punk future caught between technology and psychic abilities.","Very Positive","(289)","BANDAI NAMCO Studios Inc.","BANDAI NAMCO Entertainment","Action,RPG,Anime,Adventure,Action RPG,JRPG,Sci-fi,Action-Adventure,Combat,Character Action Game,Open World,Fighting,Interactive Fiction,Fantasy,Strategy RPG,Futuristic,Character Customization,CRPG,Singleplayer,Post-apocalyptic,+"
"Arma 3","Sep 12 2013","2999.0","Experience true combat gameplay in a massive military sandbox. Deploying a wide variety of single- and multiplayer content, over 20 vehicles and 40 weapons, and limitless opportunities for content creation, this is the PC’s premier military game. Authentic, diverse, open - Arma 3 sends you to war.","Very Positive","(1,161)","Bohemia Interactive","Bohemia Interactive","Action,Multiplayer,Military,Simulation,Shooter,First-Person,Realistic,Open World,Tactical,FPS,War,Co-op,Strategy,Sandbox,Moddable,Combat,Singleplayer,Online Co-Op,Team-Based,Third-Person Shooter,+"
"Dead Rising Triple Pack","","1491.0","NA","NA","NA","NA","NA","NA"
"The Sims™ 4 Get To Work","Jun 18 2020","1999.0","None","Mixed","(87)","Maxis","Electronic Arts","Simulation,+"
"CS:GO Prime Status Upgrade","Aug 21 2012","1499.0","Counter-Strike: Global Offensive (CS: GO) expands upon the team-based action gameplay that it pioneered when it was launched 19 years ago. CS: GO features new maps, characters, weapons, and game modes, and delivers updated versions of the classic CS content (de_dust2, etc.).","Very Positive","(81,341)","Valve, Hidden Path Entertainment","Valve","FPS,Shooter,Multiplayer,Competitive,Action,Team-Based,eSports,Tactical,First-Person,PvP,Online Co-Op,Co-op,Strategy,Military,War,Difficult,Trading,Realistic,Fast-Paced,Moddable,+"
"Yakuza Remastered Collection","","2610.0","NA","NA","NA","NA","NA","NA"
"PowerWash Simulator","May 19 2021","1999.0","Release the Pressure with PowerWash Simulator! Wash away your worries with the soothing sounds of high-pressure water. Fire up your power washer and blast away every speck of dirt and grime you can find, all with the simple satisfaction of power-washing to a sparkling finish.","Overwhelmingly Positive","(956)","FuturLab","Square Enix","Simulation,Casual,Indie,Relaxing,Singleplayer,Early Access,Family Friendly,First-Person,Colorful,3D,Realistic,Atmospheric,FPS,Multiplayer,Co-op,Online Co-Op,Story Rich,Funny,VR,+"
"Satisfactory","Jun 8 2020","2999.0","Satisfactory is a first-person open-world factory building game with a dash of exploration and combat. Play alone or with friends, explore an alien planet, create multi-story factories, and enter conveyor belt heaven!","Overwhelmingly Positive","(1,859)","Coffee Stain Studios","Coffee Stain Publishing","Base Building,Automation,Open World,Multiplayer,Crafting,Co-op,Resource Management,Building,Sandbox,Exploration,Adventure,Early Access,Simulation,Strategy,Open World Survival Craft,Survival,First-Person,Indie,Sci-fi,Singleplayer,+"
"Utawarerumono: Prelude to the Fallen","Jan 22 2021","2399.0","The first game in the Utawarerumono trilogy of story-rich tactics RPGs. Into a world filled with verdant nature, populated by folk with fluffy ears and fuzzy tails, awakens Hakuowlo, a man of masked mien and missing memory.","Very Positive","(16)","AQUAPLUS","DMM GAMES, Shiravune","Turn-Based Tactics,Visual Novel,Anime,Story Rich,Lore-Rich,Fantasy,Sci-fi,Romance,Strategy,Turn-Based Strategy,Nature,Strategy RPG,Tactical RPG,JRPG,RPG,Adventure,3D,Simulation,Sexual Content,Singleplayer,+"
"Bloons TD 6","Dec 18 2018","999.0","The Bloons are back and better than ever! Get ready for a massive 3D tower defense game designed to give you hours and hours of the best strategy gaming available.","Overwhelmingly Positive","(5,470)","Ninja Kiwi","Ninja Kiwi","Tower Defense,Strategy,Multiplayer,Singleplayer,Co-op,Online Co-Op,Family Friendly,Casual,3D,Cartoony,Sandbox,Funny,Difficult,Great Soundtrack,Cute,Survival,Action,Indie,2D,Adventure,+"
"Pavlov VR","Feb 27 2017","2499.0","Pavlov vr is a multiplayer shooter in VR with heavy focus on community features. Realistic reloading features and fast paced combat as part of the core experience. Play the #1 most popular VR shooter on PC today.","Very Positive","(763)","Vankrupt Games","Vankrupt Games","VR,Action,Shooter,Multiplayer,FPS,Military,Gore,Funny,Zombies,Violent,First-Person,Indie,Singleplayer,Memes,Co-op,Competitive,PvP,Team-Based,Simulation,Early Access,+"
"Tom Clancy's Rainbow Six® Siege - Y7 Pass","Feb 22 2022","2999.0","None","Mixed","(248)","Ubisoft Montreal","Ubisoft","Action,Violent,+"
"Cities: Skylines","Mar 10 2015","2999.0","Cities: Skylines is a modern take on the classic city simulation. The game introduces new game play elements to realize the thrill and hardships of creating and maintaining a real city whilst expanding on some well-established tropes of the city building experience.","Very Positive","(2,343)","Colossal Order Ltd.","Paradox Interactive","City Builder,Simulation,Building,Management,Strategy,Sandbox,Singleplayer,Moddable,Economy,Resource Management,Mod,Realistic,Replay Value,Casual,Modern,Real-Time with Pause,Family Friendly,Great Soundtrack,Funny,Action,+"
"Red Dead Online","Dec 1 2020","999.0","Step into the vibrant, ever-evolving world of Red Dead Online and experience life in frontier America. Chase down bounties, battle outlaw gangs and other players, hunt, fish and trade, search for exotic treasures, run Moonshine, and much more to discover in a world of astounding depth and detail.","Very Positive","(797)","Rockstar Games","Rockstar Games","Action,Open World,Multiplayer,Western,Adventure,Shooter,Horses,Third-Person Shooter,Online Co-Op,Realistic,PvP,Character Customization,Story Rich,Singleplayer,MMORPG,Co-op,First-Person,Controller,Violent,Gore,+"
"Battlefield™ 2042","Nov 19 2021","2999.0","Battlefield™ 2042 is a first-person shooter that marks the return to the iconic all-out warfare of the franchise. In a near-future world transformed by disorder, adapt and overcome dynamically-changing battlegrounds with the help of your squad and a cutting-edge arsenal.","Overwhelmingly Negative","(3,932)","DICE","Electronic Arts","Shooter,Action,Multiplayer,FPS,War,First-Person,Military,Futuristic,PvP,Team-Based,Vehicular Combat,Combat,Modern,Destruction,Physics,Cinematic,Adventure,Hero Shooter,Singleplayer,Casual,+"
"Pathfinder: Wrath of the Righteous","Sep 2 2021","4999.0","Embark on a journey to a realm overrun by demons in a new epic RPG from the creators of the critically acclaimed Pathfinder: Kingmaker. Explore the nature of good and evil, learn the true cost of power, and rise as a Mythic Hero capable of deeds beyond mortal expectations.","Very Positive","(518)","Owlcat Games","META Publishing, Owlcat Games","RPG,CRPG,Character Customization,Story Rich,Tactical RPG,Choices Matter,Dungeons & Dragons,Female Protagonist,Gore,Choose Your Own Adventure,Fantasy,Isometric,Turn-Based Combat,Party-Based RPG,Dark Fantasy,Singleplayer,Exploration,Medieval,Tabletop,Adventure,+"
"The Elder Scrolls Online: High Isle","Jun 6 2022","3999.0","Welcome to High Isle, a part of Tamriel never-before-seen in the Elder Scrolls. Explore the Bretons' idyllic ocean enclave and seat of chivalric culture as you confront the ruinous forces of the Ascendant Lord.","['No user reviews']","0","Zenimax Online Studios","Bethesda Softworks","Adventure,RPG,MMORPG,Action,Exploration,Fantasy,Open World,Multiplayer,Singleplayer,Massively Multiplayer,Choose Your Own Adventure,Character Customization,Story Rich,PvP,PvE,Card Game,Lore-Rich,Action RPG,Class-Based,Medieval,+"
"Fallout 4: Game of the Year Edition","Nov 10 2015","3999.0","NA","NA","NA","NA","NA","NA"
"Diplomacy is Not an Option","Feb 9 2022","2499.0","You were born a feudal lord. Sounds good, right? But you're bored of hunting, executions and tournaments. Even of feasts with beautiful maidens. The only dream left - your castle surrounded by hordes of enemies. You would waste no time on negotiation. This is your chance to show'em who is in charge.","Very Positive","(1,401)","Door 407","Door 407","City Builder,Tower Defense,Sandbox,Strategy,Building,Survival,RTS,Base Building,Procedural Generation,Colorful,Stylized,Singleplayer,Combat,Medieval,3D,Early Access,Action RTS,Indie,Violent,Action,+"
"WARNO","Jan 20 2022","3999.0","Realistic, immersive, breathtaking. WARNO is the ultimate World War III battle simulator from the masters of strategy, Eugen Systems. A Cold War turns decisively hot as you command hundreds of units on a beautiful and brutal battlefield. Outsmart, outfight, and lead your forces to total victory.","Mostly Positive","(366)","Eugen Systems","Eugen Systems","Early Access,Wargame,Cold War,Real Time Tactics,Military,War,RTS,Artificial Intelligence,Tanks,PvP,Real-Time,Strategy,Turn-Based Strategy,Alternate History,Historical,Bullet Time,Team-Based,Simulation,Tactical,Realistic,+"
"Tabletop Simulator","Jun 5 2015","1999.0","Tabletop Simulator is the only simulator where you can let your aggression out by flipping the table! There are no rules to follow: just you, a physics sandbox, and your friends. Make your own online board games or play the thousands of community created mods. Unlimited gaming possibilities!","Overwhelmingly Positive","(393)","Berserk Games","Berserk Games","Tabletop,Board Game,Simulation,Multiplayer,Sandbox,Card Game,Trading Card Game,VR,Physics,Wargame,Casual,3D,Strategy,Moddable,Online Co-Op,Co-op,RPG,Funny,First-Person,Indie,+"
"Sid Meier’s Civilization® VI","Oct 21 2016","5999.0","Civilization VI offers new ways to interact with your world, expand your empire across the map, advance your culture, and compete against history’s greatest leaders to build a civilization that will stand the test of time. Play as one of 20 historical leaders including Roosevelt (America) and Victoria (England).","Very Positive","(3,183)","Firaxis Games, Aspyr (Mac), Aspyr (Linux)","2K, Aspyr (Mac), Aspyr (Linux)","Strategy,Turn-Based Strategy,Multiplayer,Historical,Singleplayer,Turn-Based,Grand Strategy,4X,War,Simulation,City Builder,Tactical,Great Soundtrack,Building,Moddable,Management,Online Co-Op,Co-op,Hex Grid,Atmospheric,+"
"The Legend of Heroes: Trails of Cold Steel IV","Apr 9 2021","4199.0","The long awaited finale to the epic engulfing a continent comes to a head in the final chapter of the Trails of Cold Steel saga!","Very Positive","(28)","Nihon Falcom, Engine Software BV, PH3 GmbH","NIS America, Inc.","RPG,JRPG,Anime,Turn-Based,Story Rich,Great Soundtrack,Singleplayer,Romance,Fantasy,Mechs,Turn-Based Combat,+"
"Ghosts 'n Goblins Resurrection","Jun 1 2021","2009.0","Watch as this nostalgic yet completely reimagined storybook world unravels before your very eyes. Taking cues from both Ghosts 'n Goblins and Ghouls 'n Ghosts and giving birth to something entirely new, Resurrection is a title worthy of its name.","Very Positive","(407)","CAPCOM Co., Ltd.","CAPCOM Co., Ltd.","Action,2D Platformer,Side Scroller,2D,Hand-drawn,1980s,Old School,Zombies,Dark,Dark Fantasy,Dragons,Retro,Demons,Magic,PvE,Score Attack,Multiple Endings,Difficult,Singleplayer,Local Co-Op,+"
"Call of Duty® Franchise Collection","","96260.0","NA","NA","NA","NA","NA","NA"
"METAL GEAR RISING: REVENGEANCE","Jan 9 2014","2999.0","Developed by Kojima Productions and PlatinumGames, METAL GEAR RISING: REVENGEANCE takes the renowned METAL GEAR franchise into exciting new territory with an all-new action experience. The game seamlessly melds pure action and epic story-telling that surrounds Raiden – a child soldier transformed into a half-human, half-cyborg ninja who...","Overwhelmingly Positive","(1,603)","PlatinumGames","Konami Digital Entertainment","Great Soundtrack,Action,Hack and Slash,Spectacle fighter,Swordplay,Character Action Game,Third Person,Singleplayer,Ninja,Fast-Paced,Cyberpunk,Gore,Sci-fi,Difficult,Story Rich,Replay Value,Mechs,Adventure,Beat 'em up,Stealth,+"
"Halo Infinite (Campaign)","Dec 8 2021","5999.0","None","Mixed","(84)","343 Industries","Xbox Game Studios","Action,Adventure,Shooter,FPS,Singleplayer,Open World,Sci-fi,Atmospheric,Aliens,Lore-Rich,Story Rich,Space,Great Soundtrack,First-Person,Co-op,Multiplayer,Co-op Campaign,Beautiful,Epic,Hentai,+"
"Blade and Sorcery","Dec 11 2018","1999.0","Blade & Sorcery is a built-for-VR medieval fantasy sandbox with full physics driven melee, ranged and magic combat. Become a powerful warrior, ranger or sorcerer and devastate your enemies.","Overwhelmingly Positive","(1,016)","WarpFrog","WarpFrog","VR,Action,Swordplay,Violent,Gore,Simulation,Moddable,Magic,Sandbox,Physics,Adventure,Fighting,Medieval,Indie,Singleplayer,RPG,Early Access,Fantasy,First-Person,Games Workshop,+"
"Hunt: Showdown","Aug 27 2019","3999.0","Hunt: Showdown is a thrilling, high-stakes PvPvE first-person shooter. Take down nightmarish monsters, as you compete for the bounties that will bring you glory, gear, and gold in this unforgiving – and unforgettable - online multiplayer experience.","Very Positive","(1,971)","Crytek","Crytek","Hunting,Dark,Tactical,FPS,Horror,Western,Perma Death,Multiplayer,Survival,PvP,Shooter,Open World,Zombies,Atmospheric,Battle Royale,Violent,Team-Based,Online Co-Op,First-Person,Action,+"
"Deep Rock Galactic","May 13 2020","2999.0","Deep Rock Galactic is a 1-4 player co-op FPS featuring badass space Dwarves, 100% destructible environments, procedurally-generated caves, and endless hordes of alien monsters.","Overwhelmingly Positive","(3,110)","Ghost Ship Games","Coffee Stain Publishing","Co-op,PvE,FPS,Loot,Exploration,Looter Shooter,Procedural Generation,Shooter,First-Person,Horror,Class-Based,Sci-fi,Action,Space,Combat,Atmospheric,Action Roguelike,Dark,Survival,Open World,+"
"Utawarerumono Complete Bundle","","4761.0","NA","NA","NA","NA","NA","NA"
"SCARLET NEXUS","Jun 24 2021","2399.0","Choose between Yuito and Kasane, elite psionics each armed with a talent in psychokinesis and their own reason to fight. Complete both of their stories to unlock all the mysteries of a Brain Punk future caught between technology and psychic abilities.","Very Positive","(289)","BANDAI NAMCO Studios Inc.","BANDAI NAMCO Entertainment","Action,RPG,Anime,Adventure,Action RPG,JRPG,Sci-fi,Action-Adventure,Combat,Character Action Game,Open World,Fighting,Interactive Fiction,Fantasy,Strategy RPG,Futuristic,Character Customization,CRPG,Singleplayer,Post-apocalyptic,+"
"RimWorld","Oct 17 2018","3499.0","A sci-fi colony sim driven by an intelligent AI storyteller. Generates stories by simulating psychology, ecology, gunplay, melee combat, climate, biomes, diplomacy, interpersonal relationships, art, medicine, trade, and more.","Overwhelmingly Positive","(1,856)","Ludeon Studios","Ludeon Studios","Colony Sim,Base Building,Survival,Strategy,Management,Sandbox,Building,Simulation,City Builder,Singleplayer,Procedural Generation,Open World,Moddable,2D,Sci-fi,Indie,Tactical RPG,Space,Western,Cartoony,+"
"DEAD RISING®","Sep 13 2016","599.0","You are Frank West. A hard-edged photojournalist hellbent on investigating the mystery at Willamette Mall. It's swarming with zombies. You have 72 hours. Chop 'till you drop!","Very Positive","(52)","Capcom","Capcom","Zombies,Action,Adventure,Singleplayer,Open World,Third Person,Survival,Gore,Funny,Classic,Sandbox,Horror,Survival Horror,Comedy,Great Soundtrack,Difficult,Memes,Nudity,Beat 'em up,Multiplayer,+"
"Journey","Jun 11 2020","749.0","Explore the ancient, mysterious world of Journey as you soar above ruins and glide across sands to discover its secrets.","Very Positive","(812)","thatgamecompany","Annapurna Interactive","Adventure,Beautiful,Indie,Atmospheric,Exploration,Great Soundtrack,Relaxing,Co-op,Walking Simulator,Casual,Story Rich,Multiplayer,Stylized,Classic,Family Friendly,Music,Mystery,3D,Narrative,Singleplayer,+"
"Crusader Kings III","Sep 1 2020","4999.0","Love, fight, scheme, and claim greatness. Determine your noble house’s legacy in the sprawling grand strategy of Crusader Kings III. Death is only the beginning as you guide your dynasty’s bloodline in the rich and larger-than-life simulation of the Middle Ages.","Very Positive","(1,470)","Paradox Development Studio","Paradox Interactive","Strategy,RPG,Simulation,Medieval,Grand Strategy,Historical,Political,War,Management,Singleplayer,Character Customization,Choices Matter,Multiplayer,Sandbox,Real-Time with Pause,Moddable,Sexual Content,PvP,Nudity,Dating Sim,+"
"Golden Light","Mar 11 2022","1399.0","Eat weapons, be scared and question your own mind in this Survival-Horror FPS Prop Hunt Roguelike about meat. Now with online Co-op and Versus modes. Walls are watching you!","Very Positive","(92)","Mr. Pink","HypeTrain Digital","Shooter,First-Person,Dark Humor,Stylized,Psychedelic,Retro,Old School,Early Access,FPS,Action,Singleplayer,Blood,Surreal,Arena Shooter,Colorful,Cyberpunk,Difficult,3D,Immersive Sim,Capitalism,+"
"Battlefield V","Oct 22 2020","1249.0","This is the ultimate Battlefield V experience. Enter mankind’s greatest conflict with the complete arsenal of weapons, vehicles, and gadgets plus the best customization content of Year 1 and 2.","Mixed","(3,457)","DICE","Electronic Arts","FPS,World War II,Shooter,Multiplayer,Singleplayer,War,Military,First-Person,PvP,Combat,Open World,Massively Multiplayer,Action,Historical,Destruction,Atmospheric,Battle Royale,Violent,Sexual Content,Female Protagonist,+"
"Totally Accurate Battle Simulator","Apr 1 2021","1999.0","Be the leader of wobblers from ancient lands, spooky places, and fantasy worlds. Watch them fight in simulations made with the wobbliest physics system ever created, make your own wobblers in the unit creator and send your army off to fight your friends in multiplayer.","Overwhelmingly Positive","(1,623)","Landfall","Landfall","Sandbox,Funny,Simulation,Physics,Singleplayer,Indie,Adventure,Realistic,War,Strategy,3D,Colorful,Fantasy,Comedy,Action,Memes,Casual,Historical,Medieval,Cute,+"
"RESONANCE OF FATE™/END OF ETERNITY™ 4K/HD EDITION","Oct 17 2018","2099.0","This symphonic gunplay RPG, where you can change the fate of the world, has been remastered in a 4K/HD EDITION. Fly through the air and enjoy the blazing gun battles in this fateful tale set on a ruined planet.","Very Positive","(621)","tri-Ace","tri-Ace","RPG,JRPG,Singleplayer,Turn-Based Combat,Story Rich,Anime,Difficult,Gun Customization,Steampunk,Action,Female Protagonist,Great Soundtrack,+"
"FINAL FANTASY XIV: Endwalker","Dec 7 2021","3999.0","None","Very Positive","(31)","Square Enix","Square Enix","Massively Multiplayer,RPG,Story Rich,MMORPG,Fantasy,Multiplayer,Great Soundtrack,JRPG,+"
"X4: Split Vendetta","Mar 31 2020","899.0","None","Mostly Positive","(158)","Egosoft","Egosoft","Simulation,Action,Space,Sandbox,Space Sim,Exploration,Sci-fi,Economy,Building,Flight,+"
"Microsoft Flight Simulator Game of the Year Edition","Apr 18 2020","5999.0","Thank you to our fans – new and old! Microsoft Flight Simulator Game of the Year (GOTY) Edition offers 5 all-new aircrafts, 8 new handcrafted airports, 6 new Discovery Flights, new tutorials, and updates to the weather system. GOTY Edition is free for existing users. The sky is calling!","Mostly Positive","(858)","Asobo Studio","Xbox Game Studios","Simulation,Flight,Open World,Realistic,Multiplayer,Singleplayer,Atmospheric,Real-Time,VR,Physics,Adventure,Colorful,Family Friendly,TrackIR,Logic,Life Sim,Surreal,Beautiful,Short,Action Roguelike,+"
"Apex Legends™ - Champion Edition","Nov 5 2020","2799.0","None","Very Positive","(15)","Respawn Entertainment","Electronic Arts","Action,Adventure,Battle Royale,Multiplayer,FPS,Shooter,First-Person,Free to Play,+"
"Factorio","Aug 14 2020","3000.0","Factorio is a game about building and creating automated factories to produce items of increasing complexity, within an infinite 2D world. Use your imagination to design your factory, combine simple elements into ingenious structures, and finally protect it from the creatures who don't really like you.","Overwhelmingly Positive","(798)","Wube Software LTD.","Wube Software LTD.","Automation,Base Building,Resource Management,Sandbox,Crafting,Strategy,Multiplayer,Survival,Management,Open World,Co-op,Building,2D,Casual,Moddable,Singleplayer,Simulation,Trains,Pixel Graphics,City Builder,+"
"Divinity: Original Sin 2 - Definitive Edition","Sep 14 2017","4499.0","The critically acclaimed RPG that raised the bar, from the creators of Baldur's Gate 3. Gather your party. Master deep, tactical combat. Venture as a party of up to four - but know that only one of you will have the chance to become a God.","Very Positive","(1,620)","Larian Studios","Larian Studios","Tactical RPG,Exploration,Turn-Based Strategy,RPG,Story Rich,CRPG,Fantasy,Party-Based RPG,Character Customization,Strategy RPG,PvP,Female Protagonist,Co-op Campaign,Local Co-Op,Isometric,Romance,Strategy,Funny,Moddable,3D,+"
"Portal 2","Apr 19 2011","999.0","The "Perpetual Testing Initiative" has been expanded to allow you to design co-op puzzles for you and your friends!","Overwhelmingly Positive","(3,499)","Valve","Valve","Platformer,Puzzle,Dark Humor,First-Person,Puzzle Platformer,Story Rich,Funny,Female Protagonist,3D Platformer,Action-Adventure,Action,FPS,Co-op,Physics,Level Editor,Sci-fi,Science,Atmospheric,Comedy,Adventure,+"
"Utawarerumono Series Bundle","","3957.0","NA","NA","NA","NA","NA","NA"
"Cities: Skylines - New Player Bundle","","6566.0","NA","NA","NA","NA","NA","NA"
"The Sims™ 4 Discover University","Jun 18 2020","1999.0","None","Mostly Negative","(67)","Maxis","Electronic Arts","Casual,Simulation,+"
"Madden NFL 22","Aug 20 2021","1799.0","Madden NFL 22 is where gameday happens. All-new features in Franchise include staff management, an enhanced scenario engine, and weekly strategy. Share avatar progress and player class between Face of The Franchise and The Yard with unified progression.","Mixed","(449)","Tiburon","Electronic Arts","Sports,Football,Controller,PvP,Realistic,Casual,Immersive Sim,eSports,Third Person,Physics,Team-Based,Strategy,Cinematic,Simulation,America,Local Co-Op,Local Multiplayer,Multiplayer,Online Co-Op,Singleplayer,+"
"The Sims™ 4 Get Famous","Jun 18 2020","1999.0","None","Mixed","(67)","Maxis","Electronic Arts","Simulation,Singleplayer,Character Customization,Classic,Funny,+"
