title_name,realease_date,price,description,title_review,title_rating,developer,publisher,game_tags
"Who's Your Daddy?!","May 13 2016","499.0","Who's Your Daddy is a casual multiplayer game featuring a clueless father attempting to prevent his infant son from certain death. Play with up to 7 of your friends, and test your parenting skills in a competitive setup with wacky physics and over 67 potentially ominous household items.","Very Positive","(379)","Evil Tortilla Games","Evil Tortilla Games","Funny,Multiplayer,First-Person,Comedy,Simulation,Strategy,Online Co-Op,Dark Humor,Casual,Co-op,Indie,Action,Early Access,Split Screen,Difficult,Survival,Sandbox,Third Person,Adventure,Singleplayer,+"
"Disco Elysium - The Final Cut","Oct 15 2019","3999.0","Disco Elysium - The Final Cut is a groundbreaking role playing game. You’re a detective with a unique skill system at your disposal and a whole city to carve your path across. Interrogate unforgettable characters, crack murders or take bribes. Become a hero or an absolute disaster of a human being.","Very Positive","(1,773)","ZA/UM","ZA/UM","RPG,Story Rich,Choices Matter,Detective,Isometric,Atmospheric,Singleplayer,Noir,CRPG,Surreal,Point & Click,Indie,Adventure,Open World,Exploration,Funny,Visual Novel,Character Customization,Fantasy,Sexual Content,+"
"Dying Light 2 Stay Human","Feb 3 2022","5999.0","The virus won and civilization has fallen back to the Dark Ages. The City, one of the last human settlements, is on the brink of collapse. Use your agility and combat skills to survive, and reshape the world. Your choices matter.","Mostly Positive","(3,764)","Techland","Techland","Open World,Zombies,Co-op,Multiplayer,Parkour,Survival,Action,First-Person,Horror,Gore,Post-apocalyptic,Violent,Choices Matter,RPG,Adventure,Story Rich,Atmospheric,Singleplayer,Survival Horror,FPS,+"
"Call of Duty: World at War","Nov 18 2008","1499.0","Call of Duty is back, redefining war like you've never experienced before. Building on the Call of Duty 4®: Modern Warfare engine, Call of Duty: World at War immerses players into the most gritty and chaotic WWII combat ever experienced.","Very Positive","(401)","Treyarch","Activision","Zombies,World War II,FPS,Multiplayer,Action,Shooter,Co-op,Singleplayer,Moddable,First-Person,War,Online Co-Op,Gore,Historical,Classic,Survival,Great Soundtrack,Tanks,Horror,Adventure,+"
"RimWorld - Royalty","Feb 24 2020","1999.0","NA","NA","NA","NA","NA","NA"
"Conan Exiles","May 8 2018","3999.0","An online multiplayer survival game, now with mounts and mounted combat, set in the lands of Conan the Barbarian. Survive in a vast open world sandbox, build a home and kingdom, dominate your enemies in single or multiplayer.","Very Positive","(325)","Funcom","Funcom","Survival,Open World,Building,Nudity,Open World Survival Craft,Crafting,Multiplayer,RPG,Sandbox,Massively Multiplayer,Action,Adventure,Online Co-Op,Exploration,Violent,Co-op,Singleplayer,Fantasy,PvP,Gore,+"
"Stolen Realm","Oct 14 2021","1999.0","Lead a party of up to 6 heroes in online co-op or venture alone in this blend of turn-based dungeon-crawling looter and action RPG, set in a high-fantasy, low-poly world. Master deep and thrilling tactical combat in procedurally generated adventures, picking your path between battles.","Very Positive","(116)","Burst2Flame Entertainment","Burst2Flame Entertainment","Early Access,Turn-Based Tactics,Party-Based RPG,Tactical RPG,CRPG,Turn-Based Strategy,Character Customization,RPG,Strategy,Top-Down,Tactical,Turn-Based Combat,Online Co-Op,Loot,Multiplayer,Adventure,Local Co-Op,Board Game,Class-Based,Tabletop,+"
"Supporter Edition","","11398.0","NA","NA","NA","NA","NA","NA"
"Ghostrunner","Oct 27 2020","1199.0","Ghostrunner offers a unique single-player experience: fast-paced, violent combat, and an original setting that blends science fiction with post-apocalyptic themes. It tells the story of a world that has already ended and its inhabitants who fight to survive.","Very Positive","(591)","One More Level, 3D Realms, Slipgate Ironworks™, All in! Games","505 Games","Action,Cyberpunk,Fast-Paced,First-Person,Difficult,Singleplayer,Swordplay,Futuristic,Violent,Sci-fi,Hack and Slash,Action-Adventure,Great Soundtrack,Adventure,Combat,Post-apocalyptic,Fighting,Strategy,Shooter,Interactive Fiction,+"
"OMORI","Dec 25 2020","1999.0","Explore a strange world full of colorful friends and foes. When the time comes, the path you’ve chosen will determine your fate... and perhaps the fate of others as well.","Overwhelmingly Positive","(1,724)","OMOCAT, LLC","OMOCAT, LLC","Psychological Horror,Story Rich,Indie,Pixel Graphics,Great Soundtrack,RPG,Hand-drawn,Multiple Endings,RPGMaker,Horror,Colorful,Turn-Based,2D,Atmospheric,Party-Based RPG,Exploration,JRPG,Anime,Stylized,Fantasy,+"
"PGA TOUR 2K21","Aug 21 2020","1499.0","Play against the pros. Play with your crew. In PGA TOUR 2K21, you can play by the rules or create your own featuring a new PGA TOUR Career Mode, licensed courses and more! Powered by The Golf Club.","Very Positive","(116)","HB Studios Multimedia Ltd.","2K","Sports,Simulation,Local Multiplayer,Golf,Turn-Based,Singleplayer,Character Customization,+"
"DOOM Eternal Standard Edition","Mar 20 2020","3999.0","NA","NA","NA","NA","NA","NA"
"Forgive Me Father","Apr 7 2022","1999.0","Forgive Me Father is a dark retro horror FPS set in a comic book style world inspired by the novels of H.P. Lovecraft. As the only one left with full senses, you begin a journey in search of answers and relief. How long can you last?","Mostly Positive","(237)","Byte Barrel","1C Entertainment","Action,FPS,Lovecraftian,Shooter,3D,First-Person,Cartoony,Stylized,Indie,Psychedelic,Gore,Atmospheric,Retro,Violent,Dark Fantasy,Supernatural,Mystery,Character Customization,Combat,Singleplayer,+"
"Have a Nice Death","Mar 8 2022","1499.0","Have a Nice Death is a 2D action roguelike where you play as an overworked Death, whose employees have run rampant, completely throwing off the balance of souls - and his vacation plans. In order to restore order, you'll have to grab your trusty scythe and show your employees who's boss.","Very Positive","(952)","Magic Design Studios","Gearbox Publishing","Singleplayer,Action Roguelike,2D Platformer,Action,2D,Dark Humor,Controller,Cartoony,Cartoon,Early Access,Gothic,Hack and Slash,Comedy,Combat,Metroidvania,Arcade,Platformer,Roguelike,Funny,Indie,+"
"State of Decay 2: Juggernaut Edition","Mar 13 2020","2999.0","The dead have risen and civilization has fallen. Now it's up to you to gather survivors, scavenge for resources and build a community in a post-apocalyptic world – a world where you define what it means to survive in this ultimate zombie survival simulation.","Very Positive","(542)","Undead Labs","Xbox Game Studios","Survival,Open World,Zombies,Base Building,Co-op,Multiplayer,Online Co-Op,Simulation,Action,Post-apocalyptic,RPG,Sandbox,Third Person,Violent,Gore,Horror,Perma Death,Singleplayer,Atmospheric,Replay Value,+"
"Rogue Tower","Jan 28 2022","1499.0","Rogue Tower is a tower defense game with roguelike elements and a continuously expanding path which you can influence. Unlock, build, upgrade, expand, defend.","Very Positive","(543)","Die of Death Games","Die of Death Games","Strategy,Tower Defense,Casual,Roguelike,3D,Procedural Generation,Base Building,Minimalist,Singleplayer,Roguelite,Colorful,Building,Cartoony,Fantasy,Isometric,Medieval,Magic,+"
"BIGFOOT","Jan 31 2017","1999.0","You are a Bigfoot hunter with an important mission: to put an end to rumours once and for all and prove to yourself that Bigfoot is not just a myth or an invention of the mind...","Very Positive","(203)","CyberLight Game Studio","CyberLight Game Studio","Early Access,Horror,Multiplayer,Co-op,Survival Horror,Online Co-Op,Survival,Action,Open World,Atmospheric,FPS,Psychological Horror,Adventure,Supernatural,Hunting,First-Person,Shooter,Singleplayer,Funny,Multiple Endings,+"
"Ultimate Admiral: Dreadnoughts","Dec 10 2021","3499.0","Design warships the way you want them, command fleets, win the naval arms race for your nation!","Very Positive","(119)","Game-Labs","Game-Labs","Naval Combat,Naval,Simulation,Early Access,Indie,World War II,World War I,Building,Sandbox,Military,Realistic,RTS,Wargame,Historical,War,Singleplayer,Turn-Based Strategy,3D,Strategy,Atmospheric,+"
"The Elder Scrolls Online - Blackwood","Jun 1 2021","989.0","The Elder Scrolls Online Collection: Blackwood is the ultimate Elder Scrolls experience and includes the base game, Blackwood Chapter, and all previous Chapters.","Mixed","(11)","Zenimax Online Studios","Bethesda Softworks","RPG,Massively Multiplayer,Multiplayer,Violent,Gore,Singleplayer,MMORPG,Open World,Fantasy,+"
"Godfall Ultimate Edition","Apr 7 2022","3999.0","Aperion is on the precipice of ruin. You are the last of the Valorian knights, god-like warriors able to equip Valorplates, legendary armor sets that transform wielders into unstoppable masters of melee combat. Ascend in Godfall, the first-of-its-kind, looter-slasher, melee action-RPG.","Mixed","(486)","Counterplay Games Inc","Gearbox Publishing","Action,RPG,Hack and Slash,Action RPG,3D,Third Person,Atmospheric,PvE,Co-op,Multiplayer,Online Co-Op,Singleplayer,Co-op Campaign,Cinematic,Combat,Loot,Fantasy,Adventure,Souls-like,+"
"Hero's Hour","Mar 1 2022","1799.0","A fast turn-based strategy RPG with real-time combat. Develop your cities and armies, level up your heroes to gain new, powerful spells and skills, and explore the wonders and dangers of the procedurally generated maps as you aim to conquer your enemies before they do the same to you.","Mostly Positive","(380)","Benjamin "ThingOnItsOwn" Hauer","Goblinz Publishing, Maple Whispering Limited","Local Co-Op,Strategy,Auto Battler,Turn-Based Strategy,Pixel Graphics,Fantasy,RPG,Turn-Based Tactics,Procedural Generation,Multiplayer,Singleplayer,Tactical,2D,Level Editor,Strategy RPG,PvP,Atmospheric,4X,Turn-Based,Grand Strategy,+"
"The Sims™ 4 Cottage Living Expansion Pack","Jul 22 2021","3999.0","None","Very Positive","(10)","Maxis","Electronic Arts","Simulation,Casual,+"
"LEGO® Star Wars™: The Skywalker Saga Character Collection","Apr 5 2022","1499.0","None","Very Positive","(106)","TT Games","Warner Bros. Games, Warner Bros. Interactive Entertainment","Action,Adventure,+"
"Fallout New Vegas Ultimate","Feb 7 2012","1999.0","NA","NA","NA","NA","NA","NA"
"Sid Meier's Civilization® VI: New Frontier Pass","May 21 2020","3999.0","None","Mixed","(976)","Firaxis Games, Aspyr (Mac), Aspyr (Linux)","2K","Strategy,4X,+"
"Monster Hunter Rise: Sunbreak","Jun 30 2022","3999.0","None","['No user reviews']","0","CAPCOM Co., Ltd.","CAPCOM Co., Ltd.","Action,Multiplayer,+"
"Borderlands GOTY Enhanced","Oct 26 2009","989.0","NA","NA","NA","NA","NA","NA"
"Sid Meier's Civilization® VI: Gathering Storm","Feb 14 2019","3999.0","None","Mixed","(16)","Firaxis Games, Aspyr (Mac), Aspyr (Linux)","2K, Aspyr (Mac), Aspyr (Linux)","Strategy,Turn-Based,Grand Strategy,City Builder,Multiplayer,Turn-Based Strategy,4X,Historical,Singleplayer,Simulation,+"
"Mon Bazou","Dec 16 2021","1399.0","Build your crappy vehicle into a race car, install the parts yourself. Make money by cutting wood, racing at night or delivering pizza. Maybe you want to manage a sugar shack or build yourself a big garage?","Overwhelmingly Positive","(937)","Santa Goat","Santa Goat","Simulation,Choose Your Own Adventure,Sandbox,Building,Automobile Sim,Crafting,Motorbike,Physics,Racing,3D,Relaxing,Singleplayer,Adventure,Early Access,Family Friendly,Offroad,Voxel,Logic,Driving,Open World,+"
"Arma 3 Ultimate Edition","","11975.0","NA","NA","NA","NA","NA","NA"
"Age of Empires II: Definitive Edition - Dynasties of India","Apr 28 2022","999.0","None","['No user reviews']","0","Forgotten Empires, Tantalus Media, Wicked Witch","Xbox Game Studios","Strategy,+"
"Car Mechanic Simulator 2021 - Silver Bundle","","4764.0","NA","NA","NA","NA","NA","NA"
"Call of Duty®: Black Ops - Rezurrection Content Pack","Sep 22 2011","1499.0","None","Very Positive","(330)","Treyarch","Activision","Action,Zombies,FPS,Survival,Co-op,+"
"Planet Coaster: Ghostbusters™","Jun 4 2019","749.0","None","Very Positive","(78)","Frontier Developments, Aspyr (Mac)","Frontier Developments, Aspyr (Mac)","Simulation,Strategy,Singleplayer,Resource Management,Management,Family Friendly,Funny,Economy,Relaxing,City Builder,Supernatural,Cute,Colorful,Third Person,Great Soundtrack,+"
"Pacific Northwest","","4404.0","NA","NA","NA","NA","NA","NA"
"Scrap Mechanic","Jan 20 2016","1999.0","Enter the creative paradise of Scrap Mechanic! Build fantastic machines, go on adventures with your friends and defend against waves of evil Farmbots in this imaginative multiplayer survival sandbox. With Scrap Mechanic’s powerful creation tools you can engineer your own adventures!","Very Positive","(1,166)","Axolot Games","Axolot Games","Building,Sandbox,Survival,Open World,Multiplayer,Crafting,Physics,Base Building,Co-op,Singleplayer,First-Person,Third Person,Adventure,Funny,Simulation,Early Access,Action,Indie,Moddable,Online Co-Op,+"
"SCP: Pandemic","Feb 22 2022","1999.0","SCP: Pandemic (Alpha) is a hardcore cooperative first-person tactical shooter. You are a rogue fireteam going against the SCP Foundation and their ongoing attempt of global omnicide. You start at Area 12, the site where the Psi-Z program is being actualized.","Very Positive","(157)","Affray Interactive","Affray LLC","Early Access,Sandbox,PvE,PvP,Character Customization,Gun Customization,Lore-Rich,Tactical,Story Rich,Realistic,Linear,Zombies,Lovecraftian,Stealth,Atmospheric,Investigation,America,Conspiracy,Combat,Inventory Management,+"
"Expansion - Hearts of Iron IV: No Step Back","Nov 23 2021","1999.0","None","Mostly Positive","(28)","Paradox Development Studio","Paradox Interactive","Strategy,Simulation,World War II,Grand Strategy,Historical,War,+"
"The Binding of Isaac: Rebirth","Nov 4 2014","1499.0","The Binding of Isaac: Rebirth is a randomly generated action RPG shooter with heavy Rogue-like elements. Following Isaac on his journey players will find bizarre treasures that change Isaac’s form giving him super human abilities and enabling him to fight off droves of mysterious creatures, discover secrets and fight his way to safety.","Overwhelmingly Positive","(3,698)","Nicalis, Inc., Edmund McMillen","Nicalis, Inc.","Action Roguelike,Roguelike,Indie,Replay Value,Difficult,Pixel Graphics,Dungeon Crawler,Great Soundtrack,Singleplayer,Dark,2D,Remake,Local Co-Op,Gore,Procedural Generation,Roguelite,Atmospheric,Action,Co-op,Horror,+"
"Tom Clancy's Rainbow Six® Siege","Dec 1 2015","1999.0","Tom Clancy's Rainbow Six Siege is the latest installment of the acclaimed first-person shooter franchise developed by the renowned Ubisoft Montreal studio.","Very Positive","(7,621)","Ubisoft Montreal","Ubisoft","FPS,Hero Shooter,Multiplayer,Tactical,Shooter,Team-Based,Action,First-Person,Competitive,Co-op,Strategy,Realistic,Online Co-Op,Destruction,Physics,Atmospheric,Singleplayer,Massively Multiplayer,Casual,Simulation,+"
"LEGO® Star Wars™ - The Complete Saga","Nov 12 2009","1999.0","Kick Some Brick in I through VI! Play through all six Star Wars movies in one videogame! Adding new characters, new levels, new features and for the first time ever, the chance to build and battle your way through a fun Star Wars galaxy on your PC!","Overwhelmingly Positive","(423)","Traveller's Tales","LucasArts, Lucasfilm, Disney","LEGO,Local Co-Op,Adventure,Co-op,Family Friendly,Multiplayer,Comedy,Singleplayer,Action,Funny,Sci-fi,Classic,Local Multiplayer,Controller,Great Soundtrack,Space,Psychological Horror,Casual,Puzzle,Open World,+"
"Overcooked! 2","Aug 7 2018","2499.0","Overcooked returns with a brand-new helping of chaotic cooking action! Journey back to the Onion Kingdom and assemble your team of chefs in classic couch co-op or online play for up to four players. Hold onto your aprons… it’s time to save the world again!","Very Positive","(516)","Ghost Town Games Ltd., Team17","Team17","Multiplayer,Online Co-Op,Local Co-Op,Casual,Co-op,Funny,Indie,Action,4 Player Local,Local Multiplayer,Family Friendly,Cute,Controller,Comedy,Cooking,Singleplayer,Difficult,Simulation,Colorful,Strategy,+"
"Stormworks: Build and Rescue","Sep 17 2020","2499.0","Join a world where you design, create and pilot your own air sea rescue service. Release your inner hero as you battle fierce storms out at sea to rescue those in need.","Very Positive","(717)","Geometa","Geometa","Sandbox,Flight,Open World,Building,Exploration,Programming,Sailing,Open World Survival Craft,Immersive Sim,Base Building,Survival,PvP,Character Customization,Tutorial,First-Person,Naval,Trains,Physics,Automation,Crafting,+"
"Monster Hunter: World","Aug 9 2018","2999.0","Welcome to a new world! In Monster Hunter: World, the latest installment in the series, you can enjoy the ultimate hunting experience, using everything at your disposal to hunt monsters in a new world teeming with surprises and excitement.","Very Positive","(1,680)","CAPCOM Co., Ltd.","CAPCOM Co., Ltd.","Co-op,Multiplayer,Action,Open World,RPG,Third Person,Character Customization,Adventure,Fantasy,Singleplayer,Difficult,Action RPG,Exploration,Great Soundtrack,Replay Value,Atmospheric,Hack and Slash,JRPG,Souls-like,MMORPG,+"
"Hearts of Iron IV: Ultimate Bundle","","15377.0","NA","NA","NA","NA","NA","NA"
"Call of Duty®: Black Ops III - Der Eisendrache Zombies Map","May 1 2018","799.0","None","Very Positive","(205)","Treyarch, Aspyr (Mac)","Activision, Aspyr (Mac)","Action,Adventure,Zombies,+"
"ULTRAKILL","Sep 3 2020","1999.0","ULTRAKILL is a fast-paced ultraviolent retro FPS combining the skill-based style scoring from character action games with unadulterated carnage inspired by the best shooters of the '90s. Rip apart your foes with varied destructive weapons and shower in their blood to regain your health.","Overwhelmingly Positive","(790)","Arsi "Hakita" Patala","New Blood Interactive","Early Access,FPS,Arena Shooter,Spectacle fighter,Character Action Game,Blood,Singleplayer,Retro,Shooter,First-Person,Difficult,Action,Old School,Robots,Silent Protagonist,3D,Sci-fi,Stylized,Cyberpunk,Colorful,+"
"Nobody Saves the World","Jan 18 2022","2249.0","Transform from a featureless nobody into a SLUG, a GHOST and a DRAGON in this new take on Action RPGs from the creators of Guacamelee! Discover 15+ distinct Forms, mix-and-match their abilities, clear evolving dungeons and... SAVE THE WORLD!?","Very Positive","(109)","DrinkBox Studios","DrinkBox Studios","RPG,Action RPG,Hack and Slash,Action,Fantasy,Dungeon Crawler,Adventure,Procedural Generation,Top-Down,2D,Magic,Action-Adventure,Funny,Class-Based,Character Customization,Hand-drawn,Cartoony,Colorful,Cartoon,Controller,+"
"Craftopia","Sep 4 2020","2499.0","Craftopia is the brand new multiplayer survival action game made in Japan. We combined many features we find enjoyable, such as hunting, farming, hack-and-slash, building, automation to develop this game.","Very Positive","(122)","Pocketpair","Pocketpair","Open World,Crafting,Survival,Multiplayer,Sandbox,Open World Survival Craft,RPG,Building,Action,Early Access,Adventure,Online Co-Op,Co-op,Indie,Anime,Hack and Slash,Character Customization,Automation,Singleplayer,Third Person,+"
"Slime Rancher","Aug 1 2017","1999.0","Slime Rancher is the tale of Beatrix LeBeau, a plucky, young rancher who sets out for a life a thousand light years away from Earth on the ‘Far, Far Range’ where she tries her hand at making a living wrangling slimes.","Overwhelmingly Positive","(1,847)","Monomi Park","Monomi Park","Cute,Exploration,Adventure,Singleplayer,Open World,First-Person,Colorful,Funny,Sandbox,Simulation,Casual,Fantasy,Management,Indie,Family Friendly,Great Soundtrack,Female Protagonist,Early Access,Action,FPS,+"
"F1® 2021","Jul 15 2021","5999.0","Every story has a beginning in F1® 2021, the official videogame of the 2021 FIA FORMULA ONE WORLD CHAMPIONSHIP™. Enjoy the stunning new features of F1® 2021, including the thrilling story experience ‘Braking Point’, two-player Career, and get even closer to the grid with ‘Real-Season Start’.","Very Positive","(2,390)","Codemasters","Electronic Arts","Racing,Driving,Sports,Immersive Sim,Automobile Sim,PvP,Controller,eSports,Split Screen,Simulation,3D,Realistic,Multiplayer,Co-op,Local Multiplayer,Cinematic,VR,Online Co-Op,Singleplayer,Arcade,+"
"Stellaris: Aquatics Species Pack","Nov 22 2021","999.0","None","Very Positive","(16)","Paradox Development Studio, Paradox Arctic","Paradox Interactive","Strategy,Simulation,Space,4X,RTS,Sci-fi,Grand Strategy,Management,Building,Adventure,Sandbox,Exploration,Diplomacy,Moddable,Military,Atmospheric,Singleplayer,Multiplayer,Real-Time with Pause,Replay Value,+"
"theHunter: Call of the Wild™","Feb 16 2017","1999.0","Experience an atmospheric hunting game like no other in this realistic and visually breathtaking open world. Immerse yourself in the atmospheric single player campaign, or share the ultimate hunting experience with friends.","Very Positive","(1,595)","Expansive Worlds","Expansive Worlds","Hunting,Open World,Multiplayer,Simulation,First-Person,Shooter,Survival,Realistic,Co-op,Adventure,FPS,Action,Singleplayer,Walking Simulator,Online Co-Op,Atmospheric,Sports,Combat,Strategy,Gore,+"
"Stellaris: Nemesis","Apr 15 2021","1999.0","None","Mixed","(1,425)","Paradox Development Studio","Paradox Interactive","Strategy,Simulation,Grand Strategy,4X,Replay Value,Sandbox,Management,Real-Time with Pause,Multiplayer,Exploration,Futuristic,Story Rich,Moddable,Diplomacy,Military,Singleplayer,Adventure,RTS,Atmospheric,Building,+"
"The Sims™ 4 City Living","Jun 18 2020","3999.0","None","Mixed","(119)","Maxis","Electronic Arts","Simulation,Singleplayer,Character Customization,Funny,Classic,+"
"Expeditions: Rome","Jan 20 2022","4499.0","Determine the destiny of Rome as you conquer foreign lands and navigate political intrigue in this turn-based RPG. Directly fight with your party of Praetorians, guide your legion to victory, and choose your own path in a story where every decision matters. How will you shape the future of Rome?","Very Positive","(148)","Logic Artists","THQ Nordic","RPG,Strategy,Party-Based RPG,Turn-Based Strategy,CRPG,Turn-Based Tactics,Tactical RPG,Rome,3D,Top-Down,Atmospheric,Historical,Tactical,Choices Matter,Story Rich,Female Protagonist,Singleplayer,Turn-Based Combat,Turn-Based,Character Customization,+"
"CarX Drift Racing Online","Nov 17 2017","1499.0","CarX Drift Racing Online is your chance to immerse yourself in the real world of drifting. Get together with friends, tune your car and burn some tires!","Overwhelmingly Positive","(1,420)","CarX Technologies, LLC","CarX Technologies, LLC","Racing,Driving,Simulation,Sports,Automobile Sim,Multiplayer,Massively Multiplayer,Open World,Arcade,Singleplayer,Controller,Local Multiplayer,Realistic,Co-op,VR,Early Access,Casual,Action,Free to Play,Games Workshop,+"
"Universe Sandbox","Aug 24 2015","2999.0","Create and destroy on an unimaginable scale... with a space simulator that merges real-time gravity, climate, collision, and material interactions to reveal the beauty of our universe and the fragility of our planet. Includes VR support for HTC Vive, Oculus Rift+Touch, and Windows Mixed Reality.","Overwhelmingly Positive","(184)","Giant Army","Giant Army","Sandbox,Space,Simulation,Physics,Science,Destruction,Realistic,God Game,Education,Early Access,Singleplayer,Open World,VR,Indie,Casual,Atmospheric,Sci-fi,Great Soundtrack,Exploration,Adventure,+"
"Resident Evil Village","May 7 2021","5999.0","NA","NA","NA","NA","NA","NA"
"The Sims™ 4 Bundle - Cats & Dogs + Seasons + City Living + Get to Work","","11996.0","NA","NA","NA","NA","NA","NA"
"LEGO® Harry Potter: Years 1-4","Jun 25 2010","499.0","Build the adventure from Privet Drive to the Triwizard Tournament and experience the magic of the first four Harry Potter stories – LEGO style! Explore Hogwarts™ School of Witchcraft and Wizardry, learn spells, brew potions and relive the adventures like never before with tongue-in-cheek humor and creative customization that is unique to...","Very Positive","(82)","TT Games","Warner Bros. Interactive Entertainment","LEGO,Adventure,Local Co-Op,Action,Magic,Family Friendly,Multiplayer,Singleplayer,Fantasy,Comedy,Open World,Split Screen,Funny,Puzzle,Co-op,Controller,Local Multiplayer,Third Person,3D Platformer,Atmospheric,+"
"LEGO® Harry Potter: Years 1-4","Jun 25 2010","499.0","Build the adventure from Privet Drive to the Triwizard Tournament and experience the magic of the first four Harry Potter stories – LEGO style! Explore Hogwarts™ School of Witchcraft and Wizardry, learn spells, brew potions and relive the adventures like never before with tongue-in-cheek humor and creative customization that is unique to...","Very Positive","(82)","TT Games","Warner Bros. Interactive Entertainment","LEGO,Adventure,Local Co-Op,Action,Magic,Family Friendly,Multiplayer,Singleplayer,Fantasy,Comedy,Open World,Split Screen,Funny,Puzzle,Co-op,Controller,Local Multiplayer,Third Person,3D Platformer,Atmospheric,+"
"The Walking Dead: Saints & Sinners","Jan 23 2020","3999.0","Saints & Sinners is a game unlike any other in The Walking Dead universe. Every challenge you face and decision you make is driven by YOU. Fight the undead, scavenge through the flooded ruins of New Orleans, and face gut-wrenching choices for you and the other survivors. Live The Walking Dead.","Very Positive","(83)","Skydance Interactive","Skydance Interactive","VR,Zombies,Action,Gore,Adventure,Shooter,Horror,Violent,Survival Horror,Survival,RPG,Singleplayer,Choices Matter,Indie,Simulation,Strategy,Open World,First-Person,FPS,Action RPG,+"
"Iron Harvest Deluxe Edition","","1849.0","NA","NA","NA","NA","NA","NA"
