title_name,realease_date,price,description,title_review,title_rating,developer,publisher,game_tags
"ELDEN RING","Feb 24 2022","5999.0","THE NEW FANTASY ACTION RPG. Rise, Tarnished, and be guided by grace to brandish the power of the Elden Ring and become an Elden Lord in the Lands Between.","Very Positive","(286,896)","FromSoftware Inc.","FromSoftware Inc., BANDAI NAMCO Entertainment","Souls-like,Relaxing,Dark Fantasy,RPG,Difficult,Action RPG,Third Person,Multiplayer,Fantasy,Open World,Online Co-Op,Action,Singleplayer,Co-op,PvP,Violent,3D,Atmospheric,Great Soundtrack,Walking Simulator,+"
"Ghostwire: Tokyo","Mar 25 2022","5999.0","Tokyo's population has vanished, and deadly supernatural forces prowl the streets. Use an arsenal of elemental abilities to unravel the truth behind the disappearance and save Tokyo.","Very Positive","(1,280)","Tango Gameworks","Bethesda Softworks","Singleplayer,Supernatural,First-Person,Action-Adventure,Action,Horror,Atmospheric,Lore-Rich,Open World,Surreal,Story Rich,Mystery,Combat,Exploration,Adventure,Cyberpunk,Realistic,FPS,VR,Dating Sim,+"
"Valve Index VR Kit","Jun 28 2019","99900.0","NA","NA","NA","NA","NA","NA"
"LEGO® Star Wars™: The Skywalker Saga","Apr 5 2022","4999.0","Play through all nine Star Wars saga films in a brand-new LEGO video game unlike any other. Experience fun-filled adventures, whimsical humor, and the freedom to fully immerse yourself in the LEGO Star Wars galaxy.","['No user reviews']","0","TT Games","Warner Bros. Games, Warner Bros. Interactive Entertainment","LEGO,Adventure,Open World,Multiplayer,Action,Space,Co-op,Sci-fi,Singleplayer,Funny,Third Person,Local Co-Op,Story Rich,Family Friendly,Epic,Great Soundtrack,Memes,Beautiful,Psychological Horror,Puzzle,+"
"Core Keeper","Mar 8 2022","1299.0","Explore an endless cavern of creatures, relics and resources in a mining sandbox adventure for 1-8 players. Mine, build, fight, craft and farm to unravel the mystery of the ancient Core.","Very Positive","(5,999)","Pugstorm","Fireshine Games","Early Access,Online Co-Op,Pixel Graphics,Sandbox,Adventure,2D,Procedural Generation,Farming Sim,Relaxing,Dungeon Crawler,Casual,Cooking,Simulation,Crafting,Exploration,Atmospheric,Survival,Building,Mining,Mystery,+"
"The Planet Crafter","Mar 24 2022","1799.0","A space survival open world terraforming crafting game. Transform the ecosystem of a hostile planet to make it livable for humans. Survive, collect, build your base then create oxygen, heat and pressure to make a brand new biosphere.","Overwhelmingly Positive","(515)","Miju Games","Miju Games","Early Access,Open World Survival Craft,Exploration,Base Building,Open World,Crafting,First-Person,Singleplayer,Space,Sci-fi,Futuristic,Sandbox,Resource Management,Automation,Immersive Sim,Mars,Survival,Colorful,Adventure,Story Rich,+"
"Ready or Not","Dec 17 2021","3999.0","Ready or Not is an intense, tactical, first-person shooter that depicts a modern-day world in which SWAT police units are called to defuse hostile and confronting situations.","Very Positive","(3,045)","VOID Interactive","VOID Interactive","Tactical,Realistic,FPS,Multiplayer,Shooter,First-Person,Co-op,Action,Singleplayer,Violent,Crime,Combat,Gun Customization,Modern,Gore,America,Atmospheric,Co-op Campaign,PvP,Early Access,+"
"Rust","Feb 8 2018","3999.0","The only aim in Rust is to survive. Everything wants you to die - the island’s wildlife and other inhabitants, the environment, other survivors. Do whatever it takes to last another night.","Very Positive","(11,195)","Facepunch Studios","Facepunch Studios","Survival,Crafting,Multiplayer,Open World,Open World Survival Craft,Building,Sandbox,PvP,Adventure,First-Person,Action,FPS,Nudity,Co-op,Shooter,Online Co-Op,Indie,Early Access,Post-apocalyptic,Simulation,+"
"WWE 2K22","Mar 11 2022","5999.0","REDESIGNED ENGINE. NEW CONTROLS. ALL THE FEATURES YOU CAN HANDLE. Get ripped out of the stands and hit with complete control of the WWE Universe. Hitting this hard has never been so easy. WWE 2K22: IT HITS DIFFERENT","Mostly Positive","(2,158)","Visual Concepts","2K","Simulation,Sports,PvP,Local Co-Op,Wrestling,Co-op,Multiplayer,Local Multiplayer,Online Co-Op,Fighting,Sexual Content,Character Customization,+"
"Dying Light 2 Stay Human","Feb 4 2022","5999.0","The virus won and civilization has fallen back to the Dark Ages. The City, one of the last human settlements, is on the brink of collapse. Use your agility and combat skills to survive, and reshape the world. Your choices matter.","Mostly Positive","(10,142)","Techland","Techland","Open World,Zombies,Co-op,Parkour,Multiplayer,Survival,Action,First-Person,Horror,Gore,Post-apocalyptic,Violent,Choices Matter,RPG,Adventure,Story Rich,Atmospheric,Singleplayer,Survival Horror,FPS,+"
"TUNIC","Mar 16 2022","2999.0","Explore a land filled with lost legends, ancient powers, and ferocious monsters in TUNIC, an isometric action game about a small fox on a big adventure.","Very Positive","(1,354)","TUNIC Team","Finji","Exploration,Puzzle,RPG,Souls-like,Metroidvania,Difficult,Action-Adventure,Cute,Action RPG,3D,Isometric,Top-Down,Controller,Nonlinear,Action,Colorful,Stylized,Family Friendly,Fantasy,Atmospheric,+"
"Risk of Rain 2: Survivors of the Void","Mar 1 2022","1499.0","None","Very Positive","(3,409)","Hopoo Games","Gearbox Publishing","Action,Indie,Co-op,Action Roguelike,Great Soundtrack,Multiplayer,Third-Person Shooter,Roguelike,Looter Shooter,Survival,Singleplayer,Difficult,+"
"Destiny 2: The Witch Queen","Feb 22 2022","3999.0","None","Very Positive","(785)","Bungie","Bungie","Action,Adventure,Free to Play,Looter Shooter,FPS,Multiplayer,Great Soundtrack,MMORPG,Shooter,First-Person,Atmospheric,Open World,Co-op,+"
"Grand Theft Auto V: Premium Edition","","1480.0","NA","NA","NA","NA","NA","NA"
"Red Dead Redemption 2","Dec 5 2019","2999.0","Winner of over 175 Game of the Year Awards and recipient of over 250 perfect scores, RDR2 is the epic tale of outlaw Arthur Morgan and the infamous Van der Linde gang, on the run across America at the dawn of the modern age. Also includes access to the shared living world of Red Dead Online.","Very Positive","(6,218)","Rockstar Games","Rockstar Games","Open World,Adventure,Story Rich,Western,Action,Multiplayer,Realistic,Shooter,Singleplayer,Atmospheric,Third-Person Shooter,Horses,Beautiful,Great Soundtrack,Mature,Third Person,Sandbox,First-Person,Gore,FPS,+"
"Hunt: Showdown","Aug 27 2019","1799.0","Hunt: Showdown is a thrilling, high-stakes PvPvE first-person shooter. Take down nightmarish monsters, as you compete for the bounties that will bring you glory, gear, and gold in this unforgiving – and unforgettable - online multiplayer experience.","Very Positive","(2,084)","Crytek","Crytek","Hunting,Dark,Tactical,FPS,Horror,Western,Perma Death,Multiplayer,PvP,Survival,Shooter,Open World,Zombies,Atmospheric,Battle Royale,Violent,Team-Based,Online Co-Op,First-Person,Action,+"
"Marvel's Guardians of the Galaxy","Oct 26 2021","2999.0","Fire up a wild ride across the cosmos with a fresh take on Marvel’s Guardians of the Galaxy. In this action-adventure game, you are Star-Lord leading the unpredictable Guardians from one explosion of chaos to the next. You got this. Probably.","Very Positive","(670)","Eidos-Montréal","Square Enix","Action,Singleplayer,Story Rich,Action-Adventure,Exploration,Third-Person Shooter,Choices Matter,Shooter,Adventure,Superhero,Comedy,Sci-fi,Space,Cinematic,Atmospheric,Aliens,Great Soundtrack,Realistic,Violent,RPG,+"
"Phasmophobia","Sep 18 2020","1399.0","Phasmophobia is a 4 player online co-op psychological horror. Paranormal activity is on the rise and it’s up to you and your team to use all the ghost hunting equipment at your disposal in order to gather as much evidence as you can.","Overwhelmingly Positive","(7,014)","Kinetic Games","Kinetic Games","Horror,Online Co-Op,Multiplayer,Psychological Horror,Co-op,VR,Supernatural,First-Person,Investigation,Dark,Mystery,Demons,Detective,Early Access,3D,Thriller,Indie,Action,Tactical,Lovecraftian,+"
"NieR Replicant™ ver.1.22474487139...","Apr 23 2021","2999.0","The upgraded prequel of NieR:Automata. A kind young man sets out with Grimoire Weiss, a strange talking book, to search for the "Sealed verses" in order to save his sister Yonah, who fell terminally ill to the Black Scrawl.","Very Positive","(296)","Square Enix, Toylogic Inc.","Square Enix","Great Soundtrack,Story Rich,Action,RPG,Adventure,JRPG,Singleplayer,Atmospheric,Hack and Slash,Post-apocalyptic,Anime,Bullet Hell,Cult Classic,Dark Fantasy,Action RPG,Nudity,Violent,Magic,Character Action Game,Dark Humor,+"
"Destiny 2: The Witch Queen Deluxe + Bungie 30th Anniversary Bundle","Feb 22 2022","9999.0","None","Very Positive","(37)","Bungie","Bungie","Action,Adventure,Free to Play,FPS,MMORPG,Shooter,+"
"Sea of Thieves","Jun 3 2020","3999.0","Sea of Thieves offers the essential pirate experience, from sailing and fighting to exploring and looting – everything you need to live the pirate life and become a legend in your own right. With no set roles, you have complete freedom to approach the world, and other players, however you choose.","Very Positive","(4,236)","Rare Ltd","Xbox Game Studios","Adventure,Multiplayer,Open World,Pirates,Action,Co-op,Online Co-Op,Sailing,PvP,First-Person,Exploration,Naval,Funny,PvE,Atmospheric,Massively Multiplayer,Great Soundtrack,Swordplay,FPS,Singleplayer,+"
"Sid Meier’s Civilization® VI Anthology","","2988.0","NA","NA","NA","NA","NA","NA"
"Destiny 2: The Witch Queen Deluxe Edition","Feb 22 2022","7999.0","None","Very Positive","(439)","Bungie","Bungie","Action,Adventure,Free to Play,Multiplayer,Shooter,First-Person,FPS,Story Rich,MMORPG,Sci-fi,Co-op,Great Soundtrack,Open World,Looter Shooter,Atmospheric,+"
"Risk of Rain 2","Aug 11 2020","2499.0","Escape a chaotic alien planet by fighting through hordes of frenzied monsters – with your friends, or on your own. Combine loot in surprising ways and master each character until you become the havoc you feared upon your first crash landing.","Overwhelmingly Positive","(6,873)","Hopoo Games","Gearbox Publishing","Third-Person Shooter,Action Roguelike,Multiplayer,Action,Roguelite,Co-op,Looter Shooter,Roguelike,Loot,Shooter,Online Co-Op,Difficult,Third Person,Indie,Survival,Singleplayer,Soundtrack,Great Soundtrack,Early Access,Bullet Hell,+"
"Project Zomboid","Nov 8 2013","1999.0","Project Zomboid is the ultimate in zombie survival. Alone or in MP: you loot, build, craft, fight, farm and fish in a struggle to survive. A hardcore RPG skillset, a vast map, massively customisable sandbox and a cute tutorial raccoon await the unwary. So how will you die? All it takes is a bite..","Very Positive","(4,370)","The Indie Stone","The Indie Stone","Survival,Zombies,Open World,Open World Survival Craft,Multiplayer,Sandbox,Post-apocalyptic,Crafting,Co-op,Indie,Simulation,RPG,Building,Survival Horror,Realistic,Isometric,Singleplayer,Early Access,2D,Adventure,+"
"Hell Let Loose","Jul 27 2021","3999.0","Join the ever expanding experience of Hell Let Loose - a hardcore World War Two first person shooter with epic battles of 100 players with infantry, tanks, artillery, a dynamically shifting front line and a unique resource based RTS-inspired meta-game.","Very Positive","(1,799)","Black Matter Pty Ltd","Team17","Action,Shooter,World War II,FPS,Multiplayer,Realistic,War,Simulation,Tactical,First-Person,Military,Singleplayer,PvP,Strategy,Massively Multiplayer,Historical,Gore,Mature,Violent,Indie,+"
"Forza Horizon 5","Nov 9 2021","5999.0","Your Ultimate Horizon Adventure awaits! Explore the vibrant and ever-evolving open world landscapes of Mexico with limitless, fun driving action in hundreds of the world’s greatest cars. Begin Your Horizon Adventure today and add to your Wishlist!","Very Positive","(3,239)","Playground Games","Xbox Game Studios","Racing,Open World,Driving,Adventure,Multiplayer,Automobile Sim,Simulation,Realistic,Exploration,Arcade,First-Person,Atmospheric,Sports,PvP,Co-op,Online Co-Op,Singleplayer,Beautiful,Action,Third Person,+"
"STAR WARS Jedi: Fallen Order Deluxe Edition","Nov 15 2019","999.0","A galaxy-spanning adventure awaits in Star Wars Jedi: Fallen Order, a 3rd person action-adventure title from Respawn. An abandoned Padawan must complete his training, develop new powerful Force abilities, and master the art of the lightsaber - all while staying one step ahead of the Empire.","Very Positive","(1,576)","Respawn Entertainment","Electronic Arts","Action-Adventure,Souls-like,Third Person,Swordplay,Platformer,Open World,Story Rich,Exploration,Action,RPG,Sci-fi,Space,Fighting,Metroidvania,Fantasy,Puzzle,Adventure,Hack and Slash,Atmospheric,Family Friendly,+"
"God of War","Jan 14 2022","4999.0","His vengeance against the Gods of Olympus years behind him, Kratos now lives as a man in the realm of Norse Gods and monsters. It is in this harsh, unforgiving world that he must fight to survive… and teach his son to do the same.","Overwhelmingly Positive","(2,505)","Santa Monica Studio","PlayStation PC LLC","Action,Adventure,Story Rich,Singleplayer,Mythology,Third Person,Combat,Violent,RPG,Fantasy,Exploration,Atmospheric,Hack and Slash,Emotional,Gore,Action RPG,Souls-like,3D,PvE,Crafting,+"
"Stardew Valley","Feb 26 2016","1499.0","You've inherited your grandfather's old farm plot in Stardew Valley. Armed with hand-me-down tools and a few coins, you set out to begin your new life. Can you learn to live off the land and turn these overgrown fields into a thriving home?","Overwhelmingly Positive","(6,717)","ConcernedApe","ConcernedApe","Farming Sim,Life Sim,Pixel Graphics,RPG,Multiplayer,Relaxing,Agriculture,Simulation,Crafting,Sandbox,Indie,Building,Singleplayer,Casual,Open World,2D,Great Soundtrack,Cute,Dating Sim,Fishing,+"
"It Takes Two","Mar 26 2021","1599.0","Embark on the craziest journey of your life in It Takes Two. Invite a friend to join for free with Friend’s Pass and work together across a huge variety of gleefully disruptive gameplay challenges. Winner of GAME OF THE YEAR at the Game Awards 2021.","Very Positive","(4,160)","Hazelight","Electronic Arts","Co-op,Split Screen,Multiplayer,Adventure,Puzzle,Local Co-Op,Online Co-Op,Story Rich,Puzzle Platformer,Local Multiplayer,3D Platformer,Co-op Campaign,Platformer,Action-Adventure,Action,Emotional,Female Protagonist,Atmospheric,Exploration,Minigames,+"
"NieR:Automata™","Mar 17 2017","1999.0","NieR: Automata tells the story of androids 2B, 9S and A2 and their battle to reclaim the machine-driven dystopia overrun by powerful machines.","Very Positive","(1,062)","Square Enix, PlatinumGames Inc.","Square Enix","Great Soundtrack,Story Rich,Female Protagonist,Action,Hack and Slash,RPG,Open World,JRPG,Anime,Post-apocalyptic,Singleplayer,Robots,Atmospheric,Sci-fi,Nudity,Adventure,Spectacle fighter,Bullet Hell,Character Action Game,Violent,+"
"Ghostwire: Tokyo","Mar 25 2022","5999.0","Tokyo's population has vanished, and deadly supernatural forces prowl the streets. Use an arsenal of elemental abilities to unravel the truth behind the disappearance and save Tokyo.","Very Positive","(1,280)","Tango Gameworks","Bethesda Softworks","Singleplayer,Supernatural,First-Person,Action-Adventure,Action,Horror,Atmospheric,Lore-Rich,Open World,Surreal,Story Rich,Mystery,Combat,Exploration,Adventure,Cyberpunk,Realistic,FPS,VR,Dating Sim,+"
"Squad","Sep 23 2020","4999.0","Squad is a tactical FPS that provides authentic combat experiences through teamwork, constant communication, and gameplay. It bridges the large gap between arcade shooter and military simulation with 100 player battles, combined arms combat, base building, and a great integrated VoIP system","Very Positive","(1,913)","Offworld Industries","Offworld Industries","Military,Realistic,FPS,Multiplayer,Tactical,Shooter,War,Team-Based,Action,First-Person,Strategy,Simulation,Open World,Co-op,Massively Multiplayer,Early Access,Atmospheric,Walking Simulator,Indie,Singleplayer,+"
"Raft","May 23 2018","1999.0","Raft throws you and your friends into an epic oceanic adventure! Alone or together, players battle to survive a perilous voyage across a vast sea! Gather debris, scavenge reefs and build your own floating home, but be wary of the man-eating sharks!","Very Positive","(3,220)","Redbeet Interactive","Axolot Games","Survival,Open World Survival Craft,Multiplayer,Co-op,Crafting,Open World,Building,Base Building,Online Co-Op,Adventure,Sandbox,Early Access,First-Person,Singleplayer,Underwater,Simulation,Action,Indie,Strategy,Massively Multiplayer,+"
"PowerWash Simulator","May 19 2021","1699.0","Release the Pressure with PowerWash Simulator! Wash away your worries with the soothing sounds of high-pressure water. Fire up your power washer and blast away every speck of dirt and grime you can find, all with the simple satisfaction of power-washing to a sparkling finish.","Overwhelmingly Positive","(1,130)","FuturLab","Square Enix","Simulation,Casual,Indie,Relaxing,Singleplayer,Early Access,Family Friendly,First-Person,Colorful,3D,Realistic,Atmospheric,FPS,Multiplayer,Co-op,Online Co-Op,Story Rich,Funny,NSFW,Sexual Content,+"
"Valheim","Feb 2 2021","1999.0","A brutal exploration and survival game for 1-10 players, set in a procedurally-generated purgatory inspired by viking culture. Battle, build, and conquer your way to a saga worthy of Odin’s patronage!","Very Positive","(4,190)","Iron Gate AB","Coffee Stain Publishing","Open World Survival Craft,Survival,Online Co-Op,Open World,Multiplayer,Building,Crafting,Exploration,Co-op,Base Building,Sandbox,Adventure,Mythology,RPG,Sailing,Early Access,Action,Indie,PvP,Fishing,+"
"Call of Duty®: Black Ops III","Nov 6 2015","5999.0","Call of Duty®: Black Ops III Zombies Chronicles Edition includes the full base game plus the Zombies Chronicles content expansion.","Very Positive","(1,479)","Treyarch, Aspyr (Mac)","Activision, Aspyr (Mac)","Multiplayer,FPS,Zombies,Shooter,Action,First-Person,Co-op,Singleplayer,Futuristic,Illuminati,Hero Shooter,Robots,Sci-fi,Gore,Great Soundtrack,Story Rich,Atmospheric,Quick-Time Events,Parkour,Simulation,+"
"Wartales","Dec 1 2021","2799.0","Wartales is an open world RPG in which you lead a group of mercenaries in their search for wealth across a massive medieval universe. Explore the world, recruit companions, collect bounties and unravel the secrets of the tombs of the ancients!","Very Positive","(324)","Shiro Games","Shiro Unlimited","RPG,Open World,Turn-Based Strategy,Adventure,Medieval,Strategy,Exploration,Singleplayer,Early Access,Indie,Tactical RPG,Story Rich,Survival,3D,Sandbox,Turn-Based Combat,Violent,Fantasy,Turn-Based,Tactical,+"
"The Forest","Apr 30 2018","1999.0","As the lone survivor of a passenger jet crash, you find yourself in a mysterious forest battling to stay alive against a society of cannibalistic mutants. Build, explore, survive in this terrifying first person survival horror simulator.","Overwhelmingly Positive","(4,505)","Endnight Games Ltd","Endnight Games Ltd","Open World Survival Craft,Survival,Open World,Horror,Crafting,Adventure,Building,Survival Horror,First-Person,Action,Exploration,Sandbox,Atmospheric,Singleplayer,Simulation,Indie,Realistic,Gore,Early Access,Zombies,+"
"Farming Simulator 22","Nov 22 2021","4999.0","Create your farm and let the good times grow! Harvest crops, tend to animals, manage productions, and take on seasonal challenges.","Very Positive","(1,271)","Giants Software","Giants Software","Co-op,Simulation,Farming Sim,Agriculture,Moddable,Management,Sandbox,Immersive Sim,3D,First-Person,Multiplayer,Character Customization,Online Co-Op,Economy,Family Friendly,Third Person,Open World,America,Horses,Nature,+"
"Cities: Skylines - New Player Bundle","","2471.0","NA","NA","NA","NA","NA","NA"
"Cities: Skylines Collection","","13311.0","NA","NA","NA","NA","NA","NA"
"Mass Effect™ Legendary Edition","May 14 2021","2459.0","The Mass Effect™ Legendary Edition includes single-player base content and over 40 DLC from the highly acclaimed Mass Effect, Mass Effect 2, and Mass Effect 3 games, including promo weapons, armors, and packs — remastered and optimized for 4K Ultra HD.","Very Positive","(597)","BioWare","Electronic Arts","RPG,Story Rich,Sci-fi,Choices Matter,Action,Singleplayer,Third-Person Shooter,Space,Action RPG,Character Customization,Shooter,Sexual Content,Great Soundtrack,Atmospheric,Military,Combat,Nudity,Classic,Tactical RPG,Female Protagonist,+"
"Marvel's Guardians of the Galaxy Deluxe Edition","","3479.0","NA","NA","NA","NA","NA","NA"
"ARK: Survival Evolved","Aug 27 2017","2999.0","Stranded on the shores of a mysterious island, you must learn to survive. Use your cunning to kill or tame the primeval creatures roaming the land, and encounter other players to survive, dominate... and escape!","Very Positive","(4,753)","Studio Wildcard, Instinct Games, Efecto Studios, Virtual Basement LLC","Studio Wildcard","Open World Survival Craft,Survival,Open World,Multiplayer,Dinosaurs,Crafting,Building,Adventure,Base Building,Co-op,Action,First-Person,Sandbox,Massively Multiplayer,Singleplayer,Early Access,RPG,Dragons,Sci-fi,Indie,+"
"Age of Empires IV","Oct 28 2021","5999.0","One of the most beloved real-time strategy games returns to glory with Age of Empires IV, putting you at the center of epic historical battles that shaped the world.","Very Positive","(815)","Relic Entertainment, World's Edge","Xbox Game Studios","Strategy,RTS,Medieval,Multiplayer,Singleplayer,Historical,War,Resource Management,Base Building,Action RTS,PvP,PvE,City Builder,3D,Isometric,Co-op,Management,Open World,Sexual Content,Online Co-Op,+"
"Sekiro™: Shadows Die Twice - GOTY Edition","Mar 21 2019","5999.0","Game of the Year - The Game Awards 2019 Best Action Game of 2019 - IGN Carve your own clever path to vengeance in the award winning adventure from developer FromSoftware, creators of Bloodborne and the Dark Souls series. Take Revenge. Restore Your Honor. Kill Ingeniously.","Overwhelmingly Positive","(2,845)","FromSoftware","Activision (Excluding Japan and Asia), FromSoftware (Japan), 方块游戏 (Asia)","Souls-like,Difficult,Action,Singleplayer,Ninja,Stealth,Adventure,Third Person,Open World,Story Rich,Atmospheric,Violent,Assassin,Dark Fantasy,Hack and Slash,Great Soundtrack,RPG,Gore,Dark,Rhythm,+"
"World War 3","Oct 20 2018","1499.0","World War 3 is a tactical online multiplayer FPS where the world is your battleground. Outgun the enemy in thrilling, team-based skirmishes with a huge arsenal of weapons, vehicles, gadgets, and drones at your disposal.","Mostly Positive","(1,895)","The Farm 51","MY.GAMES, The 4 Winds Entertainment","FPS,Multiplayer,Tactical,Shooter,Military,War,Modern,Action,PvP,Team-Based,Combat,First-Person,Realistic,Character Customization,Gun Customization,Early Access,Atmospheric,Physics,3D,Vehicular Combat,+"
"DayZ","Dec 13 2018","4499.0","How long can you survive a post-apocalyptic world? A land overrun with an infected "zombie" population, where you compete with other survivors for limited resources. Will you team up with strangers and stay strong together? Or play as a lone wolf to avoid betrayal? This is DayZ – this is your story.","Very Positive","(2,258)","Bohemia Interactive","Bohemia Interactive","Survival,Zombies,Multiplayer,Open World,Action,PvP,Shooter,Massively Multiplayer,Horror,Post-apocalyptic,Simulation,Early Access,FPS,First-Person,Survival Horror,Sandbox,Adventure,Co-op,Atmospheric,Indie,+"
"Animal Shelter","Mar 23 2022","1799.0","In Animal Shelter, your main target is to make your four-legged friends happy. Pet them, hand out treats, play with toys - and they will pay you back with great trust. Get to know the animals well enough to find them the best home! Don't wait any longer, open your animal shelter now!","Very Positive","(218)","Games Incubator","Games Incubator, PlayWay S.A.","Life Sim,Dog,Cats,Education,Casual,Singleplayer,Adventure,Family Friendly,Realistic,Simulation,Indie,Cute,Immersive Sim,Atmospheric,Management,First-Person,Relaxing,Building,Modern,Experience,+"
"BeamNG.drive","May 29 2015","2499.0","A dynamic soft-body physics vehicle simulator capable of doing just about anything.","Overwhelmingly Positive","(3,367)","BeamNG","BeamNG","Simulation,Driving,Physics,Destruction,Automobile Sim,Realistic,Open World,Sandbox,Racing,Moddable,Singleplayer,Early Access,Multiplayer,Exploration,First-Person,Third Person,Funny,Action,Adventure,Flight,+"
"Halo: The Master Chief Collection","Dec 3 2019","3999.0","NA","NA","NA","NA","NA","NA"
"Five Nights at Freddy's: Security Breach","Dec 17 2021","3999.0","In Five Nights at Freddy’s: Security Breach, play as Gregory, a young boy who’s been trapped overnight inside of Freddy Fazbear’s Mega Pizzaplex. With the help of Freddy himself, Gregory must uncover the secrets of the Pizzaplex, learn the truth, and survive until dawn.","Very Positive","(2,913)","Steel Wool Studios","ScottGames","Horror,Survival Horror,Singleplayer,Robots,Stealth,Exploration,Multiple Endings,First-Person,3D,Action,Indie,Adventure,Artificial Intelligence,Story Rich,Thriller,Action-Adventure,Colorful,Family Friendly,Cartoony,Sexual Content,+"
"Risk of Rain 2 + Survivors of the Void Expansion","","3478.0","NA","NA","NA","NA","NA","NA"
"Lost Ark Vanquisher Starter Pack","Feb 11 2022","6499.0","None","Mixed","(64)","Smilegate RPG","Amazon Games","RPG,Free to Play,Action,Massively Multiplayer,Adventure,Sexual Content,Gore,Violent,+"
