title_name,realease_date,price,description,title_review,title_rating,developer,publisher,game_tags
"ELDEN RING","Feb 24 2022","5999.0","THE NEW FANTASY ACTION RPG. Rise, Tarnished, and be guided by grace to brandish the power of the Elden Ring and become an Elden Lord in the Lands Between.","Very Positive","(183,113)","FromSoftware Inc.","FromSoftware Inc., BANDAI NAMCO Entertainment","Souls-like,Dark Fantasy,Relaxing,RPG,Difficult,Action RPG,Third Person,Multiplayer,Fantasy,Action,Online Co-Op,Singleplayer,Co-op,PvP,Open World,Violent,3D,Great Soundtrack,Atmospheric,Walking Simulator,+"
"Dead by Daylight - Sadako Rising Chapter","Mar 8 2022","699.0","None","Very Positive","(159)","Behaviour Interactive Inc.","Behaviour Interactive","Action,Gore,Violent,+"
"Valve Index VR Kit","Jun 28 2019","99900.0","NA","NA","NA","NA","NA","NA"
"Core Keeper","Mar 8 2022","1169.0","Explore an endless cavern of creatures, relics and resources in a mining sandbox adventure for 1-8 players. Mine, build, fight, craft and farm to unravel the mystery of the ancient Core.","Very Positive","(231)","Pugstorm","Fireshine Games","Early Access,Online Co-Op,Adventure,Pixel Graphics,Sandbox,2D,Procedural Generation,Relaxing,Casual,Farming Sim,Dungeon Crawler,Cooking,Simulation,Atmospheric,Exploration,Crafting,Building,Survival,Mining,Mystery,+"
"Have a Nice Death","Mar 8 2022","1499.0","Have a Nice Death is a 2D action roguelike where you play as an overworked Death, whose employees have run rampant, completely throwing off the balance of souls - and his vacation plans. In order to restore order, you'll have to grab your trusty scythe and show your employees who's boss.","Very Positive","(130)","Magic Design Studios","Gearbox Publishing","Singleplayer,Action Roguelike,Action,2D Platformer,2D,Dark Humor,Controller,Cartoony,Cartoon,Early Access,Gothic,Comedy,Combat,Arcade,Hack and Slash,Funny,Platformer,Roguelike,Indie,Metroidvania,+"
"Risk of Rain 2: Survivors of the Void","Mar 1 2022","1499.0","None","Very Positive","(2,906)","Hopoo Games","Gearbox Publishing","Action,Indie,Co-op,Action Roguelike,Multiplayer,Great Soundtrack,Third-Person Shooter,Roguelike,Looter Shooter,Survival,Singleplayer,Difficult,+"
"Steam Deck","","39900.0","NA","NA","NA","NA","NA","NA"
"Steam Deck","","39900.0","NA","NA","NA","NA","NA","NA"
"Steam Deck","","39900.0","NA","NA","NA","NA","NA","NA"
"WWE 2K22","Mar 11 2022","5999.0","REDESIGNED ENGINE. NEW CONTROLS. ALL THE FEATURES YOU CAN HANDLE. Get ripped out of the stands and hit with complete control of the WWE Universe. Hitting this hard has never been so easy. WWE 2K22: IT HITS DIFFERENT","['No user reviews']","0","Visual Concepts","2K","Simulation,Sports,PvP,Wrestling,Co-op,Local Co-Op,Multiplayer,Online Co-Op,Fighting,Local Multiplayer,+"
"Jurassic World Evolution 2: Camp Cretaceous Dinosaur Pack","Mar 8 2022","999.0","None","Mostly Positive","(20)","Frontier Developments","Frontier Developments","Simulation,Strategy,Action,Casual,Dinosaurs,Building,Singleplayer,Survival,Open World,Sandbox,Sci-fi,Historical,Atmospheric,City Builder,Violent,Economy,Sequel,Management,Resource Management,+"
"WWE 2K22","Mar 11 2022","5999.0","REDESIGNED ENGINE. NEW CONTROLS. ALL THE FEATURES YOU CAN HANDLE. Get ripped out of the stands and hit with complete control of the WWE Universe. Hitting this hard has never been so easy. WWE 2K22: IT HITS DIFFERENT","['No user reviews']","0","Visual Concepts","2K","Simulation,Sports,PvP,Wrestling,Co-op,Local Co-Op,Multiplayer,Online Co-Op,Fighting,Local Multiplayer,+"
"Destiny 2: The Witch Queen","Feb 22 2022","3999.0","None","Very Positive","(1,160)","Bungie","Bungie","Action,Adventure,Free to Play,Looter Shooter,FPS,Multiplayer,Great Soundtrack,MMORPG,Shooter,First-Person,Atmospheric,Open World,Co-op,+"
"Jurassic World Evolution 2: Premium Edition","","5684.0","NA","NA","NA","NA","NA","NA"
"Dying Light 2 Stay Human","Feb 4 2022","5999.0","The virus won and civilization has fallen back to the Dark Ages. The City, one of the last human settlements, is on the brink of collapse. Use your agility and combat skills to survive, and reshape the world. Your choices matter.","Very Positive","(45,705)","Techland","Techland","Open World,Zombies,Co-op,Parkour,Multiplayer,Survival,Action,First-Person,Horror,Gore,Post-apocalyptic,Violent,Choices Matter,RPG,Adventure,Story Rich,Atmospheric,Singleplayer,FPS,Survival Horror,+"
"Jurassic World Evolution 2","Nov 9 2021","3599.0","Jurassic World Evolution 2 is the much-anticipated sequel to Frontier’s highly successful Jurassic World Evolution. This bold new era in the Jurassic World Evolution game franchise builds upon the ground-breaking and immersive 2018 management simulation.","Very Positive","(558)","Frontier Developments","Frontier Developments","Dinosaurs,Simulation,Building,Management,Strategy,Sandbox,Singleplayer,Sci-fi,City Builder,Economy,Resource Management,Open World,Violent,Atmospheric,Action,Sequel,Survival,Multiplayer,Base Building,VR,+"
"Squad","Sep 23 2020","3749.0","Squad is a tactical FPS that provides authentic combat experiences through teamwork, constant communication, and gameplay. It bridges the large gap between arcade shooter and military simulation with 100 player battles, combined arms combat, base building, and a great integrated VoIP system","Very Positive","(1,703)","Offworld Industries","Offworld Industries","Military,Realistic,FPS,Multiplayer,Tactical,Shooter,War,Team-Based,Action,First-Person,Strategy,Simulation,Open World,Co-op,Massively Multiplayer,Early Access,Atmospheric,Walking Simulator,Indie,Singleplayer,+"
"Destiny 2: The Witch Queen Deluxe + Bungie 30th Anniversary Bundle","Feb 22 2022","9999.0","None","Positive","(45)","Bungie","Bungie","Action,Adventure,Free to Play,FPS,MMORPG,+"
"Lost Ark Vanquisher Starter Pack","Feb 11 2022","6499.0","None","Mixed","(452)","Smilegate RPG","Amazon Games","RPG,Free to Play,Action,Massively Multiplayer,Adventure,Sexual Content,Gore,Violent,+"
"Rust","Feb 8 2018","3999.0","The only aim in Rust is to survive. Everything wants you to die - the island’s wildlife and other inhabitants, the environment, other survivors. Do whatever it takes to last another night.","Very Positive","(12,435)","Facepunch Studios","Facepunch Studios","Survival,Crafting,Multiplayer,Open World,Open World Survival Craft,Building,Sandbox,PvP,Adventure,First-Person,Action,FPS,Nudity,Co-op,Shooter,Online Co-Op,Indie,Early Access,Post-apocalyptic,Simulation,+"
"Grand Theft Auto V: Premium Edition","","2998.0","NA","NA","NA","NA","NA","NA"
"Ready or Not","Dec 17 2021","3999.0","Ready or Not is an intense, tactical, first-person shooter that depicts a modern-day world in which SWAT police units are called to defuse hostile and confronting situations.","Very Positive","(4,176)","VOID Interactive","VOID Interactive","Tactical,Realistic,Multiplayer,FPS,Shooter,First-Person,Co-op,Action,Singleplayer,Violent,Crime,Combat,Gun Customization,Modern,Gore,Atmospheric,America,Co-op Campaign,PvP,Early Access,+"
"Risk of Rain 2","Aug 11 2020","2499.0","Escape a chaotic alien planet by fighting through hordes of frenzied monsters – with your friends, or on your own. Combine loot in surprising ways and master each character until you become the havoc you feared upon your first crash landing.","Overwhelmingly Positive","(4,792)","Hopoo Games","Gearbox Publishing","Third-Person Shooter,Action Roguelike,Multiplayer,Action,Roguelite,Co-op,Looter Shooter,Roguelike,Loot,Shooter,Online Co-Op,Difficult,Third Person,Indie,Survival,Singleplayer,Soundtrack,Great Soundtrack,Early Access,Bullet Hell,+"
"Total War: WARHAMMER III","Feb 17 2022","5999.0","The cataclysmic conclusion to the Total War: WARHAMMER trilogy is here. Rally your forces and step into the Realm of Chaos, a dimension of mind-bending horror where the very fate of the world will be decided. Will you conquer your Daemons… or command them?","Mixed","(24,427)","CREATIVE ASSEMBLY","SEGA, Feral Interactive","Strategy,Grand Strategy,Turn-Based Strategy,RTS,Action,Real Time Tactics,Dark Fantasy,Fantasy,War,Atmospheric,Colorful,Tactical,PvP,Story Rich,Multiplayer,Co-op,Warhammer 40K,Games Workshop,Online Co-Op,Singleplayer,+"
"Destiny 2: The Witch Queen Deluxe Edition","Feb 22 2022","7999.0","None","Very Positive","(668)","Bungie","Bungie","Action,Adventure,Free to Play,Multiplayer,Shooter,First-Person,FPS,Story Rich,MMORPG,Sci-fi,Co-op,Great Soundtrack,Open World,Atmospheric,Looter Shooter,+"
"Hell Hath No Fury","","2506.0","NA","NA","NA","NA","NA","NA"
"Project Zomboid","Nov 8 2013","1999.0","Project Zomboid is the ultimate in zombie survival. Alone or in MP: you loot, build, craft, fight, farm and fish in a struggle to survive. A hardcore RPG skillset, a vast map, massively customisable sandbox and a cute tutorial raccoon await the unwary. So how will you die? All it takes is a bite..","Very Positive","(5,232)","The Indie Stone","The Indie Stone","Survival,Zombies,Open World,Open World Survival Craft,Multiplayer,Sandbox,Post-apocalyptic,Crafting,Co-op,Indie,Simulation,RPG,Building,Survival Horror,Realistic,Isometric,Singleplayer,Early Access,2D,Adventure,+"
"Unpacking","Nov 2 2021","1599.0","Unpacking is a zen puzzle game about the familiar experience of pulling possessions out of boxes and fitting them into a new home. Part block-fitting puzzle, part home decoration, you are invited to create a satisfying living space while learning clues about the life you’re unpacking.","Very Positive","(1,259)","Witch Beam","Humble Games","Relaxing,Story Rich,Pixel Graphics,Cute,Casual,Simulation,Life Sim,Puzzle,Singleplayer,Atmospheric,Indie,Isometric,Female Protagonist,Family Friendly,Point & Click,Colorful,Inventory Management,Hidden Object,Experimental,2D,+"
"Airborne Kingdom","Mar 7 2022","1999.0","The sky city builder awaits. Create your own flying kingdom and lead it on a quest across an expansive world. Explore the varied landscape, build up a floating metropolis, aid struggling people below, uncover lost secrets and, ultimately, bring back the Airborne Kingdom legend.","Very Positive","(80)","The Wandering Band LLC","Freedom Games","City Builder,Base Building,Simulation,Strategy,Exploration,Building,Indie,Sandbox,Singleplayer,3D,Stylized,Colorful,Relaxing,Economy,Real-Time with Pause,Resource Management,+"
"Hearts of Iron IV","Jun 6 2016","999.0","Victory is at your fingertips! Your ability to lead your nation is your supreme weapon, the strategy game Hearts of Iron IV lets you take command of any nation in World War II; the most engaging conflict in world history.","Very Positive","(3,207)","Paradox Development Studio","Paradox Interactive","Strategy,World War II,Grand Strategy,Historical,War,Military,Alternate History,Multiplayer,Simulation,Tactical,Real-Time with Pause,RTS,Singleplayer,Diplomacy,Sandbox,Co-op,Great Soundtrack,Open World,Action,Casual,+"
"Hunt: Showdown - They Came From Salem","Mar 8 2022","899.0","NA","NA","NA","NA","NA","NA"
"Risk of Rain 2 + Survivors of the Void Expansion","","3478.0","NA","NA","NA","NA","NA","NA"
"God of War","Jan 14 2022","4999.0","His vengeance against the Gods of Olympus years behind him, Kratos now lives as a man in the realm of Norse Gods and monsters. It is in this harsh, unforgiving world that he must fight to survive… and teach his son to do the same.","Overwhelmingly Positive","(5,038)","Santa Monica Studio","PlayStation PC LLC","Action,Adventure,Singleplayer,Story Rich,Mythology,Third Person,Combat,Violent,RPG,Fantasy,Exploration,Atmospheric,Hack and Slash,Emotional,Gore,Action RPG,Souls-like,3D,PvE,Crafting,+"
"LEGO® Star Wars™: The Skywalker Saga","Apr 5 2022","4999.0","Play through all nine Star Wars saga films in a brand-new LEGO video game unlike any other. Experience fun-filled adventures, whimsical humor, and the freedom to fully immerse yourself in the LEGO Star Wars galaxy.","['No user reviews']","0","TT Games","Warner Bros. Games, Warner Bros. Interactive Entertainment","LEGO,Adventure,Open World,Action,Multiplayer,Space,Co-op,Sci-fi,Singleplayer,Funny,Third Person,Local Co-Op,Story Rich,Epic,Family Friendly,Great Soundtrack,Memes,Beautiful,Psychological Horror,Puzzle,+"
"LEGO® Star Wars™: The Skywalker Saga","Apr 5 2022","4999.0","Play through all nine Star Wars saga films in a brand-new LEGO video game unlike any other. Experience fun-filled adventures, whimsical humor, and the freedom to fully immerse yourself in the LEGO Star Wars galaxy.","['No user reviews']","0","TT Games","Warner Bros. Games, Warner Bros. Interactive Entertainment","LEGO,Adventure,Open World,Action,Multiplayer,Space,Co-op,Sci-fi,Singleplayer,Funny,Third Person,Local Co-Op,Story Rich,Epic,Family Friendly,Great Soundtrack,Memes,Beautiful,Psychological Horror,Puzzle,+"
"WWE 2K22","Mar 11 2022","5999.0","REDESIGNED ENGINE. NEW CONTROLS. ALL THE FEATURES YOU CAN HANDLE. Get ripped out of the stands and hit with complete control of the WWE Universe. Hitting this hard has never been so easy. WWE 2K22: IT HITS DIFFERENT","['No user reviews']","0","Visual Concepts","2K","Simulation,Sports,PvP,Wrestling,Co-op,Local Co-Op,Multiplayer,Online Co-Op,Fighting,Local Multiplayer,+"
"Spyro™ Reignited Trilogy","Sep 3 2019","1399.0","Same sick burns, same smoldering attitude, now all scaled up in stunning HD, Spyro is back in the Spyro™ Reignited Trilogy! Rekindle the fire with remastered versions of the original three games, Spyro™ the Dragon, Spyro™ 2: Ripto's Rage! and Spyro™: Year of the Dragon.","Very Positive","(112)","Toys for Bob, Iron Galaxy","Activision","Adventure,3D Platformer,Remake,Dragons,Action,Classic,Family Friendly,Singleplayer,Cute,Platformer,Colorful,Fantasy,Cult Classic,Casual,Great Soundtrack,Cartoony,Collectathon,Third Person,Atmospheric,Funny,+"
"Crash Bandicoot™ N. Sane Trilogy","Jun 29 2018","1999.0","Your favorite marsupial, Crash Bandicoot™, is back! He’s enhanced, entranced and ready-to-dance with the N. Sane Trilogy. Relive all your favorite moments in Crash Bandicoot™, Crash Bandicoot™ 2: Cortex Strikes Back and Crash Bandicoot™ 3: Warped, now in fully-remastered graphical glory!","Very Positive","(97)","Vicarious Visions, Iron Galaxy","Activision","3D Platformer,Remake,Classic,Platformer,Singleplayer,Difficult,Adventure,Great Soundtrack,Action,Funny,Cartoony,Colorful,Family Friendly,Controller,Retro,1990's,Comedy,Third Person,Souls-like,Cute,+"
"Fallout 76: Atoms","Apr 14 2020","499.0","None","['No user reviews']","0","Bethesda Game Studios","Bethesda Softworks","Psychological Horror,Capitalism,Dark Comedy,Horror,Memes,Dystopian,Sexual Content,Gore,Hentai,Violent,Gambling,Illuminati,Dark Humor,Comedy,RPG,LGBTQ+,Nudity,Dating Sim,Walking Simulator,Story Rich,+"
"Fallout 76: Atoms","Apr 14 2020","499.0","None","['No user reviews']","0","Bethesda Game Studios","Bethesda Softworks","Psychological Horror,Capitalism,Dark Comedy,Horror,Memes,Dystopian,Sexual Content,Gore,Hentai,Violent,Gambling,Illuminati,Dark Humor,Comedy,RPG,LGBTQ+,Nudity,Dating Sim,Walking Simulator,Story Rich,+"
"Fallout 76: Atoms","Apr 14 2020","499.0","None","['No user reviews']","0","Bethesda Game Studios","Bethesda Softworks","Psychological Horror,Capitalism,Dark Comedy,Horror,Memes,Dystopian,Sexual Content,Gore,Hentai,Violent,Gambling,Illuminati,Dark Humor,Comedy,RPG,LGBTQ+,Nudity,Dating Sim,Walking Simulator,Story Rich,+"
"Fallout 76: Atoms","Apr 14 2020","499.0","None","['No user reviews']","0","Bethesda Game Studios","Bethesda Softworks","Psychological Horror,Capitalism,Dark Comedy,Horror,Memes,Dystopian,Sexual Content,Gore,Hentai,Violent,Gambling,Illuminati,Dark Humor,Comedy,RPG,LGBTQ+,Nudity,Dating Sim,Walking Simulator,Story Rich,+"
"Phasmophobia","Sep 18 2020","1399.0","Phasmophobia is a 4 player online co-op psychological horror. Paranormal activity is on the rise and it’s up to you and your team to use all the ghost hunting equipment at your disposal in order to gather as much evidence as you can.","Overwhelmingly Positive","(8,423)","Kinetic Games","Kinetic Games","Horror,Online Co-Op,Multiplayer,Psychological Horror,Co-op,VR,Supernatural,First-Person,Investigation,Dark,Mystery,Demons,Detective,Early Access,3D,Thriller,Indie,Action,Tactical,Lovecraftian,+"
"Tom Clancy's Ghost Recon® Wildlands","Mar 7 2017","999.0","Create a team with up to 3 friends in Tom Clancy’s Ghost Recon® Wildlands and enjoy the ultimate military shooter experience set in a massive, dangerous, and responsive open world.","Very Positive","(759)","Ubisoft Paris, Ubisoft Annecy, Ubisoft Bucharest, Ubisoft Montpellier, Ubisoft Milan, Reflections, Ubisoft Belgrade","Ubisoft","Open World,Shooter,Co-op,Multiplayer,Action,Tactical,Stealth,Singleplayer,Third-Person Shooter,Military,FPS,Online Co-Op,Adventure,Third Person,Survival,Strategy,Sandbox,First-Person,Atmospheric,PvP,+"
"Sea of Thieves","Jun 3 2020","3999.0","Sea of Thieves offers the essential pirate experience, from sailing and fighting to exploring and looting – everything you need to live the pirate life and become a legend in your own right. With no set roles, you have complete freedom to approach the world, and other players, however you choose.","Very Positive","(4,939)","Rare Ltd","Xbox Game Studios","Adventure,Multiplayer,Open World,Pirates,Action,Co-op,Online Co-Op,Sailing,PvP,First-Person,Exploration,Naval,Funny,PvE,Atmospheric,Massively Multiplayer,Swordplay,Great Soundtrack,FPS,Singleplayer,+"
"Dead by Daylight","Jun 14 2016","999.0","Dead by Daylight is a multiplayer (4vs1) horror game where one player takes on the role of the savage Killer, and the other four players play as Survivors, trying to escape the Killer and avoid being caught and killed.","Mostly Positive","(4,833)","Behaviour Interactive Inc.","Behaviour Interactive Inc.","Horror,Survival Horror,Multiplayer,Online Co-Op,Survival,Co-op,Gore,Team-Based,Stealth,Blood,Third Person,Violent,First-Person,Psychological Horror,Action,Atmospheric,Strategy,Comedy,Mature,Difficult,+"
"Destiny 2: Bungie 30th Anniversary Pack","Dec 7 2021","2499.0","None","Mixed","(87)","Bungie","Bungie","Adventure,Action,Free to Play,Looter Shooter,FPS,Shooter,Great Soundtrack,+"
"Overcooked! 2","Aug 7 2018","624.0","Overcooked returns with a brand-new helping of chaotic cooking action! Journey back to the Onion Kingdom and assemble your team of chefs in classic couch co-op or online play for up to four players. Hold onto your aprons… it’s time to save the world again!","Very Positive","(697)","Ghost Town Games Ltd., Team17","Team17","Multiplayer,Online Co-Op,Local Co-Op,Casual,Co-op,Funny,Indie,Action,4 Player Local,Local Multiplayer,Family Friendly,Cute,Controller,Comedy,Cooking,Singleplayer,Difficult,Simulation,Colorful,Strategy,+"
"Five Nights at Freddy's: Security Breach","Dec 17 2021","3999.0","In Five Nights at Freddy’s: Security Breach, play as Gregory, a young boy who’s been trapped overnight inside of Freddy Fazbear’s Mega Pizzaplex. With the help of Freddy himself, Gregory must uncover the secrets of the Pizzaplex, learn the truth, and survive until dawn.","Very Positive","(4,142)","Steel Wool Studios","ScottGames","Horror,Survival Horror,Singleplayer,Robots,Stealth,Exploration,Multiple Endings,First-Person,3D,Action,Indie,Adventure,Artificial Intelligence,Story Rich,Thriller,Action-Adventure,Colorful,Family Friendly,Cartoony,Hentai,+"
"Tom Clancy's Rainbow Six® Siege","Dec 1 2015","799.0","Tom Clancy's Rainbow Six Siege is the latest installment of the acclaimed first-person shooter franchise developed by the renowned Ubisoft Montreal studio.","Very Positive","(9,759)","Ubisoft Montreal","Ubisoft","FPS,Hero Shooter,Multiplayer,Tactical,Shooter,Team-Based,Action,First-Person,Competitive,Co-op,Strategy,Realistic,Online Co-Op,Destruction,Physics,Atmospheric,Singleplayer,Massively Multiplayer,Casual,Simulation,+"
"STAR WARS™: The Old Republic™ - Cartel Coins","Jul 21 2020","299.0","None","['No user reviews']","0","BioWare","Electronic Arts","Massively Multiplayer,MMORPG,+"
"STAR WARS™: The Old Republic™ - Cartel Coins","Jul 21 2020","299.0","None","['No user reviews']","0","BioWare","Electronic Arts","Massively Multiplayer,MMORPG,+"
"STAR WARS™: The Old Republic™ - Cartel Coins","Jul 21 2020","299.0","None","['No user reviews']","0","BioWare","Electronic Arts","Massively Multiplayer,MMORPG,+"
"STAR WARS™: The Old Republic™ - Cartel Coins","Jul 21 2020","299.0","None","['No user reviews']","0","BioWare","Electronic Arts","Massively Multiplayer,MMORPG,+"
"STAR WARS™: The Old Republic™ - Cartel Coins","Jul 21 2020","299.0","None","['No user reviews']","0","BioWare","Electronic Arts","Massively Multiplayer,MMORPG,+"
"STAR WARS™: The Old Republic™ - Cartel Coins","Jul 21 2020","299.0","None","['No user reviews']","0","BioWare","Electronic Arts","Massively Multiplayer,MMORPG,+"
"Farming Simulator 22","Nov 22 2021","4999.0","Create your farm and let the good times grow! Harvest crops, tend to animals, manage productions, and take on seasonal challenges.","Very Positive","(1,476)","Giants Software","Giants Software","Co-op,Simulation,Farming Sim,Agriculture,Moddable,Management,Sandbox,Immersive Sim,3D,First-Person,Multiplayer,Character Customization,Online Co-Op,Economy,Family Friendly,Third Person,Open World,America,Horses,Nature,+"
"Stardew Valley","Feb 26 2016","1499.0","You've inherited your grandfather's old farm plot in Stardew Valley. Armed with hand-me-down tools and a few coins, you set out to begin your new life. Can you learn to live off the land and turn these overgrown fields into a thriving home?","Overwhelmingly Positive","(6,891)","ConcernedApe","ConcernedApe","Farming Sim,Life Sim,Pixel Graphics,RPG,Multiplayer,Relaxing,Agriculture,Simulation,Crafting,Sandbox,Indie,Building,Singleplayer,Casual,Open World,2D,Great Soundtrack,Cute,Dating Sim,Fishing,+"
"WorldBox - God Simulator","Dec 2 2021","1999.0","WorldBox is the ULTIMATE god simulator and sandbox game. Create your own world or destroy it using different powers. Watch civilizations grow, form kingdoms, colonize new lands and sail to far continents. Towns will rebel, empires will fall. It's your choice to help or watch them fight.","Very Positive","(1,144)","Maxim Karpenko","Maxim Karpenko","Early Access,God Game,Sandbox,Pixel Graphics,Simulation,Colony Sim,Life Sim,Destruction,Political Sim,Artificial Intelligence,Building,Indie,Fantasy,Medieval,Procedural Generation,Management,Relaxing,Politics,Mythology,Idler,+"
"Dying Light Platinum Edition","Sep 21 2021","1499.0","NA","NA","NA","NA","NA","NA"
"Detroit: Become Human","Jun 18 2020","1999.0","Detroit: Become Human puts the destiny of both mankind and androids in your hands, taking you to a near future where machines have become more intelligent than humans. Every choice you make affects the outcome of the game, with one of the most intricately branching narratives ever created.","Very Positive","(1,110)","Quantic Dream","Quantic Dream","Choices Matter,Story Rich,Multiple Endings,Cinematic,Singleplayer,Emotional,Adventure,Sci-fi,Futuristic,Beautiful,Robots,Great Soundtrack,Third Person,Atmospheric,Dynamic Narration,Cyberpunk,Replay Value,Violent,Narration,Female Protagonist,+"
"BeamNG.drive","May 29 2015","2499.0","A dynamic soft-body physics vehicle simulator capable of doing just about anything.","Overwhelmingly Positive","(3,820)","BeamNG","BeamNG","Simulation,Driving,Physics,Destruction,Automobile Sim,Realistic,Open World,Sandbox,Racing,Moddable,Singleplayer,Early Access,Multiplayer,Exploration,First-Person,Third Person,Funny,Action,Adventure,Flight,+"
"Valheim","Feb 2 2021","1999.0","A brutal exploration and survival game for 1-10 players, set in a procedurally-generated purgatory inspired by viking culture. Battle, build, and conquer your way to a saga worthy of Odin’s patronage!","Very Positive","(5,373)","Iron Gate AB","Coffee Stain Publishing","Open World Survival Craft,Survival,Online Co-Op,Open World,Multiplayer,Building,Crafting,Exploration,Co-op,Base Building,Sandbox,Adventure,Mythology,RPG,Sailing,Early Access,Action,Indie,PvP,Fishing,+"
"Rise of Industry","May 2 2019","749.0","Put your entrepreneurial skills to the test as you create & optimise intricate production lines whilst keeping an eye on the all-important bottom line. As an early 20th Century industrialist, grow your empire & adapt to an ever-changing business landscape with unexpected events that could lead to boom…or bust.","Mostly Positive","(20)","Dapper Penguin Studios","Kasedo Games","Strategy,Management,Simulation,Economy,City Builder,Resource Management,Indie,Base Building,Trading,Singleplayer,Building,Early Access,Sandbox,Isometric,+"
"Hearts of Iron IV: Ultimate Bundle","","7079.0","NA","NA","NA","NA","NA","NA"
"Sekiro™: Shadows Die Twice - GOTY Edition","Mar 21 2019","5999.0","Game of the Year - The Game Awards 2019 Best Action Game of 2019 - IGN Carve your own clever path to vengeance in the award winning adventure from developer FromSoftware, creators of Bloodborne and the Dark Souls series. Take Revenge. Restore Your Honor. Kill Ingeniously.","Overwhelmingly Positive","(3,649)","FromSoftware","Activision (Excluding Japan and Asia), FromSoftware (Japan), 方块游戏 (Asia)","Souls-like,Difficult,Action,Singleplayer,Ninja,Stealth,Adventure,Third Person,Open World,Story Rich,Atmospheric,Violent,Assassin,Dark Fantasy,Hack and Slash,Great Soundtrack,RPG,Gore,Dark,Rhythm,+"
"Rogue Tower","Jan 28 2022","1499.0","Rogue Tower is a tower defense game with roguelike elements and a continuously expanding path which you can influence. Unlock, build, upgrade, expand, defend.","Very Positive","(1,074)","Die of Death Games","Die of Death Games","Strategy,Tower Defense,Casual,Roguelike,3D,Procedural Generation,Minimalist,Base Building,Singleplayer,Colorful,Building,Roguelite,Cartoony,Fantasy,Isometric,Medieval,Magic,+"
