title_name,realease_date,price,description,title_review,title_rating,developer,publisher,game_tags
"OMORI","Dec 25 2020","1999.0","Explore a strange world full of colorful friends and foes. When the time comes, the path you’ve chosen will determine your fate... and perhaps the fate of others as well.","Overwhelmingly Positive","(1,588)","OMOCAT, LLC","OMOCAT, LLC","Psychological Horror,Story Rich,Indie,Pixel Graphics,Great Soundtrack,RPG,Hand-drawn,Multiple Endings,RPGMaker,Horror,Colorful,Turn-Based,2D,Atmospheric,Party-Based RPG,Exploration,JRPG,Anime,Stylized,Fantasy,+"
"DCS: AH-64D","Mar 17 2022","6499.0","None","Mostly Positive","(154)","Eagle Dynamics SA","Eagle Dynamics SA","Simulation,Flight,Realistic,Free to Play,+"
"Kerbal Space Program","Apr 27 2015","999.0","In Kerbal Space Program, take charge of the space program for the alien race known as the Kerbals. You have access to an array of parts to assemble fully-functional spacecraft that flies (or doesn’t) based on realistic aerodynamic and orbital physics.","Overwhelmingly Positive","(740)","Squad","Private Division","Space,Simulation,Sandbox,Physics,Science,Space Sim,Building,Moddable,Indie,Education,Open World,Singleplayer,Exploration,Funny,Sci-fi,Difficult,Adventure,Strategy,Replay Value,Comedy,+"
"Hades","Sep 17 2020","2499.0","Defy the god of the dead as you hack and slash out of the Underworld in this rogue-like dungeon crawler from the creators of Bastion, Transistor, and Pyre.","Overwhelmingly Positive","(3,001)","Supergiant Games","Supergiant Games","Action Roguelike,Indie,Action,Roguelite,Hack and Slash,RPG,Mythology,Roguelike,Great Soundtrack,Singleplayer,Dungeon Crawler,Story Rich,Replay Value,Difficult,Isometric,Action RPG,Hand-drawn,Atmospheric,Perma Death,LGBTQ+,+"
"Power to the People","Feb 8 2022","1499.0","Build and maintain a power grid for a constantly growing population, while fighting off all kinds of disasters in this thrilling resource management experience. It's time for you to give "Power to the People"! Do you have what it takes to keep the lights on?","Mostly Positive","(27)","Hermes Interactive","Crytivo","Management,Economy,Building,Resource Management,City Builder,Simulation,Isometric,Real-Time with Pause,Strategy,Procedural Generation,Colorful,3D,Singleplayer,Realistic,Modern,Base Building,Time Management,Puzzle,+"
"Red Dead Online","Dec 1 2020","999.0","Step into the vibrant, ever-evolving world of Red Dead Online and experience life in frontier America. Chase down bounties, battle outlaw gangs and other players, hunt, fish and trade, search for exotic treasures, run Moonshine, and much more to discover in a world of astounding depth and detail.","Very Positive","(901)","Rockstar Games","Rockstar Games","Action,Open World,Multiplayer,Western,Adventure,Shooter,Horses,Third-Person Shooter,Realistic,Online Co-Op,PvP,Character Customization,Story Rich,Singleplayer,MMORPG,Co-op,First-Person,Controller,Violent,Gore,+"
"Marvel’s Avengers Endgame Edition","","2698.0","NA","NA","NA","NA","NA","NA"
"The Sims™ 4 Island Living","Jun 18 2020","1999.0","None","Mixed","(62)","Maxis","Electronic Arts","Simulation,Casual,+"
"Valve Index® Replacement Left Controller","Jun 28 2019","14900.0","NA","NA","NA","NA","NA","NA"
"Battlefield 4™","Jun 11 2020","999.0","Embrace unrivaled destruction in Battlefield 4™. Revel in the glorious chaos of all-out war packed with rewarding, tactical challenges in an interactive environment.","Very Positive","(954)","DICE","Electronic Arts","Multiplayer,FPS,Shooter,Military,Singleplayer,Action,War,First-Person,PvP,Violent,Co-op,Massively Multiplayer,Destruction,Controller,Tactical,Open World,Online Co-Op,Strategy,Great Soundtrack,Story Rich,+"
"Distant Worlds 2","Mar 10 2022","4999.0","Distant Worlds 2 is a vast, pausable real-time 4X space strategy game.","Mixed","(1,160)","CodeForce","Slitherine Ltd.","Simulation,Strategy,4X,Grand Strategy,Sci-fi,3D,Singleplayer,Procedural Generation,Combat,Space,+"
"Zenith: The Last City","Jan 27 2022","2999.0","Fight, craft, explore, and lose yourself in a massively multiplayer world built for VR. Forge alliances and friendships in guilds and parties. Join epic raids and world events, and blaze your own path. How will you use your power?","Very Positive","(213)","Ramen VR","Ramen VR","Early Access,VR,MMORPG,Open World,Action,Action-Adventure,Adventure,RPG,PvE,Action RPG,Massively Multiplayer,Hack and Slash,Exploration,Anime,JRPG,Dystopian,Futuristic,Character Customization,Combat,Crafting,+"
"CHRONO TRIGGER®","Feb 27 2018","749.0","The timeless RPG classic returns loaded with upgrades! Journey to the forgotten past, to the far future, and to the end of time. A big adventure to save the planet, now begins…","Very Positive","(284)","Square Enix","Square Enix","RPG,JRPG,Classic,Story Rich,Great Soundtrack,Time Travel,Singleplayer,Fantasy,Retro,Turn-Based,Pixel Graphics,Cult Classic,Anime,2D,Multiple Endings,Sci-fi,Replay Value,Adventure,Action,Silent Protagonist,+"
"Tom Clancy's Rainbow Six® Siege - Y7 Pass Premium","Feb 22 2022","5999.0","None","Mixed","(115)","Ubisoft Montreal","Ubisoft","Action,Violent,+"
"The Sims™ 4 Get Famous","Jun 18 2020","1999.0","None","Mixed","(68)","Maxis","Electronic Arts","Simulation,Singleplayer,Character Customization,Classic,Funny,+"
"Jurassic World Evolution 2","Nov 9 2021","5999.0","Jurassic World Evolution 2 is the much-anticipated sequel to Frontier’s highly successful Jurassic World Evolution. This bold new era in the Jurassic World Evolution game franchise builds upon the ground-breaking and immersive 2018 management simulation.","Very Positive","(798)","Frontier Developments","Frontier Developments","Dinosaurs,Simulation,Building,Management,Strategy,Sandbox,Singleplayer,City Builder,Sci-fi,Economy,Resource Management,Open World,Violent,Atmospheric,Action,Sequel,Survival,Base Building,Multiplayer,VR,+"
"Sid Meier's Civilization® VI: Maya & Gran Colombia Pack","May 21 2020","899.0","None","Mixed","(247)","Firaxis Games, Aspyr (Mac), Aspyr (Linux)","2K","Strategy,+"
"BioShock: The Collection","Sep 16 2016","1199.0","NA","NA","NA","NA","NA","NA"
"FINAL FANTASY IX","Apr 14 2016","1049.0","Selling over five million copies since its release in 2000, FINAL FANTASY IX proudly returns on Steam! Now you can relive the adventures of Zidane and his crew on PC !","Very Positive","(83)","Square Enix","Square Enix","JRPG,Story Rich,Great Soundtrack,Fantasy,RPG,Classic,Turn-Based Combat,Singleplayer,Adventure,Atmospheric,Turn-Based,Open World,Party-Based RPG,Funny,Cult Classic,Steampunk,Medieval,Anime,Exploration,Action,+"
"Surviving the Aftermath","Nov 16 2021","2399.0","Survive and thrive in a post-apocalyptic future — resources are scarce, but opportunity calls! Build the ultimate disaster proof colony, protect your colonists, and restore civilization to a devastated world.","Mostly Positive","(45)","Iceflake Studios","Paradox Interactive","Strategy,Simulation,City Builder,Post-apocalyptic,Survival,Colony Sim,Base Building,Building,Singleplayer,Exploration,Open World,Management,War,Early Access,Difficult,Atmospheric,Isometric,Tactical,Multiplayer,Co-op,+"
"THE KING OF FIGHTERS XV","Feb 17 2022","5999.0","SHATTER ALL EXPECTATIONS! Transcend beyond your limits with KOF XV!","Very Positive","(1,129)","SNK CORPORATION","SNK CORPORATION","Action,2D Fighter,PvP,Fighting,Multiplayer,3D,Singleplayer,Anime,Arcade,Competitive,Great Soundtrack,Sexual Content,2.5D,Female Protagonist,+"
"Grand Theft Auto V: Premium Edition & Great White Shark Card Bundle","","2880.0","NA","NA","NA","NA","NA","NA"
"The Flipper Bundle","","5846.0","NA","NA","NA","NA","NA","NA"
"Police Stories","Sep 19 2019","524.0","A fresh take on top-down shooters with an emphasis on tactics that forces you to make split second decisions. Neutralize criminals, rescue civilians and defuse bombs in Single Player mode or Co-op. And remember - shooting first is not an option!","Very Positive","(72)","Mighty Morgan","HypeTrain Digital","Action,Strategy,Simulation,Villain Protagonist,Co-op,Tactical,Shooter,Multiplayer,Top-Down Shooter,Indie,Online Co-Op,2D,Pixel Graphics,Singleplayer,Atmospheric,Crime,Realistic,Violent,Gore,Difficult,+"
"PAYDAY 2: Legacy Collection","","1963.0","NA","NA","NA","NA","NA","NA"
"Steam Deck","","39900.0","NA","NA","NA","NA","NA","NA"
"Steam Deck","","39900.0","NA","NA","NA","NA","NA","NA"
"Subnautica: Below Zero","May 14 2021","2999.0","Dive into a freezing underwater adventure on an alien planet. Below Zero is set two years after the original Subnautica. Return to Planet 4546B to uncover the truth behind a deadly cover-up. Survive by building habitats, crafting tools, & diving deeper into the world of Subnautica.","Very Positive","(702)","Unknown Worlds Entertainment","Unknown Worlds Entertainment","Open World Survival Craft,Survival,Underwater,Open World,Singleplayer,Exploration,Adventure,Base Building,Horror,Crafting,First-Person,Aliens,Survival Horror,Sci-fi,Early Access,Story Rich,Atmospheric,Great Soundtrack,Sandbox,Multiplayer,+"
"Batman™: Arkham Origins","Oct 25 2013","1999.0","As of December 4, 2016, the online services portion of Batman: Arkham Origins will be retired. We thank those that have joined us to battle over the last 3 years. The Single player campaign may still be played and enjoyed offline.","Very Positive","(555)","WB Games Montreal, Splash Damage","Warner Bros. Interactive Entertainment","Action,Open World,Superhero,Adventure,Third Person,Stealth,Singleplayer,Multiplayer,Fighting,Beat 'em up,Comic Book,Detective,Story Rich,Atmospheric,Action-Adventure,Controller,3D Vision,Sandbox,Third-Person Shooter,RPG,+"
"Tomb Raider Collection","","4339.0","NA","NA","NA","NA","NA","NA"
"Borderlands 3","Mar 13 2020","5999.0","The original shooter-looter returns, packing bazillions of guns and a mayhem-fueled adventure! Blast through new worlds and enemies as one of four new Vault Hunters.","Very Positive","(1,250)","Gearbox Software","2K","RPG,Action,FPS,Looter Shooter,Online Co-Op,Open World,Multiplayer,Loot,Co-op,Shooter,Co-op Campaign,Singleplayer,Gore,First-Person,Violent,Adventure,Great Soundtrack,Epic,Nudity,Comedy,+"
"UNO","Jan 3 2017","999.0","UNO makes its return with new exciting features! Match cards by color or value and play action cards to change things up. Race against others to empty your hand before everyone else in Classic play or customize your experience with House Rules.","Mostly Positive","(694)","Ubisoft Entertainment","Ubisoft Entertainment","Card Game,Multiplayer,Tabletop,Board Game,Casual,Family Friendly,Funny,Strategy,Co-op,Online Co-Op,Singleplayer,Classic,War,Cult Classic,Local Multiplayer,Replay Value,Team-Based,NSFW,Action,Mature,+"
"Martha Is Dead","Feb 24 2022","2999.0","Martha Is Dead is a dark first-person psychological thriller, set in 1944 Italy, that blurs the lines between reality, superstition and the tragedy of war.","Mostly Positive","(707)","LKA","Wired Productions","Psychological Horror,Psychological,Female Protagonist,Story Rich,Adventure,Horror,Atmospheric,Narration,Cinematic,Thriller,World War II,Dark,Drama,Dynamic Narration,Mystery,Nudity,Indie,Exploration,War,First-Person,+"
"Steam Deck","","39900.0","NA","NA","NA","NA","NA","NA"
"Sid Meier's Civilization® VI: Vietnam & Kublai Khan Pack","Jan 28 2021","899.0","None","Mixed","(88)","Firaxis Games, Aspyr (Mac), Aspyr (Linux)","2K","Strategy,+"
"Sid Meier's Civilization® VI: Byzantium & Gaul Pack","Sep 24 2020","899.0","None","Mixed","(79)","Firaxis Games, Aspyr (Mac), Aspyr (Linux)","2K","Strategy,+"
"Cities: Skylines - Natural Disasters","Nov 29 2016","749.0","None","Mostly Positive","(809)","Colossal Order Ltd.","Paradox Interactive","Simulation,Strategy,Destruction,City Builder,Singleplayer,Survival,Open World,Management,+"
"Call of Duty®: Black Ops","Nov 9 2010","3999.0","The biggest first-person action series of all time and the follow-up to critically acclaimed Call of Duty®: Modern Warfare 2 returns with Call of Duty®: Black Ops.","Overwhelmingly Positive","(212)","Treyarch","Activision","Action,FPS,Zombies,Multiplayer,Shooter,Singleplayer,Cold War,First-Person,War,Military,Online Co-Op,Co-op,Gore,Story Rich,Controller,Adventure,Linear,Horror,Massively Multiplayer,Great Soundtrack,+"
"Gloomhaven","Oct 20 2021","3499.0","Whether you are drawn to Gloomhaven by the call of adventure or by an avid desire for gold glimmering in the dark, your fate will surely be the same. Gloomhaven, the digital adaptation of the acclaimed board game, mixes Tactical-RPG and dungeon-crawling.","Very Positive","(233)","Flaming Fowl Studios","Asmodee Digital","Tabletop,Co-op,RPG,Turn-Based,Board Game,Dungeon Crawler,Strategy,Turn-Based Strategy,Adventure,Turn-Based Tactics,Singleplayer,Hex Grid,Multiplayer,Tactical RPG,Replay Value,Online Co-Op,Early Access,Roguelike,Difficult,3D,+"
"Dragon Age™ Inquisition","Jun 4 2020","599.0","Winner of over 130 Game of the Year awards, discover the definitive Dragon Age: Inquisition experience. The Game of the Year Edition includes the critically acclaimed game, all three official add-ons - Jaws of Hakkon, The Descent, and Trespasser - and more.","Mostly Positive","(252)","BioWare","Electronic Arts","RPG,Open World,Character Customization,Fantasy,Singleplayer,Story Rich,Choices Matter,Action,Adventure,Sexual Content,Strategy,Female Protagonist,Dragons,Third Person,Great Soundtrack,Action RPG,Multiplayer,Atmospheric,Combat,CRPG,+"
"HITMAN 3","Jan 20 2022","5999.0","Death Awaits. Agent 47 returns in HITMAN 3, the dramatic conclusion to the World of Assassination trilogy.","Mixed","(668)","IO Interactive A/S","IO Interactive A/S","Action,Adventure,Stealth,Sandbox,Assassin,Shooter,Third-Person Shooter,Third Person,Singleplayer,VR,Violent,Realistic,Funny,Cinematic,Gore,Puzzle,Capitalism,+"
"Planet Zoo","Nov 5 2019","4499.0","Build a world for wildlife in Planet Zoo. From the developers of Planet Coaster and Zoo Tycoon comes the ultimate zoo sim. Construct detailed habitats, manage your zoo, and meet authentic living animals who think, feel and explore the world you create around them.","Very Positive","(727)","Frontier Developments","Frontier Developments","Management,Simulation,Building,Sandbox,Nature,City Builder,Economy,Realistic,Family Friendly,Singleplayer,Resource Management,Cute,Great Soundtrack,Strategy,Relaxing,Open World,Funny,Casual,Multiplayer,Horses,+"
"BIGFOOT","Jan 31 2017","1999.0","You are a Bigfoot hunter with an important mission: to put an end to rumours once and for all and prove to yourself that Bigfoot is not just a myth or an invention of the mind...","Very Positive","(222)","CyberLight Game Studio","CyberLight Game Studio","Early Access,Horror,Multiplayer,Co-op,Survival Horror,Online Co-Op,Survival,Action,Open World,Atmospheric,Psychological Horror,FPS,Supernatural,Adventure,Hunting,First-Person,Shooter,Singleplayer,Funny,Multiple Endings,+"
"NORCO","Mar 24 2022","1274.0","NORCO is a Southern Gothic point & click narrative adventure that immerses the player in the sinking suburbs and verdant industrial swamps of a distorted South Louisiana.","Positive","(35)","Geography of Robots","Raw Fury","Mystery,Point & Click,Atmospheric,Story Rich,Dystopian,Investigation,Noir,Dark,Pixel Graphics,Colorful,Gothic,First-Person,Adventure,Retro,Conspiracy,Singleplayer,2D,Surreal,Philosophical,Old School,+"
"The Sims™ 4 Bundle - Cats & Dogs + Seasons + City Living + Get to Work","","6596.0","NA","NA","NA","NA","NA","NA"
"MechWarrior 5: Mercenaries: JumpShip Edition","","5996.0","NA","NA","NA","NA","NA","NA"
"Detroit: Become Human","Jun 18 2020","3999.0","Detroit: Become Human puts the destiny of both mankind and androids in your hands, taking you to a near future where machines have become more intelligent than humans. Every choice you make affects the outcome of the game, with one of the most intricately branching narratives ever created.","Very Positive","(1,564)","Quantic Dream","Quantic Dream","Choices Matter,Story Rich,Multiple Endings,Cinematic,Singleplayer,Emotional,Adventure,Sci-fi,Futuristic,Beautiful,Robots,Great Soundtrack,Third Person,Atmospheric,Dynamic Narration,Cyberpunk,Replay Value,Violent,Narration,Female Protagonist,+"
"Don't Starve Together","Apr 21 2016","1499.0","Fight, Farm, Build and Explore Together in the standalone multiplayer expansion to the uncompromising wilderness survival game, Don't Starve.","Very Positive","(2,849)","Klei Entertainment","Klei Entertainment","Survival,Open World Survival Craft,Multiplayer,Co-op,Open World,Adventure,Crafting,Online Co-Op,Sandbox,Difficult,Indie,2D,Funny,Atmospheric,Survival Horror,Strategy,Singleplayer,Horror,Action,Simulation,+"
"Forts - High Seas Bundle","","1393.0","NA","NA","NA","NA","NA","NA"
"Stellaris","May 9 2016","3999.0","Explore a galaxy full of wonders in this sci-fi grand strategy game from Paradox Development Studios. Interact with diverse alien races, discover strange new worlds with unexpected events and expand the reach of your empire. Each new adventure holds almost limitless possibilities.","Very Positive","(1,112)","Paradox Development Studio","Paradox Interactive","Space,Grand Strategy,Strategy,Sci-fi,Exploration,4X,Sandbox,Simulation,Real-Time with Pause,Moddable,Multiplayer,Singleplayer,Diplomacy,Management,Futuristic,Military,Replay Value,Great Soundtrack,Procedural Generation,Atmospheric,+"
"Stellaris: Nemesis","Apr 15 2021","1999.0","None","Mixed","(1,425)","Paradox Development Studio","Paradox Interactive","Strategy,Simulation,Grand Strategy,4X,Replay Value,Sandbox,Management,Real-Time with Pause,Multiplayer,Exploration,Futuristic,Story Rich,Moddable,Diplomacy,Military,Singleplayer,Adventure,RTS,Atmospheric,Building,+"
"Timberborn","Sep 15 2021","2499.0","Humans are long gone. Will your lumberpunk beavers do any better? A city-building game featuring ingenious animals, vertical architecture, river control, and deadly droughts. Contains high amounts of wood.","Very Positive","(576)","Mechanistry","Mechanistry","Early Access,City Builder,Colony Sim,Base Building,Survival,Building,Management,Resource Management,Automation,Economy,Sandbox,Singleplayer,Post-apocalyptic,Agriculture,Strategy,Level Editor,3D,Science,Top-Down,Voxel,+"
"Stormworks: Build and Rescue","Sep 17 2020","2499.0","Join a world where you design, create and pilot your own air sea rescue service. Release your inner hero as you battle fierce storms out at sea to rescue those in need.","Very Positive","(758)","Geometa","Geometa","Sandbox,Flight,Open World,Building,Exploration,Programming,Sailing,Open World Survival Craft,Immersive Sim,Base Building,Survival,PvP,Character Customization,Tutorial,First-Person,Naval,Physics,Trains,Automation,Crafting,+"
"Just Act Natural: Premium Version","Sep 1 2021","799.0","NA","NA","NA","NA","NA","NA"
"Monster Hunter Rise: Sunbreak Deluxe Edition","","5113.0","NA","NA","NA","NA","NA","NA"
"FINAL FANTASY® XIII","Oct 9 2014","799.0","Final Fantasy XIII is a fantasy RPG in which a band of brave humans struggle against fate in the utopian sky city of Cocoon and the primeval world of Pulse. Follow stylish heroine Lightning's fast paced battles and high adventure in a mysterious new world.","Mostly Positive","(80)","Square Enix","Square Enix","JRPG,RPG,Linear,Female Protagonist,Great Soundtrack,Singleplayer,Fantasy,Story Rich,Adventure,Cinematic,Sci-fi,Action,Third Person,Atmospheric,Turn-Based Combat,Action RPG,Futuristic,Turn-Based,Strategy,Difficult,+"
"A Way Out","Jun 18 2020","2999.0","A Way Out is an exclusively co-op adventure where you play the role of one of two prisoners making their daring escape from prison.","Very Positive","(805)","Hazelight","Electronic Arts","Co-op,Online Co-Op,Split Screen,Story Rich,Local Co-Op,Action-Adventure,Action,Adventure,Crime,Third Person,Emotional,Conversation,Multiplayer,Atmospheric,Nudity,Cinematic,Violent,Sexual Content,Indie,Singleplayer,+"
"Rise of the Tomb Raider™","Feb 9 2016","599.0","Rise of the Tomb Raider: 20 Year Celebration includes the base game and Season Pass featuring all-new content. Explore Croft Manor in the new “Blood Ties” story, then defend it against a zombie invasion in “Lara’s Nightmare”.","Very Positive","(566)","Crystal Dynamics, Eidos-Montréal, Feral Interactive (Mac), Feral Interactive (Linux), Nixxes","Square Enix, Feral Interactive (Mac), Feral Interactive (Linux)","Adventure,Action,Female Protagonist,Singleplayer,Third Person,Exploration,Open World,Action-Adventure,Story Rich,Survival,Puzzle,Stealth,Atmospheric,Third-Person Shooter,Parkour,Shooter,RPG,Great Soundtrack,Quick-Time Events,Multiplayer,+"
"The Isle","Dec 2 2015","1999.0","Experience fierce open world survival gameplay as you attempt to stay alive on an unforgiving island inhabited by dinosaurs! Hunt. Grow. Survive.","Very Positive","(849)","Afterthought LLC","Afterthought LLC","Dinosaurs,Survival,Open World,Multiplayer,Simulation,Hunting,Massively Multiplayer,Realistic,Adventure,Early Access,Action,Third Person,Co-op,Sandbox,Walking Simulator,Indie,Strategy,Team-Based,Horror,RPG,+"
"Total War: WARHAMMER II","Sep 28 2017","5999.0","Strategy gaming perfected. A breath-taking campaign of exploration, expansion and conquest across a fantasy world. Turn-based civilisation management and real-time epic strategy battles with thousands of troops and monsters at your command.","Very Positive","(575)","CREATIVE ASSEMBLY, Feral Interactive (Mac), Feral Interactive (Linux)","SEGA, Feral Interactive (Mac), Feral Interactive (Linux)","Strategy,Fantasy,Turn-Based Strategy,RTS,Grand Strategy,War,Multiplayer,Games Workshop,Action,Turn-Based,Singleplayer,Dark Fantasy,Co-op,Tactical,Real Time Tactics,Atmospheric,Story Rich,Dinosaurs,Great Soundtrack,Warhammer 40K,+"
"ROUNDS","Apr 1 2021","599.0","Rounds is a 1v1 rogue-lite shooter where each round gets more intense. The losing player of each round unlocks clever upgrades to create a better build to counter their opponent.","Overwhelmingly Positive","(576)","Landfall","Landfall","Multiplayer,Fighting,Local Multiplayer,2D Fighter,Deckbuilding,Indie,Action,Physics,Card Battler,Roguelite,2D,Roguelike Deckbuilder,Card Game,Side Scroller,Platformer,PvP,Arcade,2D Platformer,Party Game,Twin Stick Shooter,+"
"Fallout 1st","Apr 14 2020","1299.0","None","Mostly Negative","(26)","Bethesda Game Studios","Bethesda Softworks","Capitalism,Dark Comedy,Comedy,Dark Humor,Horror,Crime,Funny,Parody,Hentai,Illuminati,Sexual Content,Gore,Early Access,Nudity,RPG,Violent,Post-apocalyptic,Pixel Graphics,Female Protagonist,Free to Play,+"
"Fallout 76","Apr 14 2020","3999.0","Bethesda Game Studios welcome you to Fallout 76. Twenty-five years after the bombs fall, you and your fellow Vault Dwellers emerge into post-nuclear America. Explore a vast wasteland in this open-world multiplayer addition to the Fallout story.","Mostly Positive","(634)","Bethesda Game Studios","Bethesda Softworks","Dark Comedy,RPG,Open World,Multiplayer,Capitalism,Post-apocalyptic,Survival,Base Building,Co-op,Horror,Shooter,MMORPG,Gore,Exploration,Violent,Early Access,FPS,Atmospheric,Great Soundtrack,Singleplayer,+"
"Fallout 1st","Apr 14 2020","1299.0","None","Mostly Negative","(26)","Bethesda Game Studios","Bethesda Softworks","Capitalism,Dark Comedy,Comedy,Dark Humor,Horror,Crime,Funny,Parody,Hentai,Illuminati,Sexual Content,Gore,Early Access,Nudity,RPG,Violent,Post-apocalyptic,Pixel Graphics,Female Protagonist,Free to Play,+"
"Just Cause 3 XXL Edition","","406.0","NA","NA","NA","NA","NA","NA"
"GROUND BRANCH","Aug 14 2018","2999.0","From one of the developers behind the original Rainbow Six® and Ghost Recon® games, comes a thinking-man's first-person shooter featuring in-depth character and weapon customization. Take your time. Think ahead. Get the job done.","Very Positive","(332)","BlackFoot Studios","MicroProse Software","Tactical,Realistic,FPS,Military,Simulation,Action,Shooter,Multiplayer,Indie,Singleplayer,Co-op,Early Access,First-Person,War,Gun Customization,Online Co-Op,Atmospheric,Strategy,Team-Based,+"
"The Witcher 3: Wild Hunt - Game of the Year Edition","Aug 30 2016","4999.0","NA","NA","NA","NA","NA","NA"
"Jurassic World Evolution 2: Premium Edition","","8636.0","NA","NA","NA","NA","NA","NA"
"Police Stories - Complete Edition","","1235.0","NA","NA","NA","NA","NA","NA"
"Space Engineers","Feb 28 2019","1999.0","Space Engineers is a sandbox game about engineering, construction, exploration and survival in space and on planets. Players build space ships, space stations, planetary outposts of various sizes and uses, pilot ships and travel through space to explore planets and gather resources to survive.","Very Positive","(26)","Keen Software House","Keen Software House","Space,Sandbox,Building,Multiplayer,Open World Survival Craft,Simulation,Survival,Open World,Physics,Crafting,Destruction,Co-op,Indie,Futuristic,Sci-fi,Singleplayer,Action,Strategy,Adventure,Early Access,+"
"New World","Sep 28 2021","3999.0","Explore a thrilling, open-world MMO filled with danger and opportunity where you'll forge a new destiny on the supernatural island of Aeternum.","Mixed","(1,947)","Amazon Games","Amazon Games","Massively Multiplayer,Open World,MMORPG,RPG,Adventure,Action,PvP,PvE,Multiplayer,Walking Simulator,Fantasy,Character Customization,Crafting,Third Person,Co-op,Open World Survival Craft,Sandbox,Violent,Souls-like,Sexual Content,+"
"The Sims™ 4 Discover University","Jun 18 2020","1999.0","None","Mostly Negative","(69)","Maxis","Electronic Arts","Casual,Simulation,+"
