title_name,realease_date,price,description,title_review,title_rating,developer,publisher,game_tags
"Horizon Zero Dawn™ Complete Edition","Aug 7 2020","4999.0","Experience Aloy’s legendary quest to unravel the mysteries of a future Earth ruled by Machines. Use devastating tactical attacks against your prey and explore a majestic open world in this award-winning action RPG!","Very Positive","(1,205)","Guerrilla","PlayStation PC LLC","Open World,Adventure,Female Protagonist,Singleplayer,Action,RPG,Story Rich,Post-apocalyptic,Robots,Sci-fi,Third Person,Exploration,Beautiful,Atmospheric,Action RPG,Great Soundtrack,Archery,Hunting,Dinosaurs,Stealth,+"
"PowerWash Simulator","May 19 2021","1999.0","Release the Pressure with PowerWash Simulator! Wash away your worries with the soothing sounds of high-pressure water. Fire up your power washer and blast away every speck of dirt and grime you can find, all with the simple satisfaction of power-washing to a sparkling finish.","Overwhelmingly Positive","(1,078)","FuturLab","Square Enix","Simulation,Casual,Indie,Relaxing,Singleplayer,Early Access,Family Friendly,First-Person,Colorful,3D,Realistic,Atmospheric,FPS,Multiplayer,Co-op,Online Co-Op,Story Rich,Funny,Immersive Sim,+"
"Elite Dangerous","Apr 2 2015","749.0","Take control of your own starship in a cutthroat galaxy. Elite Dangerous is the definitive massively multiplayer space epic.","Mostly Positive","(528)","Frontier Developments","Frontier Developments","Space Sim,Space,Open World,Exploration,Sci-fi,Simulation,Massively Multiplayer,Multiplayer,First-Person,Action,Adventure,VR,Sandbox,Online Co-Op,Trading,Singleplayer,RPG,Difficult,Strategy,TrackIR,+"
"Wallpaper Engine","Nov 2018Nov 2018","399.0","Use stunning live wallpapers on your desktop. Animate your own images to create new wallpapers or import videos/websites and share them on the Steam Workshop!","Overwhelmingly Positive","(10,774)","Wallpaper Engine Team","Wallpaper Engine Team","Mature,Utilities,Software,Anime,Design & Illustration,Animation & Modeling,Casual,Memes,Indie,Cute,Early Access,Action,Funny,NSFW,Singleplayer,Music,Sandbox,Photo Editing,Game Development,Horror,+"
"Cat Cafe Manager","Apr 14 2022","1599.0","Travel to the sleepy village of Caterwaul Way and rebuild your grandmother's cat cafe. Renovate your restaurant, befriend the local cats and townsfolk, forge lasting friendships, unravel catty mysteries, and build a home for dozens of unique felines!","Mostly Positive","(238)","Roost Games","Freedom Games","Simulation,Strategy,Building,Management,Life Sim,Time Management,Trading,2D,Cartoon,Cartoony,Cats,Cute,Colorful,Stylized,Capitalism,Drama,Economy,Family Friendly,Relaxing,LGBTQ+,+"
"The Outer Worlds","Oct 23 2020","1979.0","The Outer Worlds is an award-winning single-player RPG from Obsidian Entertainment and Private Division. As you explore a space colony, the character you decide to become will determine how this player-driven story unfolds. In the colony's corporate equation, you are the unplanned variable.","Very Positive","(257)","Obsidian Entertainment","Private Division","Action RPG,Open World,RPG,FPS,Exploration,Adventure,Singleplayer,Story Rich,First-Person,Choices Matter,Shooter,Sci-fi,Action,Space,PvE,Character Customization,Comedy,Colorful,Action-Adventure,Funny,+"
"DARK SOULS™: REMASTERED","May 23 2018","3999.0","Then, there was fire. Re-experience the critically acclaimed, genre-defining game that started it all. Beautifully remastered, return to Lordran in stunning high-definition detail running at 60fps.","Very Positive","(1,305)","QLOC","FromSoftware, Inc, BANDAI NAMCO Entertainment","Souls-like,Dark Fantasy,RPG,Action,Difficult,Dark,Fantasy,Atmospheric,Action RPG,Great Soundtrack,Multiplayer,Lore-Rich,Adventure,Story Rich,Third Person,Replay Value,Exploration,Character Customization,Soundtrack,Co-op,+"
"Blade and Sorcery","Dec 11 2018","1999.0","Blade & Sorcery is a built-for-VR medieval fantasy sandbox with full physics driven melee, ranged and magic combat. Become a powerful warrior, ranger or sorcerer and devastate your enemies.","Overwhelmingly Positive","(798)","WarpFrog","WarpFrog","VR,Action,Swordplay,Violent,Gore,Moddable,Simulation,Magic,Sandbox,Physics,Fighting,Adventure,Medieval,Singleplayer,Indie,RPG,Early Access,First-Person,Fantasy,Games Workshop,+"
"Medieval Dynasty","Sep 23 2021","2624.0","Hunt, survive, build and lead in the harsh Middle Ages: Create your own Medieval Dynasty and ensure its long-lasting prosperity or die trying!","Very Positive","(378)","Render Cube","Toplitz Productions","Survival,Building,Open World,Medieval,Singleplayer,RPG,City Builder,Crafting,Simulation,Adventure,Sandbox,Colony Sim,Multiplayer,Resource Management,Realistic,Action,Exploration,Historical,First-Person,Early Access,+"
"The Elder Scrolls V: Skyrim Special Edition","Oct 27 2016","3999.0","Winner of more than 200 Game of the Year Awards, Skyrim Special Edition brings the epic fantasy to life in stunning detail. The Special Edition includes the critically acclaimed game and add-ons with all-new features like remastered art and effects, volumetric god rays, dynamic depth of field, screen-space reflections, and more.","Overwhelmingly Positive","(1,538)","Bethesda Game Studios","Bethesda Softworks","Open World,RPG,Adventure,Singleplayer,Fantasy,Character Customization,Dragons,Moddable,Story Rich,Magic,First-Person,Action,Atmospheric,Great Soundtrack,Third Person,Stealth,Classic,Remake,Female Protagonist,Walking Simulator,+"
"DayZ Livonia","Dec 3 2019","1119.0","None","Mixed","(12)","Bohemia Interactive","Bohemia Interactive","Action,Adventure,Massively Multiplayer,Survival,Zombies,Open World,Violent,+"
"Cities: Skylines","Mar 10 2015","2999.0","Cities: Skylines is a modern take on the classic city simulation. The game introduces new game play elements to realize the thrill and hardships of creating and maintaining a real city whilst expanding on some well-established tropes of the city building experience.","Very Positive","(2,508)","Colossal Order Ltd.","Paradox Interactive","City Builder,Simulation,Building,Management,Strategy,Sandbox,Singleplayer,Moddable,Economy,Resource Management,Mod,Realistic,Replay Value,Casual,Modern,Real-Time with Pause,Family Friendly,Great Soundtrack,Funny,Action,+"
"Insurgency: Sandstorm","Dec 12 2018","2999.0","Insurgency: Sandstorm is a team-based, tactical FPS based on lethal close quarters combat and objective-oriented multiplayer gameplay. Experience the intensity of modern combat where skill is rewarded, and teamwork wins the fight.","Very Positive","(1,047)","New World Interactive","Focus Entertainment","FPS,Realistic,Shooter,Military,Multiplayer,Tactical,Action,First-Person,Online Co-Op,War,Co-op,Violent,Gore,Atmospheric,Difficult,Simulation,Open World,Massively Multiplayer,Indie,Choices Matter,+"
"EA Play","Aug 31 2020","499.0","NA","NA","NA","NA","NA","NA"
"VTOL VR","Aug 3 2017","2999.0","VTOL VR is a near-futuristic combat flight game built for Virtual Reality. Pilot advanced multi-role jets, using your hands to flip switches, press buttons, and manipulate the virtual flight controls.","Overwhelmingly Positive","(354)","Boundless Dynamics, LLC","Boundless Dynamics, LLC","Flight,VR,Combat,Simulation,Jet,Military,War,Action,Realistic,Physics,Vehicular Combat,Artificial Intelligence,Naval Combat,6DOF,Level Editor,Singleplayer,Futuristic,First-Person,Sandbox,Indie,+"
"Microsoft Flight Simulator Game of the Year Edition","Apr 18 2020","5999.0","Thank you to our fans – new and old! Microsoft Flight Simulator Game of the Year (GOTY) Edition offers 5 all-new aircrafts, 8 new handcrafted airports, 6 new Discovery Flights, new tutorials, and updates to the weather system. GOTY Edition is free for existing users. The sky is calling!","Mostly Positive","(818)","Asobo Studio","Xbox Game Studios","Simulation,Flight,Open World,Realistic,Multiplayer,Singleplayer,Atmospheric,VR,Real-Time,Physics,Adventure,Colorful,Family Friendly,TrackIR,Logic,Life Sim,Surreal,Beautiful,Short,Boxing,+"
"Hunt: Showdown - Starter Hunter Edition","","2964.0","NA","NA","NA","NA","NA","NA"
"Call of Duty®: Black Ops II Season Pass","Feb 2013Feb 2013","2499.0","None","['No user reviews']","0","Treyarch","Activision","Action,FPS,Zombies,Multiplayer,+"
"GROUND BRANCH","Aug 14 2018","2999.0","From one of the developers behind the original Rainbow Six® and Ghost Recon® games, comes a thinking-man's first-person shooter featuring in-depth character and weapon customization. Take your time. Think ahead. Get the job done.","Very Positive","(337)","BlackFoot Studios","MicroProse Software","Tactical,Realistic,FPS,Military,Simulation,Action,Shooter,Multiplayer,Indie,Singleplayer,Co-op,Early Access,First-Person,War,Gun Customization,Online Co-Op,Atmospheric,Strategy,Team-Based,Sandbox,+"
"Hearts of Iron IV","Jun 6 2016","3999.0","Victory is at your fingertips! Your ability to lead your nation is your supreme weapon, the strategy game Hearts of Iron IV lets you take command of any nation in World War II; the most engaging conflict in world history.","Very Positive","(3,038)","Paradox Development Studio","Paradox Interactive","Strategy,World War II,Grand Strategy,Historical,War,Military,Alternate History,Multiplayer,Simulation,Tactical,Real-Time with Pause,RTS,Singleplayer,Diplomacy,Sandbox,Co-op,Great Soundtrack,Open World,Action,Casual,+"
"Mount & Blade II: Bannerlord","Mar 30 2020","4999.0","The horns sound, the ravens gather. An empire is torn by civil war. Beyond its borders, new kingdoms rise. Gird on your sword, don your armour, summon your followers and ride forth to win glory on the battlefields of Calradia. Establish your hegemony and create a new world out of the ashes of the old.","Very Positive","(1,482)","TaleWorlds Entertainment","TaleWorlds Entertainment","Medieval,Strategy,Open World,RPG,War,Multiplayer,Sandbox,Singleplayer,Action,Simulation,Character Customization,Moddable,Adventure,Horses,Realistic,Third Person,First-Person,Historical,Great Soundtrack,Early Access,+"
"The Jackbox Party Pack 8","Oct 14 2021","2999.0","Plan your next game night! Jackbox Games is back with 5 hilarious new party games including Drawful Animate, Job Job, The Poll Mine, Weapons Drawn, and The Wheel of Enormous Proportions.","Very Positive","(19)","Jackbox Games, Inc.","Jackbox Games, Inc.","Party Game,Comedy,Family Friendly,Trivia,Colorful,Indie,Word Game,Funny,Cartoon,2D,Local Multiplayer,Local Co-Op,Team-Based,Casual,Multiplayer,+"
"Hunt: Showdown","Aug 27 2019","3999.0","Hunt: Showdown is a thrilling, high-stakes PvPvE first-person shooter. Take down nightmarish monsters, as you compete for the bounties that will bring you glory, gear, and gold in this unforgiving – and unforgettable - online multiplayer experience.","Mostly Positive","(3,059)","Crytek","Crytek","Hunting,Dark,Tactical,FPS,Horror,Multiplayer,Western,Survival,Perma Death,PvP,Open World,Shooter,Zombies,Atmospheric,Battle Royale,Violent,Team-Based,Online Co-Op,First-Person,Action,+"
"People Playground","Jul 23 2019","999.0","Shoot, stab, burn, poison, tear, vaporise, or crush ragdolls in a large open space.","Overwhelmingly Positive","(7,259)","mestiez","Studio Minus","Sandbox,Physics,Gore,Violent,Moddable,Singleplayer,Blood,2D,Simulation,Destruction,Funny,Building,Pixel Graphics,Casual,Indie,Psychological Horror,Action,Horror,Comedy,Choose Your Own Adventure,+"
"Control Ultimate Edition","Aug 27 2020","1199.0","Winner of over 80 awards, Control is a visually stunning third-person action-adventure that will keep you on the edge of your seat.","Very Positive","(330)","Remedy Entertainment","505 Games","Action,Adventure,Female Protagonist,Supernatural,Story Rich,Third Person,Sci-fi,Horror,Atmospheric,Third-Person Shooter,Singleplayer,Surreal,Psychological Horror,Metroidvania,Shooter,Open World,Epic,Violent,Difficult,Great Soundtrack,+"
"Escape Simulator","Oct 19 2021","1499.0","First-person puzzler you can play solo or in an online co-op (best with 2-3 players, but playable with more). Explore a set of highly interactive escape rooms. Move furniture, pick up and examine everything, smash pots and break locks! Supports community rooms through the level editor.","Very Positive","(456)","Pine Studio","Pine Studio","Puzzle,Co-op,Multiplayer,Escape Room,Mystery,First-Person,Exploration,Singleplayer,Point & Click,Investigation,Simulation,Online Co-Op,Story Rich,Indie,Level Editor,Walking Simulator,Atmospheric,Casual,Character Customization,Controller,+"
"THE KING OF FIGHTERS XV","Feb 17 2022","4799.0","SHATTER ALL EXPECTATIONS! Transcend beyond your limits with KOF XV!","Mostly Positive","(491)","SNK CORPORATION","SNK CORPORATION","Action,2D Fighter,PvP,Fighting,Multiplayer,3D,Singleplayer,Anime,Arcade,Competitive,Great Soundtrack,Sexual Content,2.5D,Female Protagonist,+"
"Lost Ark Vanquisher Starter Pack","Feb 11 2022","6499.0","None","Mostly Positive","(17)","Smilegate RPG","Amazon Games","RPG,Free to Play,Action,Massively Multiplayer,Adventure,Sexual Content,Gore,Violent,+"
"CS:GO Prime Status Upgrade","Aug 21 2012","1499.0","Counter-Strike: Global Offensive (CS: GO) expands upon the team-based action gameplay that it pioneered when it was launched 19 years ago. CS: GO features new maps, characters, weapons, and game modes, and delivers updated versions of the classic CS content (de_dust2, etc.).","Very Positive","(70,535)","Valve, Hidden Path Entertainment","Valve","FPS,Shooter,Multiplayer,Competitive,Action,Team-Based,eSports,Tactical,First-Person,PvP,Online Co-Op,Co-op,Strategy,Military,War,Difficult,Trading,Realistic,Fast-Paced,Moddable,+"
"Coromon","Mar 31 2022","1999.0","Coromon is a modern take on the classic monster-taming genre. Tame Coromon and explore a vast world filled with thrilling turn-based battles, brain-twisting puzzles, and a mysterious threat to the world awaiting defeat. Nobody said being a Battle Researcher was easy!","Very Positive","(1,320)","TRAGsoft","Freedom Games","Creature Collector,Turn-Based,Collectathon,Difficult,JRPG,Character Customization,2D,RPG,Pixel Graphics,Turn-Based Combat,Cute,Story Rich,Anime,Colorful,Adventure,Retro,Singleplayer,Indie,Strategy,Exploration,+"
"Planet Zoo: North America Animal Pack","Oct 4 2021","699.0","None","Very Positive","(96)","Frontier Developments","Frontier Developments","Strategy,Simulation,Casual,Sandbox,Management,Building,Family Friendly,Resource Management,+"
"Jurassic World Evolution 2: Early Cretaceous Pack","Dec 9 2021","599.0","None","Very Positive","(68)","Frontier Developments","Frontier Developments","Simulation,Strategy,Casual,Action,Dinosaurs,Sequel,Management,Resource Management,Atmospheric,Singleplayer,Violent,Sandbox,Sci-fi,Building,Survival,Open World,Historical,Economy,City Builder,+"
"Fallout 4: Game of the Year Edition","Nov 10 2015","3999.0","NA","NA","NA","NA","NA","NA"
"DRAGON BALL FighterZ","Jan 26 2018","899.0","DRAGON BALL FighterZ is born from what makes the DRAGON BALL series so loved and famous: endless spectacular fights with its all-powerful fighters.","Very Positive","(460)","Arc System Works","BANDAI NAMCO Entertainment","Fighting,Anime,Action,2D Fighter,Multiplayer,Competitive,Local Multiplayer,Controller,Singleplayer,Arcade,eSports,Difficult,Fast-Paced,PvP,Beat 'em up,Adventure,Third Person,Spectacle fighter,Comic Book,Combat,+"
"Destiny 2: Bungie 30th Anniversary Pack","Dec 7 2021","2499.0","None","Mostly Negative","(53)","Bungie","Bungie","Adventure,Action,Free to Play,Looter Shooter,FPS,Shooter,Great Soundtrack,+"
"FINAL FANTASY XIV Online - Complete Edition","","5998.0","NA","NA","NA","NA","NA","NA"
"Inscryption","Oct 19 2021","1999.0","Inscryption is an inky black card-based odyssey that blends the deckbuilding roguelike, escape-room style puzzles, and psychological horror into a blood-laced smoothie. Darker still are the secrets inscrybed upon the cards...","Overwhelmingly Positive","(2,847)","Daniel Mullins Games","Devolver Digital","Card Battler,Card Game,Story Rich,Deckbuilding,Horror,Dark,Puzzle,Psychological,Roguelite,Strategy,Surreal,Roguelike,Experimental,Point & Click,First-Person,3D,2D,FMV,Pixel Graphics,Adventure,+"
"DARK SOULS™ III","Apr 11 2016","5999.0","Dark Souls continues to push the boundaries with the latest, ambitious chapter in the critically-acclaimed and genre-defining series. Prepare yourself and Embrace The Darkness!","Very Positive","(2,902)","FromSoftware, Inc.","FromSoftware, Inc., BANDAI NAMCO Entertainment","Souls-like,Dark Fantasy,Difficult,RPG,Atmospheric,Lore-Rich,Third Person,Exploration,Story Rich,Action RPG,Co-op,Great Soundtrack,Adventure,Action,PvP,Multiplayer,Open World,Singleplayer,Character Customization,Replay Value,+"
"Crusader Kings III","Sep 1 2020","4999.0","Love, fight, scheme, and claim greatness. Determine your noble house’s legacy in the sprawling grand strategy of Crusader Kings III. Death is only the beginning as you guide your dynasty’s bloodline in the rich and larger-than-life simulation of the Middle Ages.","Very Positive","(973)","Paradox Development Studio","Paradox Interactive","Strategy,RPG,Simulation,Grand Strategy,Medieval,Historical,Political,War,Management,Character Customization,Singleplayer,Choices Matter,Multiplayer,Sandbox,Real-Time with Pause,Moddable,Sexual Content,PvP,Nudity,Dating Sim,+"
"Assetto Corsa","Dec 19 2014","399.0","Assetto Corsa v1.16 introduces the new "Laguna Seca" laser-scanned track, 7 new cars among which the eagerly awaited Alfa Romeo Giulia Quadrifoglio! Check the changelog for further info!","Very Positive","(1,436)","Kunos Simulazioni","Kunos Simulazioni","Racing,Automobile Sim,Simulation,Driving,Multiplayer,Realistic,VR,Sports,Moddable,Controller,Physics,Singleplayer,Open World,First-Person,Indie,Replay Value,Action,3D Vision,TrackIR,Artificial Intelligence,+"
"Call of Duty®: WWII","Nov 2 2017","1979.0","Call of Duty® returns to its roots with Call of Duty®: WWII - a breathtaking experience that redefines World War II for a new gaming generation.","Mostly Positive","(466)","Sledgehammer Games, Raven Software","Activision","World War II,FPS,Multiplayer,War,Zombies,Action,Singleplayer,Shooter,First-Person,Co-op,Violent,Gore,Historical,Story Rich,Horror,Psychological Horror,Massively Multiplayer,Open World,Female Protagonist,Heist,+"
"Left 4 Dead 2","Nov 17 2009","999.0","Set in the zombie apocalypse, Left 4 Dead 2 (L4D2) is the highly anticipated sequel to the award-winning Left 4 Dead, the #1 co-op game of 2008. This co-operative action horror FPS takes you and your friends through the cities, swamps and cemeteries of the Deep South, from Savannah to New Orleans across five expansive campaigns.","Overwhelmingly Positive","(6,089)","Valve","Valve","Zombies,Co-op,FPS,Multiplayer,Shooter,Action,Online Co-Op,Survival,Horror,First-Person,Gore,Team-Based,Moddable,Survival Horror,Post-apocalyptic,Singleplayer,Adventure,Local Co-Op,Replay Value,Tactical,+"
"Jurassic World Evolution 2","Nov 9 2021","3299.0","Jurassic World Evolution 2 is the much-anticipated sequel to Frontier’s highly successful Jurassic World Evolution. This bold new era in the Jurassic World Evolution game franchise builds upon the ground-breaking and immersive 2018 management simulation.","Very Positive","(444)","Frontier Developments","Frontier Developments","Dinosaurs,Building,Simulation,Management,Strategy,Sandbox,Singleplayer,City Builder,Sci-fi,Economy,Resource Management,Open World,Violent,Atmospheric,Action,Sequel,Survival,Base Building,Multiplayer,VR,+"
"Call of Duty®: Modern Warfare® 3","Nov 8 2011","1999.0","The best-selling first-person action series of all-time returns with an epic sequel to the multiple GOTY award winner Call of Duty®: Modern Warfare® 2","Very Positive","(190)","Infinity Ward, Sledgehammer Games","Activision","Action,FPS,Multiplayer,Shooter,First-Person,War,Singleplayer,Online Co-Op,Military,Co-op,Casual,Story Rich,Survival,Controller,Linear,Adventure,Zombies,Point & Click,Dog,Massively Multiplayer,+"
"Kerbal Space Program","Apr 27 2015","3999.0","In Kerbal Space Program, take charge of the space program for the alien race known as the Kerbals. You have access to an array of parts to assemble fully-functional spacecraft that flies (or doesn’t) based on realistic aerodynamic and orbital physics.","Overwhelmingly Positive","(882)","Squad","Private Division","Space,Simulation,Sandbox,Physics,Science,Space Sim,Building,Moddable,Indie,Education,Open World,Singleplayer,Exploration,Funny,Sci-fi,Difficult,Adventure,Strategy,Replay Value,Comedy,+"
"Fallout 1st","Apr 14 2020","1299.0","None","Mostly Negative","(11)","Bethesda Game Studios","Bethesda Softworks","Capitalism,Dark Comedy,Comedy,Dark Humor,Horror,Crime,Funny,Parody,Hentai,Illuminati,Sexual Content,Gore,Early Access,Nudity,RPG,Violent,Post-apocalyptic,Pixel Graphics,Female Protagonist,Free to Play,+"
"FIFA 22","Oct 1 2021","5999.0","Powered by Football™, EA SPORTS™ FIFA 22 brings the game even closer to the real thing with fundamental gameplay advances and a new season of innovation across every mode.","Mostly Positive","(5,684)","EA Canada & EA Romania","Electronic Arts","Soccer,Sports,Multiplayer,Football,Competitive,Simulation,Local Multiplayer,Controller,Online Co-Op,Singleplayer,Realistic,Local Co-Op,PvP,Family Friendly,eSports,Team-Based,Immersive Sim,Physics,Co-op,Cinematic,+"
"Gloomhaven","Oct 20 2021","3499.0","Whether you are drawn to Gloomhaven by the call of adventure or by an avid desire for gold glimmering in the dark, your fate will surely be the same. Gloomhaven, the digital adaptation of the acclaimed board game, mixes Tactical-RPG and dungeon-crawling.","Very Positive","(265)","Flaming Fowl Studios","Asmodee Digital","Tabletop,Co-op,RPG,Turn-Based,Board Game,Dungeon Crawler,Strategy,Turn-Based Strategy,Adventure,Turn-Based Tactics,Singleplayer,Hex Grid,Multiplayer,Tactical RPG,Replay Value,Online Co-Op,Roguelike,Early Access,Difficult,3D,+"
"Divinity: Original Sin 2 - Definitive Edition","Sep 14 2017","4499.0","The critically acclaimed RPG that raised the bar, from the creators of Baldur's Gate 3. Gather your party. Master deep, tactical combat. Venture as a party of up to four - but know that only one of you will have the chance to become a God.","Very Positive","(1,222)","Larian Studios","Larian Studios","Tactical RPG,Turn-Based Strategy,Exploration,RPG,Story Rich,CRPG,Fantasy,Party-Based RPG,Character Customization,Strategy RPG,PvP,Female Protagonist,Co-op Campaign,Local Co-Op,Isometric,Romance,Strategy,Funny,Moddable,3D,+"
"The Binding of Isaac: Rebirth Complete Bundle","","5096.0","NA","NA","NA","NA","NA","NA"
"Offworld Trading Company - Ultimate Edition","","2976.0","NA","NA","NA","NA","NA","NA"
"Fall Guys: Ultimate Knockout","Aug 4 2020","1999.0","NA","NA","NA","NA","NA","NA"
"OMORI","Dec 25 2020","1999.0","Explore a strange world full of colorful friends and foes. When the time comes, the path you’ve chosen will determine your fate... and perhaps the fate of others as well.","Overwhelmingly Positive","(1,717)","OMOCAT, LLC","OMOCAT, LLC","Psychological Horror,Story Rich,Indie,Pixel Graphics,Great Soundtrack,RPG,Hand-drawn,Multiple Endings,RPGMaker,Horror,Colorful,Turn-Based,2D,Atmospheric,Party-Based RPG,Exploration,JRPG,Anime,Stylized,Fantasy,+"
"Planet Zoo: Aquatic Pack","Dec 8 2020","599.0","None","Very Positive","(238)","Frontier Developments","Frontier Developments","Simulation,Strategy,Casual,Management,Sandbox,Family Friendly,Resource Management,Building,+"
"Arma 3","Sep 12 2013","2999.0","Experience true combat gameplay in a massive military sandbox. Deploying a wide variety of single- and multiplayer content, over 20 vehicles and 40 weapons, and limitless opportunities for content creation, this is the PC’s premier military game. Authentic, diverse, open - Arma 3 sends you to war.","Very Positive","(160,520)","Bohemia Interactive","Bohemia Interactive","Action,Military,Multiplayer,Simulation,Shooter,First-Person,Realistic,Open World,Tactical,FPS,War,Co-op,Strategy,Sandbox,Moddable,Combat,Singleplayer,Online Co-Op,Team-Based,Third-Person Shooter,+"
"Planet Zoo: Premium Edition","","3178.0","NA","NA","NA","NA","NA","NA"
"Warhammer 40,000: Chaos Gate - Daemonhunters","May 5 2022","4499.0","Lead humanity’s greatest weapon, the Grey Knights, in this fast-paced turn-based tactical RPG. Root out and purge a galaxy-spanning plague in a cinematic, story-driven campaign, using the tactics and talents of your own personalised squad of Daemonhunters.","['No user reviews']","0","Complex Games","Frontier Foundry","Warhammer 40K,Turn-Based Strategy,Strategy RPG,Turn-Based Tactics,Tactical,Choices Matter,Strategy,PvE,Character Customization,3D,Third Person,Story Rich,Turn-Based Combat,Stylized,Dark Fantasy,Sci-fi,RPG,Demons,Tactical RPG,Futuristic,+"
"Sid Meier’s Civilization® VI Anthology","","9870.0","NA","NA","NA","NA","NA","NA"
"FINAL FANTASY XIV Online","Feb 18 2014","1999.0","Take part in an epic and ever-changing FINAL FANTASY as you adventure and explore with friends from around the world.","Very Positive","(851)","Square Enix","Square Enix","MMORPG,RPG,Massively Multiplayer,Fantasy,JRPG,Great Soundtrack,Character Customization,Story Rich,Open World,Anime,Multiplayer,Adventure,Magic,Action,Atmospheric,Co-op,Action RPG,Online Co-Op,Female Protagonist,Singleplayer,+"
