title_name,realease_date,price,description,title_review,title_rating,developer,publisher,game_tags
"ELDEN RING","Feb 24 2022","5999.0","THE NEW FANTASY ACTION RPG. Rise, Tarnished, and be guided by grace to brandish the power of the Elden Ring and become an Elden Lord in the Lands Between.","Very Positive","(223,009)","FromSoftware Inc.","FromSoftware Inc., BANDAI NAMCO Entertainment","Souls-like,Dark Fantasy,Relaxing,RPG,Difficult,Action RPG,Third Person,Multiplayer,Fantasy,Online Co-Op,Action,Singleplayer,Open World,Co-op,PvP,Violent,3D,Atmospheric,Great Soundtrack,Walking Simulator,+"
"Steam Deck","","39900.0","NA","NA","NA","NA","NA","NA"
"Steam Deck","","39900.0","NA","NA","NA","NA","NA","NA"
"Steam Deck","","39900.0","NA","NA","NA","NA","NA","NA"
"Core Keeper","Mar 8 2022","1169.0","Explore an endless cavern of creatures, relics and resources in a mining sandbox adventure for 1-8 players. Mine, build, fight, craft and farm to unravel the mystery of the ancient Core.","Very Positive","(2,610)","Pugstorm","Fireshine Games","Early Access,Online Co-Op,Pixel Graphics,Adventure,Sandbox,2D,Procedural Generation,Relaxing,Farming Sim,Casual,Dungeon Crawler,Cooking,Simulation,Atmospheric,Exploration,Crafting,Building,Survival,Mining,Mystery,+"
"MONSTER HUNTER RISE","Jan 12 2022","3959.0","Rise to the challenge and join the hunt! In Monster Hunter Rise, the latest installment in the award-winning and top-selling Monster Hunter series, you’ll become a hunter, explore brand new maps and use a variety of weapons to take down fearsome monsters as part of an all-new storyline.","Very Positive","(1,815)","CAPCOM Co., Ltd.","CAPCOM Co., Ltd.","Action,JRPG,RPG,Action RPG,Online Co-Op,Co-op,Hunting,Multiplayer,Third Person,Singleplayer,Souls-like,Anime,Character Customization,PvE,Fantasy,Nature,3D,Story Rich,Atmospheric,Ninja,+"
"Valve Index VR Kit","Jun 28 2019","99900.0","NA","NA","NA","NA","NA","NA"
"WWE 2K22","Mar 11 2022","5999.0","REDESIGNED ENGINE. NEW CONTROLS. ALL THE FEATURES YOU CAN HANDLE. Get ripped out of the stands and hit with complete control of the WWE Universe. Hitting this hard has never been so easy. WWE 2K22: IT HITS DIFFERENT","Mostly Positive","(1,157)","Visual Concepts","2K","Simulation,Sports,PvP,Local Co-Op,Co-op,Wrestling,Multiplayer,Local Multiplayer,Online Co-Op,Fighting,+"
"Resident Evil Village","May 7 2021","2999.0","NA","NA","NA","NA","NA","NA"
"Mass Effect™ Legendary Edition","May 14 2021","2459.0","The Mass Effect™ Legendary Edition includes single-player base content and over 40 DLC from the highly acclaimed Mass Effect, Mass Effect 2, and Mass Effect 3 games, including promo weapons, armors, and packs — remastered and optimized for 4K Ultra HD.","Very Positive","(680)","BioWare","Electronic Arts","RPG,Story Rich,Choices Matter,Sci-fi,Action,Singleplayer,Third-Person Shooter,Space,Action RPG,Character Customization,Shooter,Sexual Content,Great Soundtrack,Atmospheric,Military,Combat,Nudity,Classic,Tactical RPG,Female Protagonist,+"
"Risk of Rain 2: Survivors of the Void","Mar 1 2022","1499.0","None","Very Positive","(3,206)","Hopoo Games","Gearbox Publishing","Action,Indie,Action Roguelike,Great Soundtrack,Co-op,Multiplayer,Third-Person Shooter,Roguelike,Looter Shooter,Survival,Singleplayer,Difficult,+"
"Red Dead Redemption 2","Dec 5 2019","2999.0","Winner of over 175 Game of the Year Awards and recipient of over 250 perfect scores, RDR2 is the epic tale of outlaw Arthur Morgan and the infamous Van der Linde gang, on the run across America at the dawn of the modern age. Also includes access to the shared living world of Red Dead Online.","Very Positive","(5,807)","Rockstar Games","Rockstar Games","Open World,Adventure,Story Rich,Western,Action,Multiplayer,Realistic,Shooter,Singleplayer,Atmospheric,Third-Person Shooter,Horses,Beautiful,Great Soundtrack,Mature,Third Person,Sandbox,First-Person,Gore,FPS,+"
"Destiny 2: The Witch Queen","Feb 22 2022","3999.0","None","Very Positive","(1,233)","Bungie","Bungie","Action,Adventure,Free to Play,Looter Shooter,FPS,Multiplayer,Great Soundtrack,MMORPG,Shooter,First-Person,Atmospheric,Open World,Co-op,+"
"World War 3","Oct 20 2018","1499.0","World War 3 is a tactical online multiplayer FPS where the world is your battleground. Outgun the enemy in thrilling, team-based skirmishes with a huge arsenal of weapons, vehicles, gadgets, and drones at your disposal.","Mostly Positive","(1,093)","The Farm 51","MY.GAMES, The 4 Winds Entertainment","FPS,Multiplayer,Tactical,Shooter,Military,War,Modern,Action,PvP,Team-Based,Combat,First-Person,Realistic,Character Customization,Gun Customization,Early Access,Atmospheric,Physics,3D,Vehicular Combat,+"
"Ready or Not","Dec 17 2021","3999.0","Ready or Not is an intense, tactical, first-person shooter that depicts a modern-day world in which SWAT police units are called to defuse hostile and confronting situations.","Very Positive","(3,745)","VOID Interactive","VOID Interactive","Tactical,Realistic,FPS,Multiplayer,Shooter,First-Person,Co-op,Action,Singleplayer,Violent,Crime,Combat,Gun Customization,Modern,Gore,America,Atmospheric,Co-op Campaign,PvP,Early Access,+"
"Grand Theft Auto V: Premium Edition","","1480.0","NA","NA","NA","NA","NA","NA"
"MONSTER HUNTER RISE Deluxe Edition","","4707.0","NA","NA","NA","NA","NA","NA"
"Hyperbolica","Mar 14 2022","1699.0","Hyperbolica is a whimsical Non-Euclidean adventure with mind-bending worlds full of games, puzzles, mazes, and secrets! Immerse yourself in reality-warping geometries where lines can never be parallel, horizons are curved, and space grows exponentially.","Very Positive","(143)","CodeParade","CodeParade","Exploration,Surreal,First-Person,Adventure,Puzzle,Open World,Sci-fi,Story Rich,Funny,Psychedelic,Singleplayer,Comedy,Physics,Psychological,Education,3D Platformer,VR,Experimental,Casual,Indie,+"
"Dying Light 2 Stay Human","Feb 4 2022","5999.0","The virus won and civilization has fallen back to the Dark Ages. The City, one of the last human settlements, is on the brink of collapse. Use your agility and combat skills to survive, and reshape the world. Your choices matter.","Mostly Positive","(24,615)","Techland","Techland","Open World,Zombies,Co-op,Parkour,Multiplayer,Survival,Action,First-Person,Horror,Gore,Post-apocalyptic,Violent,Choices Matter,RPG,Adventure,Story Rich,Atmospheric,Singleplayer,FPS,Survival Horror,+"
"STAR WARS Jedi: Fallen Order Deluxe Edition","Nov 15 2019","999.0","A galaxy-spanning adventure awaits in Star Wars Jedi: Fallen Order, a 3rd person action-adventure title from Respawn. An abandoned Padawan must complete his training, develop new powerful Force abilities, and master the art of the lightsaber - all while staying one step ahead of the Empire.","Very Positive","(988)","Respawn Entertainment","Electronic Arts","Action-Adventure,Souls-like,Third Person,Swordplay,Platformer,Open World,Story Rich,Exploration,RPG,Action,Sci-fi,Space,Fighting,Metroidvania,Fantasy,Puzzle,Adventure,Hack and Slash,Atmospheric,Family Friendly,+"
"Devil May Cry 5","Mar 8 2019","1499.0","The ultimate Devil Hunter is back in style, in the game action fans have been waiting for.","Overwhelmingly Positive","(493)","CAPCOM Co., Ltd.","CAPCOM Co., Ltd.","Action,Hack and Slash,Great Soundtrack,Character Action Game,Demons,Spectacle fighter,Third Person,Singleplayer,Violent,Stylized,Classic,Story Rich,Gore,Difficult,Nudity,Multiplayer,Controller,Adventure,Anime,Co-op,+"
"It Takes Two","Mar 26 2021","1599.0","Embark on the craziest journey of your life in It Takes Two. Invite a friend to join for free with Friend’s Pass and work together across a huge variety of gleefully disruptive gameplay challenges. Winner of GAME OF THE YEAR at the Game Awards 2021.","Overwhelmingly Positive","(3,465)","Hazelight","Electronic Arts","Co-op,Split Screen,Multiplayer,Adventure,Puzzle,Local Co-Op,Online Co-Op,Story Rich,Puzzle Platformer,Local Multiplayer,3D Platformer,Co-op Campaign,Platformer,Action-Adventure,Action,Emotional,Female Protagonist,Atmospheric,Exploration,Minigames,+"
"Rust","Feb 8 2018","3999.0","The only aim in Rust is to survive. Everything wants you to die - the island’s wildlife and other inhabitants, the environment, other survivors. Do whatever it takes to last another night.","Very Positive","(11,860)","Facepunch Studios","Facepunch Studios","Survival,Crafting,Multiplayer,Open World,Open World Survival Craft,Building,Sandbox,PvP,Adventure,First-Person,Action,FPS,Nudity,Co-op,Shooter,Online Co-Op,Indie,Early Access,Post-apocalyptic,Simulation,+"
"Monster Hunter World: Iceborne","Jan 9 2020","1999.0","None","Very Positive","(58)","CAPCOM Co., Ltd.","CAPCOM Co., Ltd.","Action,Multiplayer,Open World,Co-op,Hunting,Difficult,Third Person,Singleplayer,Adventure,Online Co-Op,Character Customization,RPG,Exploration,Dragons,Hack and Slash,Story Rich,JRPG,PvE,MMORPG,Souls-like,+"
"X4: Tides of Avarice","Mar 14 2022","1499.0","None","Positive","(35)","Egosoft","Egosoft","Action,Simulation,Strategy,Sci-fi,Space,Sandbox,Exploration,First-Person,Singleplayer,Space Sim,+"
"Phasmophobia","Sep 18 2020","1399.0","Phasmophobia is a 4 player online co-op psychological horror. Paranormal activity is on the rise and it’s up to you and your team to use all the ghost hunting equipment at your disposal in order to gather as much evidence as you can.","Overwhelmingly Positive","(7,791)","Kinetic Games","Kinetic Games","Horror,Online Co-Op,Multiplayer,Psychological Horror,Co-op,VR,Supernatural,First-Person,Investigation,Dark,Mystery,Demons,Detective,Early Access,3D,Thriller,Indie,Action,Tactical,Lovecraftian,+"
"Destiny 2: The Witch Queen Deluxe Edition","Feb 22 2022","7999.0","None","Very Positive","(725)","Bungie","Bungie","Action,Adventure,Free to Play,Multiplayer,Shooter,First-Person,FPS,Story Rich,MMORPG,Sci-fi,Co-op,Great Soundtrack,Open World,Atmospheric,Looter Shooter,+"
"Monster Hunter: World","Aug 9 2018","1499.0","Welcome to a new world! In Monster Hunter: World, the latest installment in the series, you can enjoy the ultimate hunting experience, using everything at your disposal to hunt monsters in a new world teeming with surprises and excitement.","Very Positive","(1,250)","CAPCOM Co., Ltd.","CAPCOM Co., Ltd.","Co-op,Multiplayer,Action,Open World,RPG,Third Person,Character Customization,Adventure,Fantasy,Singleplayer,Difficult,Action RPG,Exploration,Great Soundtrack,Replay Value,Atmospheric,Hack and Slash,JRPG,Souls-like,MMORPG,+"
"Project Zomboid","Nov 8 2013","1999.0","Project Zomboid is the ultimate in zombie survival. Alone or in MP: you loot, build, craft, fight, farm and fish in a struggle to survive. A hardcore RPG skillset, a vast map, massively customisable sandbox and a cute tutorial raccoon await the unwary. So how will you die? All it takes is a bite..","Very Positive","(4,789)","The Indie Stone","The Indie Stone","Survival,Zombies,Open World,Open World Survival Craft,Multiplayer,Sandbox,Post-apocalyptic,Crafting,Co-op,Indie,Simulation,RPG,Building,Survival Horror,Realistic,Isometric,Singleplayer,Early Access,2D,Adventure,+"
"Have a Nice Death","Mar 8 2022","1499.0","Have a Nice Death is a 2D action roguelike where you play as an overworked Death, whose employees have run rampant, completely throwing off the balance of souls - and his vacation plans. In order to restore order, you'll have to grab your trusty scythe and show your employees who's boss.","Very Positive","(1,138)","Magic Design Studios","Gearbox Publishing","Singleplayer,Action Roguelike,2D Platformer,Action,2D,Dark Humor,Controller,Cartoony,Cartoon,Early Access,Gothic,Comedy,Combat,Hack and Slash,Arcade,Funny,Platformer,Roguelike,Metroidvania,Indie,+"
"Destiny 2: The Witch Queen Deluxe + Bungie 30th Anniversary Bundle","Feb 22 2022","9999.0","None","Positive","(48)","Bungie","Bungie","Action,Adventure,Free to Play,FPS,MMORPG,+"
"LEGO® Star Wars™: The Skywalker Saga","Apr 5 2022","4999.0","Play through all nine Star Wars saga films in a brand-new LEGO video game unlike any other. Experience fun-filled adventures, whimsical humor, and the freedom to fully immerse yourself in the LEGO Star Wars galaxy.","['No user reviews']","0","TT Games","Warner Bros. Games, Warner Bros. Interactive Entertainment","LEGO,Adventure,Open World,Action,Multiplayer,Space,Co-op,Sci-fi,Singleplayer,Funny,Third Person,Local Co-Op,Story Rich,Family Friendly,Epic,Great Soundtrack,Memes,Beautiful,Psychological Horror,Puzzle,+"
"LEGO® Star Wars™: The Skywalker Saga","Apr 5 2022","4999.0","Play through all nine Star Wars saga films in a brand-new LEGO video game unlike any other. Experience fun-filled adventures, whimsical humor, and the freedom to fully immerse yourself in the LEGO Star Wars galaxy.","['No user reviews']","0","TT Games","Warner Bros. Games, Warner Bros. Interactive Entertainment","LEGO,Adventure,Open World,Action,Multiplayer,Space,Co-op,Sci-fi,Singleplayer,Funny,Third Person,Local Co-Op,Story Rich,Family Friendly,Epic,Great Soundtrack,Memes,Beautiful,Psychological Horror,Puzzle,+"
"Sea of Thieves","Jun 3 2020","3999.0","Sea of Thieves offers the essential pirate experience, from sailing and fighting to exploring and looting – everything you need to live the pirate life and become a legend in your own right. With no set roles, you have complete freedom to approach the world, and other players, however you choose.","Very Positive","(4,661)","Rare Ltd","Xbox Game Studios","Adventure,Multiplayer,Open World,Pirates,Action,Co-op,Online Co-Op,Sailing,PvP,First-Person,Exploration,Naval,Funny,PvE,Atmospheric,Massively Multiplayer,Swordplay,Great Soundtrack,FPS,Singleplayer,+"
"SCUM","Aug 29 2018","1749.0","SCUM aims to evolve the multiplayer open world survival game with unprecedented levels of character customization, control and progression, where knowledge and skills are the ultimate weapons for long-term survival.","Very Positive","(801)","Gamepires","Gamepires","Survival,Open World Survival Craft,Multiplayer,Open World,Zombies,Massively Multiplayer,Action,Early Access,Adventure,Crafting,Realistic,Nudity,FPS,Violent,Singleplayer,PvP,Third Person,Gore,Indie,RPG,+"
"X4: Foundations Collector's Edition","","3994.0","NA","NA","NA","NA","NA","NA"
"Monster Hunter World: Iceborne Master Edition Digital Deluxe","","3497.0","NA","NA","NA","NA","NA","NA"
"X4: Foundations","Nov 30 2018","1999.0","X4: FOUNDATIONS brings our most sophisticated universe SIMULATION ever. Fly every ship, EXPLORE space or manage an empire; TRADE, FIGHT, BUILD and THINK carefully, while you embark on an epic journey. Experience tons of improvements with the massive 5.00 Update!","Very Positive","(196)","Egosoft","Egosoft","Space,Simulation,Sandbox,Sci-fi,Open World,Action,Space Sim,Economy,Exploration,Singleplayer,Strategy,Trading,Flight,Building,Management,Crafting,Immersive Sim,First-Person,Lore-Rich,Multiplayer,+"
"Devil May Cry HD Collection","Mar 13 2018","989.0","The popular stylish action games Devil May Cry, Devil May Cry 2, and Devil May Cry 3 Special Edition return in one collection!","Very Positive","(57)","CAPCOM Co., Ltd.","CAPCOM Co., Ltd.","Action,Hack and Slash,Character Action Game,Classic,Great Soundtrack,Difficult,Singleplayer,Demons,Spectacle fighter,Violent,Stylized,Third Person,Gore,Story Rich,Beat 'em up,Atmospheric,Anime,Fast-Paced,Adventure,Gothic,+"
"Risk of Rain 2","Aug 11 2020","2499.0","Escape a chaotic alien planet by fighting through hordes of frenzied monsters – with your friends, or on your own. Combine loot in surprising ways and master each character until you become the havoc you feared upon your first crash landing.","Overwhelmingly Positive","(5,996)","Hopoo Games","Gearbox Publishing","Third-Person Shooter,Action Roguelike,Multiplayer,Action,Roguelite,Co-op,Looter Shooter,Roguelike,Loot,Shooter,Online Co-Op,Difficult,Third Person,Indie,Survival,Singleplayer,Soundtrack,Great Soundtrack,Early Access,Bullet Hell,+"
"Resident Evil Village & Resident Evil 7 Complete Bundle","May 7 2021","5199.0","NA","NA","NA","NA","NA","NA"
"Call to Arms - Complete","","2316.0","NA","NA","NA","NA","NA","NA"
"Raft","May 23 2018","1999.0","Raft throws you and your friends into an epic oceanic adventure! Alone or together, players battle to survive a perilous voyage across a vast sea! Gather debris, scavenge reefs and build your own floating home, but be wary of the man-eating sharks!","Very Positive","(3,444)","Redbeet Interactive","Axolot Games","Survival,Open World Survival Craft,Multiplayer,Co-op,Crafting,Open World,Building,Base Building,Online Co-Op,Adventure,Sandbox,Early Access,First-Person,Singleplayer,Underwater,Simulation,Action,Indie,Strategy,Massively Multiplayer,+"
"God of War","Jan 14 2022","4999.0","His vengeance against the Gods of Olympus years behind him, Kratos now lives as a man in the realm of Norse Gods and monsters. It is in this harsh, unforgiving world that he must fight to survive… and teach his son to do the same.","Overwhelmingly Positive","(3,914)","Santa Monica Studio","PlayStation PC LLC","Action,Adventure,Singleplayer,Story Rich,Mythology,Third Person,Combat,Violent,RPG,Fantasy,Exploration,Atmospheric,Hack and Slash,Emotional,Gore,Action RPG,Souls-like,3D,PvE,Crafting,+"
"Distant Worlds 2","Mar 10 2022","4999.0","Distant Worlds 2 is a vast, pausable real-time 4X space strategy game.","Mostly Positive","(716)","CodeForce","Slitherine Ltd.","Simulation,Strategy,4X,Grand Strategy,Sci-fi,3D,Singleplayer,Combat,Procedural Generation,Space,+"
"Persona 4 Arena Ultimax","Mar 16 2022","2999.0","A Persona 4 Smackdown!","['No user reviews']","0","Arc System Works, ATLUS","SEGA","Action,2D Fighter,Story Rich,2D,Multiplayer,Anime,Fighting,Great Soundtrack,Visual Novel,+"
"Squad","Sep 23 2020","4999.0","Squad is a tactical FPS that provides authentic combat experiences through teamwork, constant communication, and gameplay. It bridges the large gap between arcade shooter and military simulation with 100 player battles, combined arms combat, base building, and a great integrated VoIP system","Very Positive","(1,749)","Offworld Industries","Offworld Industries","Military,Realistic,FPS,Multiplayer,Tactical,Shooter,War,Team-Based,Action,First-Person,Strategy,Simulation,Open World,Co-op,Massively Multiplayer,Early Access,Atmospheric,Walking Simulator,Indie,Singleplayer,+"
"Stardew Valley","Feb 26 2016","1499.0","You've inherited your grandfather's old farm plot in Stardew Valley. Armed with hand-me-down tools and a few coins, you set out to begin your new life. Can you learn to live off the land and turn these overgrown fields into a thriving home?","Overwhelmingly Positive","(6,791)","ConcernedApe","ConcernedApe","Farming Sim,Life Sim,Pixel Graphics,RPG,Multiplayer,Relaxing,Agriculture,Simulation,Crafting,Sandbox,Indie,Building,Singleplayer,Casual,Open World,2D,Great Soundtrack,Cute,Dating Sim,Fishing,+"
"Lost Ark Vanquisher Starter Pack","Feb 11 2022","6499.0","None","Mixed","(283)","Smilegate RPG","Amazon Games","RPG,Free to Play,Action,Massively Multiplayer,Adventure,Sexual Content,Gore,Violent,+"
"Call of Duty®: Black Ops III","Nov 6 2015","5999.0","Call of Duty®: Black Ops III Zombies Chronicles Edition includes the full base game plus the Zombies Chronicles content expansion.","Very Positive","(1,584)","Treyarch, Aspyr (Mac)","Activision, Aspyr (Mac)","Multiplayer,FPS,Zombies,Shooter,Action,First-Person,Co-op,Singleplayer,Futuristic,Illuminati,Hero Shooter,Robots,Sci-fi,Gore,Great Soundtrack,Story Rich,Atmospheric,Quick-Time Events,Parkour,Simulation,+"
"Monster Hunter World: Iceborne Master Edition","","2998.0","NA","NA","NA","NA","NA","NA"
"Monster Hunter Stories 2: Wings of Ruin","Jul 9 2021","3959.0","A new adventure awaits you in this second installment of the turn-based RPG series set in the world of Monster Hunter! Become a Rider and form bonds with friendly monsters known as Monsties to fight alongside them as you take part in an epic story.","Very Positive","(83)","CAPCOM Co., Ltd.","CAPCOM Co., Ltd.","RPG,Adventure,JRPG,Exploration,3D,Cartoony,Dragons,Third Person,Fantasy,Loot,PvE,Emotional,Character Customization,PvP,Turn-Based,Story Rich,Creature Collector,Hunting,Online Co-Op,Multiplayer,+"
"CHRONO TRIGGER®","Feb 27 2018","749.0","The timeless RPG classic returns loaded with upgrades! Journey to the forgotten past, to the far future, and to the end of time. A big adventure to save the planet, now begins…","Very Positive","(152)","Square Enix","Square Enix","RPG,JRPG,Classic,Story Rich,Great Soundtrack,Time Travel,Singleplayer,Fantasy,Retro,Turn-Based,Cult Classic,Anime,Pixel Graphics,2D,Multiple Endings,Sci-fi,Replay Value,Adventure,Action,Silent Protagonist,+"
"Destiny 2: Bungie 30th Anniversary Pack","Dec 7 2021","2499.0","None","Mixed","(85)","Bungie","Bungie","Adventure,Action,Free to Play,Looter Shooter,FPS,Shooter,Great Soundtrack,+"
"NBA 2K22","Sep 10 2021","1979.0","NBA 2K22 puts the entire basketball universe in your hands. Anyone, anywhere can hoop in NBA 2K22.","Mixed","(2,264)","Visual Concepts","2K","Sports,Basketball,Simulation,Realistic,eSports,Multiplayer,3D,Singleplayer,Team-Based,Management,Character Customization,Controller,Deckbuilding,Trading,4 Player Local,Co-op,Gambling,Local Co-Op,Local Multiplayer,Online Co-Op,+"
"Total War: WARHAMMER III","Feb 17 2022","5999.0","The cataclysmic conclusion to the Total War: WARHAMMER trilogy is here. Rally your forces and step into the Realm of Chaos, a dimension of mind-bending horror where the very fate of the world will be decided. Will you conquer your Daemons… or command them?","Mixed","(25,709)","CREATIVE ASSEMBLY","SEGA, Feral Interactive","Strategy,Grand Strategy,Turn-Based Strategy,RTS,Action,Real Time Tactics,Dark Fantasy,Fantasy,War,Atmospheric,Colorful,Tactical,PvP,Story Rich,Multiplayer,Co-op,Warhammer 40K,Games Workshop,Online Co-Op,Singleplayer,+"
"Forza Horizon 5","Nov 9 2021","5999.0","Your Ultimate Horizon Adventure awaits! Explore the vibrant and ever-evolving open world landscapes of Mexico with limitless, fun driving action in hundreds of the world’s greatest cars. Begin Your Horizon Adventure today and add to your Wishlist!","Very Positive","(3,776)","Playground Games","Xbox Game Studios","Racing,Open World,Driving,Adventure,Multiplayer,Automobile Sim,Simulation,Realistic,Exploration,Arcade,First-Person,Atmospheric,Sports,PvP,Co-op,Online Co-Op,Singleplayer,Beautiful,Action,Third Person,+"
"Valheim","Feb 2 2021","1999.0","A brutal exploration and survival game for 1-10 players, set in a procedurally-generated purgatory inspired by viking culture. Battle, build, and conquer your way to a saga worthy of Odin’s patronage!","Very Positive","(4,854)","Iron Gate AB","Coffee Stain Publishing","Open World Survival Craft,Survival,Online Co-Op,Open World,Multiplayer,Building,Crafting,Exploration,Co-op,Base Building,Sandbox,Adventure,Mythology,RPG,Sailing,Early Access,Action,Indie,PvP,Fishing,+"
"Five Nights at Freddy's: Security Breach","Dec 17 2021","3999.0","In Five Nights at Freddy’s: Security Breach, play as Gregory, a young boy who’s been trapped overnight inside of Freddy Fazbear’s Mega Pizzaplex. With the help of Freddy himself, Gregory must uncover the secrets of the Pizzaplex, learn the truth, and survive until dawn.","Very Positive","(3,744)","Steel Wool Studios","ScottGames","Horror,Survival Horror,Singleplayer,Robots,Stealth,Exploration,Multiple Endings,First-Person,3D,Action,Indie,Adventure,Artificial Intelligence,Story Rich,Thriller,Action-Adventure,Colorful,Family Friendly,Cartoony,Hentai,+"
"Dead by Daylight","Jun 14 2016","999.0","Dead by Daylight is a multiplayer (4vs1) horror game where one player takes on the role of the savage Killer, and the other four players play as Survivors, trying to escape the Killer and avoid being caught and killed.","Mostly Positive","(4,926)","Behaviour Interactive Inc.","Behaviour Interactive Inc.","Horror,Survival Horror,Multiplayer,Online Co-Op,Survival,Co-op,Gore,Team-Based,Stealth,Blood,Third Person,Violent,First-Person,Psychological Horror,Action,Atmospheric,Strategy,Comedy,Mature,Difficult,+"
"BeamNG.drive","May 29 2015","2499.0","A dynamic soft-body physics vehicle simulator capable of doing just about anything.","Overwhelmingly Positive","(3,547)","BeamNG","BeamNG","Simulation,Driving,Physics,Destruction,Automobile Sim,Realistic,Open World,Sandbox,Racing,Moddable,Singleplayer,Early Access,Multiplayer,Exploration,First-Person,Third Person,Funny,Action,Adventure,Flight,+"
"WorldBox - God Simulator","Dec 2 2021","1999.0","WorldBox is the ULTIMATE god simulator and sandbox game. Create your own world or destroy it using different powers. Watch civilizations grow, form kingdoms, colonize new lands and sail to far continents. Towns will rebel, empires will fall. It's your choice to help or watch them fight.","Very Positive","(1,186)","Maxim Karpenko","Maxim Karpenko","Early Access,God Game,Sandbox,Pixel Graphics,Simulation,Colony Sim,Life Sim,Destruction,Political Sim,Artificial Intelligence,Building,Indie,Fantasy,Medieval,Procedural Generation,Management,Relaxing,Politics,Mythology,Idler,+"
"The Forest","Apr 30 2018","1999.0","As the lone survivor of a passenger jet crash, you find yourself in a mysterious forest battling to stay alive against a society of cannibalistic mutants. Build, explore, survive in this terrifying first person survival horror simulator.","Overwhelmingly Positive","(5,034)","Endnight Games Ltd","Endnight Games Ltd","Open World Survival Craft,Survival,Open World,Horror,Crafting,Adventure,Building,Survival Horror,First-Person,Action,Exploration,Sandbox,Atmospheric,Singleplayer,Simulation,Indie,Realistic,Gore,Early Access,Zombies,+"
