title_name,realease_date,price,description,title_review,title_rating,developer,publisher,game_tags
"Marvel's Avengers","Sep 4 2020","1599.0","Assemble your team of Earth’s Mightiest Heroes, embrace your powers, and live your Super Hero dreams.","Mixed","(159)","Crystal Dynamics, Eidos-Montréal, Nixxes","Square Enix","Action,Adventure,RPG,Superhero,Multiplayer,Open World,Online Co-Op,Singleplayer,Cinematic,Third Person,Comic Book,Loot,Sci-fi,Co-op,PvE,Fantasy,Combat,Team-Based,Story Rich,Co-op Campaign,+"
"State of Decay 2: Juggernaut Edition","Mar 13 2020","2999.0","The dead have risen and civilization has fallen. Now it's up to you to gather survivors, scavenge for resources and build a community in a post-apocalyptic world – a world where you define what it means to survive in this ultimate zombie survival simulation.","Very Positive","(375)","Undead Labs","Xbox Game Studios","Survival,Open World,Zombies,Base Building,Co-op,Multiplayer,Online Co-Op,Simulation,Action,RPG,Post-apocalyptic,Sandbox,Third Person,Violent,Gore,Horror,Perma Death,Singleplayer,Atmospheric,Replay Value,+"
"Dying Light Enhanced Edition","Apr 21 2016","2999.0","NA","NA","NA","NA","NA","NA"
"ASTRONEER","Feb 6 2019","2999.0","A game of aerospace industry and interplanetary exploration.","Very Positive","(815)","System Era Softworks","System Era Softworks","Multiplayer,Open World,Open World Survival Craft,Space,Survival,Exploration,Base Building,Co-op,Sandbox,Adventure,Building,Crafting,Sci-fi,Colorful,Singleplayer,Simulation,Third Person,Automation,Atmospheric,Indie,+"
"Monster Energy Supercross - The Official Videogame 5","Mar 17 2022","4999.0","Hold on fast to the handlebar of your bike because a new chapter of the series has finally arrived. Try Monster Energy Supercross - The Official Videogame 5 and discover the quintessence of indoor supercross!","Mixed","(48)","Milestone S.r.l.","Milestone S.r.l.","Racing,Simulation,Sports,eSports,Bikes,Motocross,Motorbike,PvP,Multiplayer,Singleplayer,Split Screen,+"
"Hunt: Showdown - Platinum Edition","","5456.0","NA","NA","NA","NA","NA","NA"
"Buggos","Mar 17 2022","1499.0","Buggos is an RTS Auto Battler where you direct a bug swarm to conquer the planet from the dirty resident humans! You unlock evolution points when defeating the humans in battle allowing you to customize your bug swarm. You are the bad guys! You are the evil bugs! You are here for blood!","Very Positive","(100)","Intrepid Marmot","Intrepid Marmot","Simulation,Strategy,Auto Battler,Colony Sim,2D,Sci-fi,Building,Base Building,Singleplayer,Indie,Level Editor,Space,Wargame,Pixel Graphics,+"
"Titanfall® 2","Jun 18 2020","749.0","Respawn Entertainment gives you the most advanced titan technology in its new, single player campaign & multiplayer experience. Combine & conquer with new titans & pilots, deadlier weapons, & customization and progression systems that help you and your titan flow as one unstoppable killing force.","Very Positive","(1,741)","Respawn Entertainment","Electronic Arts","FPS,Multiplayer,Shooter,Action,Mechs,Singleplayer,Sci-fi,Parkour,First-Person,Futuristic,PvP,Military,Combat,Team-Based,Fast-Paced,Time Travel,Hero Shooter,Violent,Gore,Co-op,+"
"Hollow Knight","Feb 24 2017","1499.0","Forge your own path in Hollow Knight! An epic action adventure through a vast ruined kingdom of insects and heroes. Explore twisting caverns, battle tainted creatures and befriend bizarre bugs, all in a classic, hand-drawn 2D style.","Overwhelmingly Positive","(5,808)","Team Cherry","Team Cherry","Metroidvania,Souls-like,Platformer,Great Soundtrack,Difficult,2D,Indie,Atmospheric,Exploration,Singleplayer,Adventure,Story Rich,Hand-drawn,Action,Dark Fantasy,Multiple Endings,Open World,Cute,Controller,Side Scroller,+"
"DOOM Eternal Standard Edition","Mar 20 2020","3999.0","NA","NA","NA","NA","NA","NA"
"Planet Coaster","Nov 17 2016","4499.0","Planet Coaster® - the future of coaster park simulation games has arrived! Surprise, delight and thrill incredible crowds as you build your coaster park empire - let your imagination run wild, and share your success with the world.","Overwhelmingly Positive","(429)","Frontier Developments, Aspyr (Mac)","Frontier Developments, Aspyr (Mac)","Simulation,Building,Management,Family Friendly,Sandbox,Relaxing,Strategy,Realistic,Funny,Great Soundtrack,Economy,Atmospheric,Singleplayer,Colorful,Third Person,City Builder,Casual,First-Person,God Game,3D,+"
"Expansion - Hearts of Iron IV: No Step Back","Nov 23 2021","1999.0","None","Mixed","(54)","Paradox Development Studio","Paradox Interactive","Strategy,Simulation,World War II,Grand Strategy,Historical,War,+"
"Life is Strange Remastered Collection","Feb 1 2022","3999.0","NA","NA","NA","NA","NA","NA"
"Demon Slayer -Kimetsu no Yaiba- The Hinokami Chronicles","Oct 15 2021","5999.0","Become the Blade that Destroys Demons!","Very Positive","(574)","CyberConnect2","SEGA","Anime,Action,Adventure,3D Fighter,Action-Adventure,3D,2D Fighter,Demons,Cartoon,Cinematic,Colorful,Comic Book,PvP,Drama,Emotional,Combat,Foreign,Multiplayer,Controller,Quick-Time Events,+"
"MONSTER HUNTER RISE Deluxe Edition","","7048.0","NA","NA","NA","NA","NA","NA"
"Propnight","Dec 1 2021","999.0","Join a thrilling party in Propnight, a multiplayer physics-based prop hunt mixed with classic horror survival.","Mixed","(963)","FNTASTIC","MYTONA","Multiplayer,Horror,Action,Survival Horror,3D,First-Person,Online Co-Op,Third Person,PvP,Stylized,Co-op,Combat,Asynchronous Multiplayer,Funny,Survival,Controller,+"
"The Jackbox Party Pack 5","Oct 17 2018","2999.0","It’s the biggest Party Pack yet, including the return of the classic pop culture trivia mash-up YOU DON’T KNOW JACK: Full Stream; the game of hilarious hypotheticals Split the Room; the lyric-writing, robot rap battle Mad Verse City; the inventive drawing game Patently Stupid; and the outer space fling-fest Zeeple Dome.","Very Positive","(33)","Jackbox Games, Inc.","Jackbox Games, Inc.","Casual,Local Multiplayer,Trivia,Comedy,Funny,Multiplayer,Party Game,Party,Board Game,Strategy,4 Player Local,Local Co-Op,Co-op,Indie,+"
"The Sims™ 4 Vampires","Jun 18 2020","1399.0","None","Mixed","(117)","Maxis","Electronic Arts","Simulation,Casual,Singleplayer,Life Sim,Experience,Gaming,Funny,Character Customization,Building,Story Rich,Colorful,Atmospheric,Realistic,Cute,Emotional,Vampire,+"
"The Sinking City - Necronomicon Edition","","1824.0","NA","NA","NA","NA","NA","NA"
"The Jackbox Party Pack 6","Oct 17 2019","2999.0","It’s the wildest Party Pack yet, with the absurd deathmatch Trivia Murder Party 2, the weird word circus Dictionarium, the hidden identity game Push The Button, the comedy contest Joke Boat and the offbeat personality test Role Models.","Very Positive","(25)","Jackbox Games, Inc.","Jackbox Games, Inc.","Trivia,Casual,Indie,Multiplayer,Local Multiplayer,Funny,Comedy,Party,Board Game,Local Co-Op,Co-op,Family Friendly,Party Game,Social Deduction,Singleplayer,+"
"Assetto Corsa Competizione - Challengers Pack","Mar 23 2022","1099.0","None","Very Positive","(73)","Kunos Simulazioni","505 Games","Indie,Simulation,Racing,Sports,eSports,+"
"Wildermyth","Jun 15 2021","2499.0","Wildermyth follows heroes over their whole careers, from their pitchfork days to their powerful primes, and on into old age and memory. It’s a party-based procedural storytelling RPG where tactical combat and story decisions will alter your world and reshape your cast of characters.","Overwhelmingly Positive","(225)","Worldwalker Games LLC","Worldwalker Games LLC, WhisperGames","Party-Based RPG,Story Rich,Choices Matter,Turn-Based Tactics,Character Customization,Procedural Generation,Fantasy,Tactical RPG,Hand-drawn,Emotional,Roguelite,Turn-Based Strategy,RPG,Comic Book,Turn-Based,Moddable,Indie,Strategy,Singleplayer,2.5D,+"
"Fallout 4","Nov 10 2015","1999.0","Bethesda Game Studios, the award-winning creators of Fallout 3 and The Elder Scrolls V: Skyrim, welcome you to the world of Fallout 4 – their most ambitious game ever, and the next generation of open-world gaming.","Very Positive","(1,749)","Bethesda Game Studios","Bethesda Softworks","Open World,Post-apocalyptic,Exploration,Singleplayer,RPG,Atmospheric,Adventure,Shooter,First-Person,Story Rich,Action,Sci-fi,FPS,Action RPG,Sandbox,Great Soundtrack,Third Person,Survival,Third-Person Shooter,Casual,+"
"Stick Fight: The Game","Sep 28 2017","499.0","Stick Fight is a physics-based couch/online fighting game where you battle it out as the iconic stick figures from the golden age of the internet.","Very Positive","(1,234)","Landfall West","Landfall","Multiplayer,Funny,Fighting,Action,Local Multiplayer,2D Fighter,PvP,4 Player Local,2D,Casual,Physics,Indie,Online Co-Op,Shooter,Local Co-Op,Controller,Co-op,Great Soundtrack,Split Screen,Strategy,+"
"Stick Fight: The Game","Sep 28 2017","499.0","Stick Fight is a physics-based couch/online fighting game where you battle it out as the iconic stick figures from the golden age of the internet.","Very Positive","(1,234)","Landfall West","Landfall","Multiplayer,Funny,Fighting,Action,Local Multiplayer,2D Fighter,PvP,4 Player Local,2D,Casual,Physics,Indie,Online Co-Op,Shooter,Local Co-Op,Controller,Co-op,Great Soundtrack,Split Screen,Strategy,+"
"FINAL FANTASY VI","Feb 23 2022","1799.0","The original FINAL FANTASY VI comes to life with completely new graphics and audio! A remodeled 2D take on the sixth game in the world-renowned FINAL FANTASY series! Enjoy the timeless story told through charming retro graphics.","Very Positive","(833)","Square Enix","Square Enix","RPG,Singleplayer,2D,Adventure,Class-Based,JRPG,Emotional,Exploration,Fantasy,Lore-Rich,Nostalgia,Magic,Pixel Graphics,Party-Based RPG,Remake,Retro,Story Rich,Turn-Based Combat,Great Soundtrack,Female Protagonist,+"
"Ultimate Admiral: Dreadnoughts","Dec 10 2021","3499.0","Design warships the way you want them, command fleets, win the naval arms race for your nation!","Very Positive","(121)","Game-Labs","Game-Labs","Naval Combat,Naval,Simulation,Early Access,Indie,World War II,World War I,Building,Sandbox,Realistic,Military,RTS,Wargame,Historical,War,Singleplayer,Turn-Based Strategy,3D,Strategy,Atmospheric,+"
"Ravenfield","May 18 2017","1499.0","Fight upon the Ravenfield together with your Blue allies! Take down those pesky Reds using helicopters, tanks, guns, and active ragdoll physics!","Overwhelmingly Positive","(1,171)","SteelRaven7","SteelRaven7","FPS,War,Singleplayer,Shooter,Action,Military,First-Person,Early Access,Sandbox,Funny,Team-Based,Strategy,Indie,Tactical,Physics,Simulation,Moddable,Realistic,Atmospheric,Adventure,+"
"Stellaris: Aquatics Species Pack","Nov 22 2021","999.0","None","Mixed","(17)","Paradox Development Studio, Paradox Arctic","Paradox Interactive","Strategy,Simulation,4X,Space,RTS,Grand Strategy,Sci-fi,Management,Adventure,Sandbox,Exploration,Diplomacy,Moddable,Futuristic,Military,Atmospheric,Building,Singleplayer,Multiplayer,Real-Time with Pause,+"
"LIGHTNING RETURNS™: FINAL FANTASY® XIII","Dec 10 2015","999.0","Lightning Returns is the concluding chapter of the Final Fantasy XIII saga and series heroine Lightning's final battle. The grand finale of the trilogy brings a world reborn as well as free character customization and stunning action based battles.","Very Positive","(24)","Square Enix","Square Enix","RPG,JRPG,Female Protagonist,Fantasy,Open World,Great Soundtrack,Singleplayer,Story Rich,Adventure,Anime,Action,Action RPG,Third Person,Character Customization,Hack and Slash,Atmospheric,Cute,Nudity,+"
"The Sims™ 4 Eco Lifestyle","Jun 18 2020","1999.0","None","Mixed","(45)","Maxis","Electronic Arts","Casual,Simulation,+"
"Portal Bundle","","1498.0","NA","NA","NA","NA","NA","NA"
"3DMark","Feb 12 2013","1199.0","NA","NA","NA","NA","NA","NA"
"Grim Dawn Definitive Edition","","2700.0","NA","NA","NA","NA","NA","NA"
"Overcooked! 2","Aug 7 2018","2499.0","Overcooked returns with a brand-new helping of chaotic cooking action! Journey back to the Onion Kingdom and assemble your team of chefs in classic couch co-op or online play for up to four players. Hold onto your aprons… it’s time to save the world again!","Very Positive","(955)","Ghost Town Games Ltd., Team17","Team17","Multiplayer,Online Co-Op,Local Co-Op,Casual,Co-op,Funny,Indie,Action,4 Player Local,Local Multiplayer,Family Friendly,Cute,Controller,Comedy,Cooking,Singleplayer,Difficult,Simulation,Colorful,Strategy,+"
"MechWarrior 5: Mercenaries","May 27 2021","2999.0","The year is 3015. The battlefields are dominated by war machines known as BattleMechs. Level entire cities and decimate the enemy in your BattleMech. Follow a quest for glory and revenge. Manage an expanding mercenary company. Fight alongside your friends with a four-player PvE co-op.","Very Positive","(104)","Piranha Games Inc.","Fireshine Games","Mechs,Simulation,FPS,Action,Shooter,Co-op,Vehicular Combat,First-Person,Destruction,Moddable,3D,Singleplayer,Online Co-Op,Combat,Futuristic,Tutorial,Economy,Management,PvE,Resource Management,+"
"Crusader Kings III: Expansion Pass","","3473.0","NA","NA","NA","NA","NA","NA"
"Sid Meier's Civilization® VI: New Frontier Pass","May 21 2020","1999.0","None","Mixed","(973)","Firaxis Games, Aspyr (Mac), Aspyr (Linux)","2K","Strategy,4X,+"
"The Jackbox Party Quintpack","","9875.0","NA","NA","NA","NA","NA","NA"
"Scrap Mechanic","Jan 20 2016","1999.0","Enter the creative paradise of Scrap Mechanic! Build fantastic machines, go on adventures with your friends and defend against waves of evil Farmbots in this imaginative multiplayer survival sandbox. With Scrap Mechanic’s powerful creation tools you can engineer your own adventures!","Overwhelmingly Positive","(1,233)","Axolot Games","Axolot Games","Building,Sandbox,Survival,Open World,Multiplayer,Crafting,Physics,Base Building,Co-op,Singleplayer,First-Person,Third Person,Adventure,Funny,Early Access,Simulation,Action,Indie,Moddable,Online Co-Op,+"
"Age of Empires Anthology","","14443.0","NA","NA","NA","NA","NA","NA"
"Gunfire Reborn","Nov 18 2021","1999.0","Gunfire Reborn is a level-based adventure game featuring FPS, Roguelite and RPG. Players can control heroes with various abilities to experience diverse Build gameplay, use various weapons to explore procedurally-generated levels. You can play the game alone, or join 4-player coop.","Very Positive","(672)","Duoyi Games","Duoyi Games","FPS,Co-op,Roguelite,Roguelike,Online Co-Op,Multiplayer,Indie,Action,Looter Shooter,Adventure,RPG,Early Access,Shooter,Action Roguelike,First-Person,Dungeon Crawler,Replay Value,Singleplayer,Fast-Paced,Souls-like,+"
"ULTRAKILL","Sep 3 2020","1999.0","ULTRAKILL is a fast-paced ultraviolent retro FPS combining the skill-based style scoring from character action games with unadulterated carnage inspired by the best shooters of the '90s. Rip apart your foes with varied destructive weapons and shower in their blood to regain your health.","Overwhelmingly Positive","(911)","Arsi "Hakita" Patala","New Blood Interactive","Early Access,FPS,Arena Shooter,Spectacle fighter,Character Action Game,Blood,Singleplayer,Retro,Shooter,First-Person,Difficult,Action,Old School,Robots,Silent Protagonist,3D,Sci-fi,Stylized,Cyberpunk,Colorful,+"
"Alice: Madness Returns","Jun 17 2011","799.0","Alice: Madness Returns is a third-person, single-player, action adventure platformer. Visit the grim reality of Victorian London and travel to the beautiful yet ghastly Wonderland to uncover the root of Alice's madness.","Very Positive","(562)","Spicy Horse Games","Electronic Arts","3D Platformer,Action-Adventure,Hack and Slash,Female Protagonist,Platformer,Horror,Third Person,Noir,Singleplayer,Action,Surreal,Story Rich,Based On A Novel,Fantasy,Gothic,Adventure,Psychological,Atmospheric,Dark,Combat,+"
"Stranded Deep","Jan 23 2015","1499.0","Take the role of a plane crash survivor stranded somewhere in the Pacific Ocean. Come face to face with some of the most life threatening scenarios that will result in a different experience each time you play. Scavenge. Discover. Survive.","Mostly Positive","(367)","Beam Team Games","Beam Team Publishing","Open World Survival Craft,Survival,Multiplayer,Open World,Crafting,First-Person,Adventure,Exploration,Realistic,Singleplayer,Building,Sandbox,Co-op,Simulation,Early Access,Underwater,Action,Atmospheric,Indie,Strategy,+"
"Borderlands 3 Ultimate Edition","","9887.0","NA","NA","NA","NA","NA","NA"
"The Sims™ 3","Jan 27 2011","999.0","The Sims 3: Create the perfect world with full customization at your fingertips. Refine personalities and help fulfill destinies.","Very Positive","(270)","The Sims Studio","Electronic Arts","Life Sim,Simulation,Character Customization,Building,Sandbox,Singleplayer,Casual,Funny,Moddable,RPG,Romance,Family Friendly,Comedy,Adventure,Replay Value,Multiplayer,Nudity,Great Soundtrack,Strategy,Action,+"
"Who's Your Daddy?!","May 13 2016","499.0","Who's Your Daddy is a casual multiplayer game featuring a clueless father attempting to prevent his infant son from certain death. Play with up to 7 of your friends, and test your parenting skills in a competitive setup with wacky physics and over 67 potentially ominous household items.","Very Positive","(404)","Evil Tortilla Games","Evil Tortilla Games","Funny,Multiplayer,First-Person,Comedy,Simulation,Strategy,Online Co-Op,Dark Humor,Casual,Co-op,Indie,Action,Early Access,Split Screen,Difficult,Survival,Sandbox,Third Person,Adventure,Singleplayer,+"
"Arma 3 Ultimate Edition","","11975.0","NA","NA","NA","NA","NA","NA"
"Foxhole","Jul 27 2017","2999.0","Foxhole is a massively multiplayer game where you will work with hundreds of players to shape the outcome of a persistent online war. Every individual soldier is a player that contributes to the war effort through logistics, base building, reconnaissance, combat, and more.","Very Positive","(312)","Siege Camp","Siege Camp","Early Access,Massively Multiplayer,Base Building,Wargame,World War II,Military,Sandbox,Open World,War,PvP,Top-Down,Tactical,Team-Based,Multiplayer,Strategy,Top-Down Shooter,Crafting,Co-op,Shooter,Action,+"
"Paint the Town Red","Jul 29 2021","1399.0","Paint the Town Red is a chaotic first person melee combat game set in different locations and time periods. The voxel-based enemies can be punched, bashed, kicked, stabbed and sliced completely dynamically using almost anything that isn't nailed down.","Overwhelmingly Positive","(336)","South East Games","South East Games","Gore,Action,Blood,Fighting,Multiplayer,Violent,First-Person,Physics,Funny,Voxel,Beat 'em up,Singleplayer,Indie,Difficult,Adventure,Mature,Roguelike,FPS,Arcade,Early Access,+"
"The Elder Scrolls® Online","May 22 2017","1999.0","Join over 18 million players in the award-winning online multiplayer RPG and experience limitless adventure in a persistent Elder Scrolls world. Battle, craft, steal, or explore, and combine different types of equipment and abilities to create your own style of play. No game subscription required.","Mostly Positive","(900)","Zenimax Online Studios","Bethesda Softworks","RPG,MMORPG,Adventure,Exploration,Fantasy,Open World,Action,Multiplayer,Singleplayer,Massively Multiplayer,PvP,PvE,Lore-Rich,Choose Your Own Adventure,Character Customization,Story Rich,Atmospheric,Class-Based,Action RPG,Magic,+"
"Mortal Online 2","Jan 25 2022","3999.0","Mortal Online 2 is the long awaited sequel to Star Vault’s long running first person sandbox MMORPG. Explore a massive open sandbox world and choose your own path, but be aware, danger lurks around every corner in this full PvP full loot world.","Mostly Positive","(497)","Star Vault AB","Star Vault AB","MMORPG,Sandbox,PvP,Character Customization,Open World,Exploration,RPG,First-Person,Fantasy,Medieval,Swordplay,Magic,Crafting,Survival,Adventure,Old School,Combat,Massively Multiplayer,Multiplayer,Gore,+"
"Deadside","Apr 14 2020","1999.0","Deadside is a hardcore multiplayer shooter with survival elements. Post-Apocalypse, PvP, PvE, open world, realistic weapons, craft, base building","Mostly Positive","(528)","Bad Pixel","Bad Pixel","Survival,Open World,Multiplayer,Massively Multiplayer,Open World Survival Craft,Action,Adventure,Base Building,Crafting,Post-apocalyptic,Shooter,Early Access,PvP,Indie,Realistic,FPS,Singleplayer,Violent,Gore,First-Person,+"
"Madden NFL 22","Aug 20 2021","1799.0","Madden NFL 22 is where gameday happens. All-new features in Franchise include staff management, an enhanced scenario engine, and weekly strategy. Share avatar progress and player class between Face of The Franchise and The Yard with unified progression.","Mixed","(319)","Tiburon","Electronic Arts","Sports,Football,Controller,PvP,Realistic,Casual,Immersive Sim,eSports,Third Person,Physics,Team-Based,Strategy,Cinematic,Simulation,America,Local Co-Op,Local Multiplayer,Multiplayer,Online Co-Op,Singleplayer,+"
"Surviving Mars: Below and Beyond","Sep 7 2021","1499.0","None","Mostly Negative","(375)","Haemimont Games, Abstraction","Paradox Interactive","Simulation,Strategy,+"
"This Means Warp","Mar 17 2022","1999.0","It’s co-op space survival fun, Jim, but not as we know it. This Means Warp is an intense spaceship management roguelite experience for 1-4 players. Explore a procedurally generated universe, upgrade your ship, battle dangerous enemies and adapt your strategies to survive in a hostile universe.","Very Positive","(79)","Outlier","Jagex Ltd","Early Access,Online Co-Op,Space,Co-op,Multiplayer,Top-Down,Sci-fi,Roguelite,Local Multiplayer,Co-op Campaign,Singleplayer,Action,Strategy,Arcade,3D,Roguelike,Comedy,Funny,Controller,4 Player Local,+"
"DARK SOULS™ II: Scholar of the First Sin","Apr 1 2015","3999.0","DARK SOULS™ II: Scholar of the First Sin brings the franchise’s renowned obscurity & gripping gameplay to a new level. Join the dark journey and experience overwhelming enemy encounters, diabolical hazards, and unrelenting challenge.","Mostly Positive","(812)","FromSoftware, Inc","BANDAI NAMCO Entertainment, FromSoftware, Inc","Souls-like,Dark Fantasy,RPG,Difficult,Action,Third Person,Atmospheric,Action RPG,Character Customization,Co-op,Multiplayer,Adventure,Fantasy,Medieval,Dark,Singleplayer,Lore-Rich,Story Rich,PvP,Remake,+"
"Trials of Mana","Apr 24 2020","2499.0","Trials of Mana is a modern revival of the 3rd game in the seminal Mana series. The game, originally released in Japan as Seiken Densetsu 3, has been fully rebuilt from the ground up in 3D.","Very Positive","(33)","Square Enix","Square Enix","RPG,JRPG,Anime,Action RPG,Remake,Adventure,Fantasy,Action,Singleplayer,Hack and Slash,Great Soundtrack,Female Protagonist,Story Rich,Classic,Character Customization,Cute,Co-op,Multiplayer,+"
"MONOPOLY® PLUS","Sep 7 2017","1499.0","EMBARK ON A JOURNEY TO OWN IT ALL! Build your empire on a colorful and 3D lively city animated by funny sidekicks! MONOPOLY® PLUS brings the classic franchise to a new level on PC with amazing animations, customizable house rules!","Mostly Negative","(335)","Ubisoft Pune","Ubisoft","Multiplayer,Board Game,Casual,Tabletop,Family Friendly,Turn-Based,Local Multiplayer,Singleplayer,Strategy,Classic,Violent,Capitalism,Economy,Memes,Cold War,Survival,Simulation,Local Co-Op,NSFW,Survival Horror,+"
"Monster Hunter World: Iceborne","Jan 9 2020","3999.0","None","Very Positive","(65)","CAPCOM Co., Ltd.","CAPCOM Co., Ltd.","Action,Multiplayer,Open World,Co-op,Hunting,Difficult,Third Person,Singleplayer,Adventure,Online Co-Op,Character Customization,RPG,Exploration,Dragons,Hack and Slash,Story Rich,JRPG,PvE,MMORPG,Souls-like,+"
"Subnautica Deep Ocean Bundle","","5998.0","NA","NA","NA","NA","NA","NA"
"Rust - Voice Props Pack","Jul 1 2021","1299.0","None","Very Positive","(22)","Facepunch Studios","Facepunch Studios","Massively Multiplayer,Action,Adventure,RPG,Indie,+"
"Prison Architect - Perfect Storm","Jan 27 2022","799.0","None","Mixed","(28)","Double Eleven, Introversion Software","Paradox Interactive","Strategy,Indie,Simulation,Violent,Nudity,+"
"Expeditions: Rome","Jan 20 2022","4499.0","Determine the destiny of Rome as you conquer foreign lands and navigate political intrigue in this turn-based RPG. Directly fight with your party of Praetorians, guide your legion to victory, and choose your own path in a story where every decision matters. How will you shape the future of Rome?","Very Positive","(190)","Logic Artists","THQ Nordic","RPG,Strategy,Party-Based RPG,Turn-Based Strategy,CRPG,Turn-Based Tactics,Tactical RPG,3D,Rome,Top-Down,Atmospheric,Historical,Tactical,Choices Matter,Story Rich,Female Protagonist,Singleplayer,Turn-Based Combat,Turn-Based,Character Customization,+"
"The Deus Ex Collection","","1007.0","NA","NA","NA","NA","NA","NA"
"Green Hell","Sep 5 2019","2499.0","Plunge into the open world survival simulation set in the extreme conditions of the uncharted Amazon jungle. Use real-life survival techniques to craft, hunt, fight and gather resources, set a makeshift shelter or raise a fortress. Tend your wounds and maintain mental health - alone or with friends.","Very Positive","(357)","Creepy Jar","Creepy Jar","Survival,Open World Survival Craft,Open World,Online Co-Op,Crafting,Simulation,Singleplayer,Base Building,Survival Horror,Realistic,Sandbox,Exploration,First-Person,Building,Adventure,Atmospheric,Action-Adventure,Resource Management,Immersive Sim,Indie,+"
"Call of Duty: World at War","Nov 18 2008","1999.0","Call of Duty is back, redefining war like you've never experienced before. Building on the Call of Duty 4®: Modern Warfare engine, Call of Duty: World at War immerses players into the most gritty and chaotic WWII combat ever experienced.","Very Positive","(371)","Treyarch","Activision","Zombies,World War II,FPS,Multiplayer,Action,Shooter,Co-op,Singleplayer,First-Person,Moddable,War,Online Co-Op,Gore,Historical,Classic,Survival,Great Soundtrack,Tanks,Horror,Adventure,+"
