title_name,realease_date,price,description,title_review,title_rating,developer,publisher,game_tags
"Stellaris","May 9 2016","3999.0","Explore a galaxy full of wonders in this sci-fi grand strategy game from Paradox Development Studios. Interact with diverse alien races, discover strange new worlds with unexpected events and expand the reach of your empire. Each new adventure holds almost limitless possibilities.","Very Positive","(1,236)","Paradox Development Studio","Paradox Interactive","Space,Grand Strategy,Strategy,Sci-fi,Exploration,4X,Sandbox,Simulation,Real-Time with Pause,Moddable,Multiplayer,Singleplayer,Diplomacy,Management,Futuristic,Military,Replay Value,Great Soundtrack,Procedural Generation,Atmospheric,+"
"Apex Legends™ - Champion Edition","Nov 5 2020","3999.0","None","Very Positive","(15)","Respawn Entertainment","Electronic Arts","Action,Adventure,Battle Royale,Multiplayer,FPS,Shooter,First-Person,Free to Play,+"
"Ghostwire: Tokyo","March 25March 25","5999.0","Tokyo's population has vanished, and deadly supernatural forces prowl the streets. Use an arsenal of elemental abilities to unravel the truth behind the disappearance and save Tokyo.","['No user reviews']","0","Tango Gameworks","Bethesda Softworks","Singleplayer,First-Person,Supernatural,Action-Adventure,Action,Lore-Rich,Surreal,Atmospheric,Horror,Story Rich,Mystery,Open World,Combat,Exploration,Realistic,Cyberpunk,Multiplayer,+"
"TaleSpire","Apr 15 2021","2499.0","TaleSpire is a beautiful way to play pen and paper RPGs online. Bring your stories to life and embark upon campaigns together with your friends, regardless of where you are in the world.","Very Positive","(93)","Bouncyrock Entertainment","Bouncyrock Entertainment","Tabletop,RPG,Dungeons & Dragons,Level Editor,Online Co-Op,Building,Board Game,Simulation,Indie,Early Access,Multiplayer,CRPG,Sandbox,Fantasy,Party-Based RPG,3D,Exploration,Third Person,Atmospheric,Dark Fantasy,+"
"Foxhole","Jul 27 2017","2999.0","Foxhole is a massively multiplayer game where you will work with hundreds of players to shape the outcome of a persistent online war. Every individual soldier is a player that contributes to the war effort through logistics, base building, reconnaissance, combat, and more.","Very Positive","(319)","Siege Camp","Siege Camp","Early Access,Massively Multiplayer,Base Building,Wargame,World War II,Military,Open World,Sandbox,War,PvP,Top-Down,Tactical,Team-Based,Multiplayer,Strategy,Top-Down Shooter,Crafting,Co-op,Shooter,Action,+"
"Fallout 1st","Apr 14 2020","1299.0","None","Mixed","(20)","Bethesda Game Studios","Bethesda Softworks","Capitalism,Dark Comedy,Comedy,Dark Humor,Horror,Crime,Funny,Parody,Hentai,Illuminati,Sexual Content,Gore,Early Access,Nudity,RPG,Violent,Post-apocalyptic,Pixel Graphics,Female Protagonist,Free to Play,+"
"Monster Hunter: World","Aug 9 2018","2999.0","Welcome to a new world! In Monster Hunter: World, the latest installment in the series, you can enjoy the ultimate hunting experience, using everything at your disposal to hunt monsters in a new world teeming with surprises and excitement.","Very Positive","(1,347)","CAPCOM Co., Ltd.","CAPCOM Co., Ltd.","Co-op,Multiplayer,Action,Open World,RPG,Third Person,Character Customization,Adventure,Fantasy,Singleplayer,Difficult,Action RPG,Exploration,Great Soundtrack,Replay Value,Atmospheric,Hack and Slash,JRPG,Souls-like,MMORPG,+"
"The Jackbox Party Pack 8","Oct 14 2021","2999.0","Plan your next game night! Jackbox Games is back with 5 hilarious new party games including Drawful Animate, Job Job, The Poll Mine, Weapons Drawn, and The Wheel of Enormous Proportions.","Very Positive","(32)","Jackbox Games, Inc.","Jackbox Games, Inc.","Party Game,Comedy,Family Friendly,Trivia,Colorful,Indie,Word Game,Funny,Cartoon,2D,Local Multiplayer,Local Co-Op,Team-Based,Casual,Multiplayer,+"
"Fallout New Vegas Ultimate","Feb 7 2012","1999.0","NA","NA","NA","NA","NA","NA"
"The Universim","Aug 2018Aug 2018","2999.0","Jump straight into managing your own planets as you guide a civilization through the ages. Build the ultimate empire in The Universim, a new breed of God Game in development by Crytivo.","Mostly Positive","(123)","Crytivo","Crytivo","Early Access,City Builder,God Game,Colony Sim,Building,Sandbox,Casual,Survival,Management,Space,Strategy,Simulation,Procedural Generation,Colorful,Sci-fi,Aliens,Resource Management,Singleplayer,Real-Time with Pause,Open World,+"
"Supporter Edition","","11398.0","NA","NA","NA","NA","NA","NA"
"Undertale","Sep 15 2015","999.0","UNDERTALE! The RPG game where you don't have to destroy anyone.","Overwhelmingly Positive","(2,042)","tobyfox","tobyfox","Great Soundtrack,Story Rich,Choices Matter,Multiple Endings,Pixel Graphics,Funny,RPG,Singleplayer,Indie,Comedy,2D,Replay Value,Bullet Hell,Cute,Memes,Retro,Dark,Psychological Horror,Dating Sim,Horror,+"
"Hollow Knight","Feb 24 2017","1499.0","Forge your own path in Hollow Knight! An epic action adventure through a vast ruined kingdom of insects and heroes. Explore twisting caverns, battle tainted creatures and befriend bizarre bugs, all in a classic, hand-drawn 2D style.","Overwhelmingly Positive","(6,487)","Team Cherry","Team Cherry","Metroidvania,Souls-like,Platformer,Great Soundtrack,Difficult,2D,Indie,Atmospheric,Exploration,Singleplayer,Adventure,Story Rich,Hand-drawn,Action,Dark Fantasy,Multiple Endings,Open World,Cute,Controller,Side Scroller,+"
"Fallout 4","Nov 10 2015","1999.0","Bethesda Game Studios, the award-winning creators of Fallout 3 and The Elder Scrolls V: Skyrim, welcome you to the world of Fallout 4 – their most ambitious game ever, and the next generation of open-world gaming.","Very Positive","(2,023)","Bethesda Game Studios","Bethesda Softworks","Open World,Post-apocalyptic,Exploration,Singleplayer,RPG,Atmospheric,Adventure,Shooter,First-Person,Story Rich,Action,Sci-fi,FPS,Action RPG,Sandbox,Great Soundtrack,Third Person,Survival,Third-Person Shooter,Casual,+"
"Batman™: Arkham Origins","Oct 25 2013","1999.0","As of December 4, 2016, the online services portion of Batman: Arkham Origins will be retired. We thank those that have joined us to battle over the last 3 years. The Single player campaign may still be played and enjoyed offline.","Very Positive","(440)","WB Games Montreal, Splash Damage","Warner Bros. Interactive Entertainment","Action,Open World,Superhero,Adventure,Third Person,Stealth,Singleplayer,Multiplayer,Fighting,Beat 'em up,Comic Book,Detective,Story Rich,Atmospheric,Action-Adventure,Controller,3D Vision,Sandbox,Third-Person Shooter,RPG,+"
"Farming Simulator 22 - Year 1 Bundle","","8728.0","NA","NA","NA","NA","NA","NA"
"Substance 3D Painter 2022","Nov 24 2021","14999.0","Adobe Substance 3D Painter is the reference texturing app for 3D professionals and enthusiasts. From AAA Game Developers to Indies, from Feature Animation to Visual Effects studios, the industry uses Painter to bring their creations to life.","Very Positive","(36)","Adobe","Adobe","Game Development,Animation & Modeling,+"
"Cruelty Squad","Jun 16 2021","1399.0","An immersive power fantasy simulator with tactical stealth elements set in a sewage infused garbage world","Overwhelmingly Positive","(176)","Consumer Softproducts","Consumer Softproducts","FPS,Capitalism,Immersive Sim,Surreal,Psychological Horror,Cyberpunk,Shooter,Stealth,First-Person,Lore-Rich,Dark Humor,Psychedelic,Post-apocalyptic,Stylized,Action,Dystopian,Simulation,Assassin,Tactical,Retro,+"
"Poppy Playtime","Oct 12 2021","499.0","You must stay alive in this horror/puzzle adventure. Try to survive the vengeful toys waiting for you in the abandoned toy factory. Use your GrabPack to hack electrical circuits or nab anything from afar. Explore the mysterious facility... and don't get caught.","Very Positive","(1,449)","MOB Games","MOB Games","Horror,Puzzle,Singleplayer,First-Person,Survival Horror,Dark,Indie,Psychological Horror,Lore-Rich,Survival,Mystery,1980s,Atmospheric,Thriller,Adventure,Cartoony,Action,Physics,Action-Adventure,Multiplayer,+"
"Portal Bundle","","1498.0","NA","NA","NA","NA","NA","NA"
"War of Rights","Dec 3 2018","2999.0","War of Rights is a first person multiplayer game featuring massive 300 player battles with a focus on historical authenticity, teamplay and immersion. It is set during the perilous days of the American Civil War, in the Maryland Campaign of September, 1862.","Very Positive","(160)","Campfire Games","Campfire Games","Historical,War,Multiplayer,Action,Simulation,Realistic,Military,Strategy,FPS,First-Person,Early Access,Shooter,Indie,Violent,Massively Multiplayer,America,Gore,Singleplayer,Tactical,Mature,+"
"Sable","Sep 23 2021","1624.0","Embark on a unique and unforgettable journey and guide Sable through her Gliding; a rite of passage that will take her across vast deserts and mesmerizing landscapes, capped by the remains of spaceships and ancient wonders.","Very Positive","(102)","Shedworks","Raw Fury","Exploration,Open World,Story Rich,Indie,Adventure,Female Protagonist,Puzzle,Stylized,3D Platformer,Third Person,Relaxing,Lore-Rich,Atmospheric,Platformer,Singleplayer,Spaceships,Racing,Puzzle Platformer,Comic Book,Sci-fi,+"
"Death and Taxes","Feb 20 2020","519.0","In this 2D, short narrative-based game, you assume the role of the Grim Reaper... on an office job. Your job is to decide which people are going to live or die. The consequences of your choices are yours to bear, while the mystery of your incarnation awaits revelation!","Very Positive","(58)","Placeholder Gameworks","Placeholder Gameworks","Simulation,Strategy,Point & Click,Story Rich,Casual,Puzzle,Choices Matter,Replay Value,Choose Your Own Adventure,Multiple Endings,Adventure,Interactive Fiction,Narrative,Atmospheric,Dark Comedy,Indie,2D,Conversation,Character Customization,Singleplayer,+"
"Total War™: ROME II - Emperor Edition","Sep 2 2013","5999.0","Emperor Edition is the definitive edition of ROME II, featuring an improved politics system, overhauled building chains, rebalanced battles and improved visuals in both campaign and battleEmperor Edition contains all free feature updates since its release in 2013, which includes bug fixes, balancing, Twitch.","Very Positive","(372)","CREATIVE ASSEMBLY","SEGA","Strategy,Turn-Based Strategy,Historical,Grand Strategy,Rome,Tactical,Multiplayer,War,Real Time Tactics,RTS,Turn-Based,Singleplayer,Online Co-Op,Turn-Based Tactics,Simulation,Co-op,Moddable,Action,Atmospheric,Education,+"
"Mortal Online 2","Jan 25 2022","3999.0","Mortal Online 2 is the long awaited sequel to Star Vault’s long running first person sandbox MMORPG. Explore a massive open sandbox world and choose your own path, but be aware, danger lurks around every corner in this full PvP full loot world.","Mostly Positive","(1,213)","Star Vault AB","Star Vault AB","MMORPG,Sandbox,Character Customization,PvP,Open World,Exploration,RPG,First-Person,Fantasy,Swordplay,Magic,Medieval,Crafting,Survival,Adventure,Old School,Combat,Massively Multiplayer,Multiplayer,Gore,+"
"Batman™: Arkham Knight","Jun 23 2015","1999.0","Batman™: Arkham Knight brings the award-winning Arkham trilogy from Rocksteady Studios to its epic conclusion. Developed exclusively for New-Gen platforms, Batman: Arkham Knight introduces Rocksteady's uniquely designed version of the Batmobile.","Overwhelmingly Positive","(1,183)","Rocksteady Studios","Warner Bros. Interactive Entertainment","Action,Open World,Superhero,Stealth,Adventure,Third Person,Singleplayer,Detective,Fighting,Story Rich,Atmospheric,Dark,Comic Book,Beat 'em up,Puzzle,Mature,Strategy,Sandbox,Horror,Epic,+"
"Stick Fight: The Game","Sep 28 2017","499.0","Stick Fight is a physics-based couch/online fighting game where you battle it out as the iconic stick figures from the golden age of the internet.","Very Positive","(1,522)","Landfall West","Landfall","Multiplayer,Funny,Fighting,Action,Local Multiplayer,2D Fighter,4 Player Local,PvP,2D,Casual,Physics,Indie,Online Co-Op,Shooter,Local Co-Op,Controller,Co-op,Great Soundtrack,Split Screen,Strategy,+"
"Call of the Sea","Dec 8 2020","1199.0","Call of the Sea is an otherworldly tale of mystery and love set in the 1930s South Pacific. Explore a lush island paradise, solve puzzles and unlock secrets in the hunt for your husband’s missing expedition.","Very Positive","(42)","Out of the Blue","Raw Fury","Adventure,Puzzle,Story Rich,Female Protagonist,First-Person,Indie,Lovecraftian,Atmospheric,Casual,Mystery,Exploration,Colorful,Singleplayer,Investigation,Narration,Historical,Surreal,Walking Simulator,Emotional,3D,+"
"Arma 3 Creator DLC: S.O.G. Prairie Fire","May 6 2021","2299.0","None","Very Positive","(23)","Savage Game Design","Bohemia Interactive","Simulation,Action,Strategy,Violent,+"
"Red Dead Online","Dec 1 2020","1999.0","Step into the vibrant, ever-evolving world of Red Dead Online and experience life in frontier America. Chase down bounties, battle outlaw gangs and other players, hunt, fish and trade, search for exotic treasures, run Moonshine, and much more to discover in a world of astounding depth and detail.","Very Positive","(820)","Rockstar Games","Rockstar Games","Action,Open World,Multiplayer,Western,Adventure,Shooter,Horses,Third-Person Shooter,Online Co-Op,Realistic,PvP,Character Customization,Story Rich,Singleplayer,MMORPG,Co-op,First-Person,Controller,Violent,Gore,+"
"The Elder Scrolls® Online","May 22 2017","1999.0","Join over 18 million players in the award-winning online multiplayer RPG and experience limitless adventure in a persistent Elder Scrolls world. Battle, craft, steal, or explore, and combine different types of equipment and abilities to create your own style of play. No game subscription required.","Mostly Positive","(1,262)","Zenimax Online Studios","Bethesda Softworks","RPG,MMORPG,Adventure,Exploration,Fantasy,Open World,Action,Multiplayer,Singleplayer,Massively Multiplayer,PvP,PvE,Lore-Rich,Choose Your Own Adventure,Character Customization,Story Rich,Atmospheric,Class-Based,Action RPG,Magic,+"
"The Isle","Dec 2 2015","1999.0","Experience fierce open world survival gameplay as you attempt to stay alive on an unforgiving island inhabited by dinosaurs! Hunt. Grow. Survive.","Very Positive","(964)","Afterthought LLC","Afterthought LLC","Dinosaurs,Survival,Open World,Multiplayer,Simulation,Hunting,Massively Multiplayer,Adventure,Realistic,Early Access,Action,Third Person,Co-op,Sandbox,Walking Simulator,Indie,Strategy,Team-Based,Horror,RPG,+"
"PAYDAY 2: Legacy Collection","","1963.0","NA","NA","NA","NA","NA","NA"
"Fran Bow","Aug 27 2015","524.0","Fran Bow is a creepy adventure game that tells the story of Fran, a young girl struggling with a mental disorder and an unfair destiny.","Overwhelmingly Positive","(163)","Killmonday Games AB","Killmonday Games AB","Psychological Horror,Story Rich,Point & Click,Puzzle,Horror,Adventure,Dark,Indie,Atmospheric,Singleplayer,Female Protagonist,Gore,Psychological,Surreal,Dark Fantasy,Fantasy,2D,Hand-drawn,Great Soundtrack,Hidden Object,+"
"MONSTER HUNTER RISE Deluxe Edition","","7048.0","NA","NA","NA","NA","NA","NA"
"Persona 4 Golden","Jun 13 2020","1999.0","A coming of age story that sets the protagonist and his friends on a journey kickstarted by a chain of serial murders.","Overwhelmingly Positive","(546)","ATLUS","SEGA","JRPG,Great Soundtrack,Story Rich,Anime,Turn-Based Combat,RPG,Singleplayer,Party-Based RPG,Mystery,Turn-Based Strategy,Emotional,Multiple Endings,Detective,Colorful,Dating Sim,Adventure,Strategy,Visual Novel,Violent,Sexual Content,+"
"Fallout 76","Apr 14 2020","3999.0","Bethesda Game Studios welcome you to Fallout 76. Twenty-five years after the bombs fall, you and your fellow Vault Dwellers emerge into post-nuclear America. Explore a vast wasteland in this open-world multiplayer addition to the Fallout story.","Mostly Positive","(825)","Bethesda Game Studios","Bethesda Softworks","Dark Comedy,RPG,Open World,Multiplayer,Capitalism,Post-apocalyptic,Survival,Base Building,Co-op,Horror,Shooter,MMORPG,Gore,Exploration,Violent,Early Access,FPS,Atmospheric,Great Soundtrack,Singleplayer,+"
"DARK SOULS III Deluxe Edition","Apr 11 2016","8498.0","NA","NA","NA","NA","NA","NA"
"Fallout 1st","Apr 14 2020","1299.0","None","Mixed","(20)","Bethesda Game Studios","Bethesda Softworks","Capitalism,Dark Comedy,Comedy,Dark Humor,Horror,Crime,Funny,Parody,Hentai,Illuminati,Sexual Content,Gore,Early Access,Nudity,RPG,Violent,Post-apocalyptic,Pixel Graphics,Female Protagonist,Free to Play,+"
"Watch_Dogs Complete","","1249.0","NA","NA","NA","NA","NA","NA"
"Brawlhalla - All Legends (Current and Future)","Nov 3 2015","1499.0","None","Very Positive","(287)","Blue Mammoth Games","Ubisoft","Free to Play,Action,Indie,Multiplayer,2D Fighter,Fighting,Co-op,Platformer,+"
"Dread Hunger","Jan 26 2022","2999.0","A game of survival and betrayal. Eight Explorers path their ship through the unforgiving Arctic. Among the crew, two traitors call on dark powers to undermine them.","Mixed","(5,329)","Dread Hunger Team","Digital Confectioners","Multiplayer,Survival,Social Deduction,Online Co-Op,Co-op,Psychological,PvP,Team-Based,Indie,Funny,Strategy,Action,Difficult,Horror,Gore,Dark,First-Person,Adventure,Blood,Atmospheric,+"
"Ultimate Admiral: Dreadnoughts","Dec 10 2021","3499.0","Design warships the way you want them, command fleets, win the naval arms race for your nation!","Very Positive","(134)","Game-Labs","Game-Labs","Naval Combat,Naval,Simulation,Early Access,Indie,World War II,World War I,Building,Sandbox,Realistic,Military,RTS,Wargame,Historical,War,Singleplayer,Turn-Based Strategy,3D,Strategy,Atmospheric,+"
"Marvel's Guardians of the Galaxy","Oct 26 2021","5999.0","Fire up a wild ride across the cosmos with a fresh take on Marvel’s Guardians of the Galaxy. In this action-adventure game, you are Star-Lord leading the unpredictable Guardians from one explosion of chaos to the next. You got this. Probably.","Very Positive","(781)","Eidos-Montréal","Square Enix","Action,Story Rich,Singleplayer,Action-Adventure,Exploration,Third-Person Shooter,Shooter,Adventure,Choices Matter,Superhero,Sci-fi,Comedy,Space,Cinematic,Atmospheric,Aliens,Great Soundtrack,Realistic,Violent,RPG,+"
"Gunfire Reborn","Nov 18 2021","1999.0","Gunfire Reborn is a level-based adventure game featuring FPS, Roguelite and RPG. Players can control heroes with various abilities to experience diverse Build gameplay, use various weapons to explore procedurally-generated levels. You can play the game alone, or join 4-player coop.","Very Positive","(858)","Duoyi Games","Duoyi Games","FPS,Co-op,Roguelite,Online Co-Op,Roguelike,Multiplayer,Indie,Action,Looter Shooter,Adventure,RPG,Early Access,Shooter,Action Roguelike,First-Person,Dungeon Crawler,Replay Value,Singleplayer,Fast-Paced,Souls-like,+"
"Call of Duty®: Modern Warfare® 3","Nov 8 2011","3999.0","The best-selling first-person action series of all-time returns with an epic sequel to the multiple GOTY award winner Call of Duty®: Modern Warfare® 2","Very Positive","(142)","Infinity Ward, Sledgehammer Games","Activision","Action,FPS,Multiplayer,Shooter,First-Person,War,Singleplayer,Online Co-Op,Military,Co-op,Casual,Story Rich,Survival,Controller,Linear,Adventure,Zombies,Point & Click,Dog,Massively Multiplayer,+"
"Planet Zoo","Nov 5 2019","4499.0","Build a world for wildlife in Planet Zoo. From the developers of Planet Coaster and Zoo Tycoon comes the ultimate zoo sim. Construct detailed habitats, manage your zoo, and meet authentic living animals who think, feel and explore the world you create around them.","Very Positive","(804)","Frontier Developments","Frontier Developments","Management,Simulation,Building,Sandbox,Nature,City Builder,Economy,Family Friendly,Realistic,Singleplayer,Resource Management,Cute,Great Soundtrack,Strategy,Relaxing,Open World,Funny,Casual,Multiplayer,Horses,+"
"Stranded Deep","Jan 23 2015","1499.0","Take the role of a plane crash survivor stranded somewhere in the Pacific Ocean. Come face to face with some of the most life threatening scenarios that will result in a different experience each time you play. Scavenge. Discover. Survive.","Mostly Positive","(395)","Beam Team Games","Beam Team Publishing","Open World Survival Craft,Survival,Multiplayer,Open World,Crafting,First-Person,Adventure,Exploration,Realistic,Singleplayer,Building,Sandbox,Co-op,Simulation,Early Access,Underwater,Action,Atmospheric,Indie,Strategy,+"
"Lobotomy Corporation | Monster Management Simulation","Apr 9 2018","849.0","A roguelite monster-management simulation inspired by the likes of the SCP Foundation, Cabin in the Woods, and Warehouse 13. Order your employees to perform work with the creatures and watch as it unfolds; harness greater energy, and expand the facility","Overwhelmingly Positive","(364)","ProjectMoon","ProjectMoon","Management,Simulation,Difficult,Story Rich,Horror,Indie,Great Soundtrack,Psychological Horror,Gore,Strategy,Singleplayer,2D,Cute,Anime,Lovecraftian,Atmospheric,RTS,Roguelike,Roguelite,Visual Novel,+"
"Far Cry® Primal","Mar 1 2016","749.0","The award-winning Far Cry franchise returns with its innovative open world gameplay, bringing together massive beasts, breathtaking environments, and unpredictable savage encounters. Welcome to the Stone Age, a time of danger and adventure.","Very Positive","(377)","Ubisoft","Ubisoft","Open World,Survival,Action,Adventure,Hunting,First-Person,Singleplayer,Open World Survival Craft,Crafting,Exploration,FPS,Stealth,Atmospheric,Shooter,Mature,Sandbox,RPG,Action RPG,Strategy,Online Co-Op,+"
"theHunter: Call of the Wild™","Feb 16 2017","1999.0","Experience an atmospheric hunting game like no other in this realistic and visually breathtaking open world. Immerse yourself in the atmospheric single player campaign, or share the ultimate hunting experience with friends.","Very Positive","(2,142)","Expansive Worlds","Expansive Worlds","Hunting,Open World,Multiplayer,Simulation,First-Person,Shooter,Survival,Realistic,Co-op,Adventure,FPS,Action,Singleplayer,Walking Simulator,Online Co-Op,Atmospheric,Sports,Combat,Strategy,Gore,+"
"Help Me Remember, Satori-sama!","Mar 8 2022","699.0","Satori's overworked herself into bed, but Okuu needs help remembering things! You can't use her heart-reading power, and will instead have to ask questions and use her power of recollection to correct wrong info, all while enduring visits from Orin and Koishi as you deduce what Okuu's forgotten!","Positive","(46)","ISY","ISY","Casual,Puzzle,Word Game,Cute,Singleplayer,Comedy,Text-Based,Faith,Anime,+"
"New World","Sep 28 2021","3999.0","Explore a thrilling, open-world MMO filled with danger and opportunity where you'll forge a new destiny on the supernatural island of Aeternum.","Mixed","(2,847)","Amazon Games","Amazon Games","Massively Multiplayer,Open World,MMORPG,RPG,Adventure,Action,PvP,PvE,Multiplayer,Walking Simulator,Fantasy,Character Customization,Crafting,Third Person,Co-op,Open World Survival Craft,Sandbox,Violent,Souls-like,Sexual Content,+"
"Operation: Tango","Jun 1 2021","1299.0","It takes two to save the world in this cooperative spy adventure. Pair up with a friend as Agent or Hacker—with only your voices to connect you—and work together to bring a hi-tech global menace to its knees. Now with a FREE CONTENT UPDATE!","Very Positive","(200)","Clever Plays","Clever Plays","Online Co-Op,Co-op Campaign,Puzzle,Hacking,Adventure,Casual,Female Protagonist,Family Friendly,Cyberpunk,Detective,Futuristic,3D,First-Person,Stylized,Colorful,Heist,Action-Adventure,Co-op,Investigation,Multiplayer,+"
"Slime Rancher","Aug 1 2017","1999.0","Slime Rancher is the tale of Beatrix LeBeau, a plucky, young rancher who sets out for a life a thousand light years away from Earth on the ‘Far, Far Range’ where she tries her hand at making a living wrangling slimes.","Overwhelmingly Positive","(1,456)","Monomi Park","Monomi Park","Cute,Exploration,Adventure,Singleplayer,Open World,First-Person,Colorful,Funny,Sandbox,Simulation,Casual,Fantasy,Management,Indie,Family Friendly,Great Soundtrack,Female Protagonist,Early Access,Action,FPS,+"
"DARK SOULS™ II: Scholar of the First Sin","Apr 1 2015","3999.0","DARK SOULS™ II: Scholar of the First Sin brings the franchise’s renowned obscurity & gripping gameplay to a new level. Join the dark journey and experience overwhelming enemy encounters, diabolical hazards, and unrelenting challenge.","Very Positive","(860)","FromSoftware, Inc","BANDAI NAMCO Entertainment, FromSoftware, Inc","Souls-like,Dark Fantasy,RPG,Difficult,Action,Third Person,Atmospheric,Action RPG,Character Customization,Co-op,Multiplayer,Adventure,Fantasy,Medieval,Dark,Singleplayer,Lore-Rich,Story Rich,PvP,Remake,+"
"Hot Dogs, Horseshoes & Hand Grenades","Apr 5 2016","1999.0","Do you like hot dogs? How about horseshoes? Hand grenades? (everyone likes hand grenades) Anyway, we've got all that, and guns. SO MANY GUNS. So if you like ordnance, meat, and far too many groan-worthy puns, this is the VR sandbox game for you.","Overwhelmingly Positive","(300)","RUST LTD.","RUST LTD.","VR,Simulation,Gun Customization,Sandbox,Shooter,Action,FPS,Early Access,Funny,Realistic,Physics,Singleplayer,Indie,America,First-Person,Destruction,Atmospheric,Family Friendly,Horror,Psychological Horror,+"
"Wartales","Dec 1 2021","3499.0","Wartales is an open world RPG in which you lead a group of mercenaries in their search for wealth across a massive medieval universe. Explore the world, recruit companions, collect bounties and unravel the secrets of the tombs of the ancients!","Very Positive","(522)","Shiro Games","Shiro Unlimited","RPG,Open World,Turn-Based Strategy,Adventure,Medieval,Strategy,Exploration,Singleplayer,Indie,Early Access,Tactical RPG,Story Rich,Survival,3D,Sandbox,Violent,Turn-Based Combat,Fantasy,Tactical,Turn-Based,+"
