title_name,realease_date,price,description,title_review,title_rating,developer,publisher,game_tags
"ELDEN RING","Feb 24 2022","5999.0","THE NEW FANTASY ACTION RPG. Rise, Tarnished, and be guided by grace to brandish the power of the Elden Ring and become an Elden Lord in the Lands Between.","Very Positive","(83,815)","FromSoftware Inc.","FromSoftware Inc., BANDAI NAMCO Entertainment","Souls-like,Relaxing,Dark Fantasy,RPG,Difficult,Action RPG,Open World,Third Person,Fantasy,Multiplayer,Online Co-Op,Action,Singleplayer,Co-op,PvP,Violent,3D,Atmospheric,Great Soundtrack,Walking Simulator,+"
"LEGO® Star Wars™: The Skywalker Saga","Apr 5 2022","4999.0","Play through all nine Skywalker saga films in a game unlike any other. With over 300 playable characters, over 100 vehicles, and 23 planets to explore, a galaxy far, far away has never been more fun! *Includes classic Obi-Wan Kenobi playable character","Very Positive","(14,593)","TT Games","Warner Bros. Games, Warner Bros. Interactive Entertainment","LEGO,Adventure,Open World,Space,Multiplayer,Co-op,Action,Sci-fi,Singleplayer,Funny,Local Co-Op,Third Person,Family Friendly,Story Rich,Epic,Great Soundtrack,Memes,Beautiful,Psychological Horror,Puzzle,+"
"LEGO® Star Wars™: The Skywalker Saga","Apr 5 2022","4999.0","Play through all nine Skywalker saga films in a game unlike any other. With over 300 playable characters, over 100 vehicles, and 23 planets to explore, a galaxy far, far away has never been more fun! *Includes classic Obi-Wan Kenobi playable character","Very Positive","(14,570)","TT Games","Warner Bros. Games, Warner Bros. Interactive Entertainment","LEGO,Adventure,Open World,Space,Multiplayer,Co-op,Action,Sci-fi,Singleplayer,Funny,Local Co-Op,Third Person,Family Friendly,Story Rich,Epic,Great Soundtrack,Memes,Beautiful,Psychological Horror,Puzzle,+"
"Valve Index VR Kit","Jun 28 2019","99900.0","NA","NA","NA","NA","NA","NA"
"No Man's Sky","Aug 12 2016","2999.0","No Man's Sky is a game about exploration and survival in an infinite procedurally generated universe.","Very Positive","(1,646)","Hello Games","Hello Games","Open World,Open World Survival Craft,Space,Exploration,Sci-fi,Survival,Procedural Generation,Adventure,First-Person,Sandbox,Singleplayer,Multiplayer,Atmospheric,Crafting,Space Sim,Indie,Action,Simulation,FPS,Great Soundtrack,+"
"Call of Duty®: Black Ops III","Nov 6 2015","1979.0","Call of Duty®: Black Ops III Zombies Chronicles Edition includes the full base game plus the Zombies Chronicles content expansion.","Very Positive","(3,011)","Treyarch, Aspyr (Mac)","Activision, Aspyr (Mac)","Multiplayer,FPS,Zombies,Shooter,Action,First-Person,Co-op,Singleplayer,Futuristic,Illuminati,Hero Shooter,Robots,Sci-fi,Gore,Great Soundtrack,Story Rich,Atmospheric,Quick-Time Events,Parkour,Simulation,+"
"Squad","Sep 23 2020","3749.0","Squad is a tactical FPS that provides authentic combat experiences through teamwork, constant communication, and gameplay. It bridges the large gap between arcade shooter and military simulation with 100 player battles, combined arms combat, base building, and a great integrated VoIP system","Very Positive","(1,992)","Offworld Industries","Offworld Industries","Military,Realistic,FPS,Multiplayer,Tactical,Shooter,War,Team-Based,Action,First-Person,Strategy,Simulation,Open World,Co-op,Massively Multiplayer,Early Access,Atmospheric,Walking Simulator,Indie,Singleplayer,+"
"Jurassic World Evolution 2: Premium Edition","","4990.0","NA","NA","NA","NA","NA","NA"
"Rust","Feb 8 2018","3999.0","The only aim in Rust is to survive. Everything wants you to die - the island’s wildlife and other inhabitants, the environment, other survivors. Do whatever it takes to last another night.","Very Positive","(10,379)","Facepunch Studios","Facepunch Studios","Survival,Crafting,Multiplayer,Open World,Open World Survival Craft,Building,Sandbox,PvP,Adventure,First-Person,Action,FPS,Nudity,Co-op,Shooter,Online Co-Op,Indie,Early Access,Post-apocalyptic,Simulation,+"
"Jurassic World Evolution 2","Nov 9 2021","3299.0","Jurassic World Evolution 2 is the much-anticipated sequel to Frontier’s highly successful Jurassic World Evolution. This bold new era in the Jurassic World Evolution game franchise builds upon the ground-breaking and immersive 2018 management simulation.","Very Positive","(444)","Frontier Developments","Frontier Developments","Dinosaurs,Building,Simulation,Management,Strategy,Sandbox,Singleplayer,City Builder,Sci-fi,Economy,Resource Management,Open World,Violent,Atmospheric,Action,Sequel,Survival,Base Building,Multiplayer,VR,+"
"DayZ","Dec 13 2018","2699.0","How long can you survive a post-apocalyptic world? A land overrun with an infected "zombie" population, where you compete with other survivors for limited resources. Will you team up with strangers and stay strong together? Or play as a lone wolf to avoid betrayal? This is DayZ – this is your story.","Very Positive","(2,598)","Bohemia Interactive","Bohemia Interactive","Survival,Zombies,Multiplayer,Open World,Action,PvP,Shooter,Massively Multiplayer,Horror,Simulation,Post-apocalyptic,Early Access,FPS,First-Person,Survival Horror,Sandbox,Adventure,Co-op,Atmospheric,Indie,+"
"Ready or Not","Dec 17 2021","3999.0","Ready or Not is an intense, tactical, first-person shooter that depicts a modern-day world in which SWAT police units are called to defuse hostile and confronting situations.","Very Positive","(2,419)","VOID Interactive","VOID Interactive","Tactical,Realistic,FPS,Multiplayer,Shooter,First-Person,Co-op,Action,Singleplayer,Violent,Crime,Combat,Gun Customization,Modern,Gore,Atmospheric,America,Co-op Campaign,Early Access,PvP,+"
"Phasmophobia","Sep 18 2020","1399.0","Phasmophobia is a 4 player online co-op psychological horror. Paranormal activity is on the rise and it’s up to you and your team to use all the ghost hunting equipment at your disposal in order to gather as much evidence as you can.","Overwhelmingly Positive","(8,983)","Kinetic Games","Kinetic Games","Horror,Online Co-Op,Multiplayer,Psychological Horror,Co-op,VR,Supernatural,First-Person,Investigation,Dark,Mystery,Demons,Detective,Early Access,3D,Thriller,Indie,Action,Tactical,Lovecraftian,+"
"Sea of Thieves","Jun 3 2020","3999.0","Sea of Thieves offers the essential pirate experience, from sailing and fighting to exploring and looting – everything you need to live the pirate life and become a legend in your own right. With no set roles, you have complete freedom to approach the world, and other players, however you choose.","Very Positive","(5,836)","Rare Ltd","Xbox Game Studios","Adventure,Multiplayer,Open World,Pirates,Co-op,Action,Online Co-Op,Sailing,PvP,First-Person,Exploration,Naval,Funny,PvE,Massively Multiplayer,Atmospheric,Great Soundtrack,Swordplay,FPS,Singleplayer,+"
"Call of Duty®: Black Ops III","Nov 6 2015","1979.0","Call of Duty®: Black Ops III Zombies Chronicles Edition includes the full base game plus the Zombies Chronicles content expansion.","Very Positive","(3,011)","Treyarch, Aspyr (Mac)","Activision, Aspyr (Mac)","Multiplayer,FPS,Zombies,Shooter,Action,First-Person,Co-op,Singleplayer,Futuristic,Illuminati,Hero Shooter,Robots,Sci-fi,Gore,Great Soundtrack,Story Rich,Atmospheric,Quick-Time Events,Parkour,Simulation,+"
"Grand Theft Auto V: Premium Edition","","2998.0","NA","NA","NA","NA","NA","NA"
"Planet Zoo: Ultimate Edition","","6310.0","NA","NA","NA","NA","NA","NA"
"Call of Duty®: Black Ops II","Nov 12 2012","1979.0","Pushing the boundaries of what fans have come to expect from the record-setting entertainment franchise, Call of Duty®: Black Ops II propels players into a near future Cold War","Very Positive","(235)","Treyarch","Activision","Action,Multiplayer,FPS,Shooter,First-Person,Singleplayer,Co-op,War,Online Co-Op,Team-Based,Futuristic,Survival,Controller,Tactical,Adventure,Great Soundtrack,Sci-fi,Massively Multiplayer,Horror,Atmospheric,+"
"Midnight Ghost Hunt","Mar 31 2022","1999.0","A chaotic multiplayer hide-and-seek game. Possess seemingly harmless objects as Ghosts or chase them down as Hunters before the clock strikes midnight!","Very Positive","(2,192)","Vaulted Sky Games","Coffee Stain Publishing","Early Access,Combat,Multiplayer,Team-Based,FPS,PvP,First-Person,Supernatural,Action,1990's,Indie,Shooter,Realistic,Sci-fi,Comedy,Tactical,3D,Third-Person Shooter,Controller,Artificial Intelligence,+"
"Project Zomboid","Nov 8 2013","1999.0","Project Zomboid is the ultimate in zombie survival. Alone or in MP: you loot, build, craft, fight, farm and fish in a struggle to survive. A hardcore RPG skillset, a vast map, massively customisable sandbox and a cute tutorial raccoon await the unwary. So how will you die? All it takes is a bite..","Very Positive","(3,589)","The Indie Stone","The Indie Stone","Survival,Zombies,Open World,Open World Survival Craft,Multiplayer,Sandbox,Post-apocalyptic,Crafting,Co-op,Indie,Simulation,RPG,Building,Survival Horror,Realistic,Isometric,Singleplayer,Early Access,2D,Adventure,+"
"GTFO","Dec 10 2021","3199.0","GTFO is an extreme cooperative horror shooter that throws you from gripping suspense to explosive action in a heartbeat. Stealth, strategy, and teamwork are necessary to survive in your deadly, underground prison. Work together or die together.","Very Positive","(352)","10 Chambers","10 Chambers","Online Co-Op,Horror,Co-op,FPS,Shooter,Difficult,Survival Horror,Multiplayer,Action,Stealth,Tactical,Team-Based,Gore,First-Person,Character Customization,PvE,Zombies,Violent,Atmospheric,Replay Value,+"
"Solasta: Crown of the Magister","May 27 2021","1599.0","Roll for initiative, take attacks of opportunity, manage player location and the verticality of the battle field in this Turn-Based Tactical RPG based on the SRD 5.1 Ruleset. In Solasta, you make the choices, dice decide your destiny.","Very Positive","(279)","Tactical Adventures","Tactical Adventures","RPG,Dungeons & Dragons,Adventure,CRPG,Character Customization,Choices Matter,Tactical,Fantasy,Top-Down,Early Access,Party-Based RPG,Story Rich,Tactical RPG,Singleplayer,Turn-Based Tactics,Turn-Based Combat,Turn-Based Strategy,3D,Team-Based,Strategy,+"
"Raft","May 23 2018","1999.0","Raft throws you and your friends into an epic oceanic adventure! Alone or together, players battle to survive a perilous voyage across a vast sea! Gather debris, scavenge reefs and build your own floating home, but be wary of the man-eating sharks!","Very Positive","(3,196)","Redbeet Interactive","Axolot Games","Survival,Open World Survival Craft,Multiplayer,Co-op,Crafting,Open World,Building,Base Building,Online Co-Op,Adventure,Sandbox,Early Access,First-Person,Singleplayer,Underwater,Simulation,Action,Indie,Strategy,Massively Multiplayer,+"
"WWE 2K22","Mar 11 2022","4499.0","REDESIGNED ENGINE. NEW CONTROLS. ALL THE FEATURES YOU CAN HANDLE. Get ripped out of the stands and hit with complete control of the WWE Universe. Hitting this hard has never been so easy. WWE 2K22: IT HITS DIFFERENT","Mostly Positive","(1,386)","Visual Concepts","2K","Simulation,Sports,Wrestling,Local Co-Op,PvP,Co-op,Multiplayer,Local Multiplayer,Fighting,Online Co-Op,Character Customization,Sexual Content,Nudity,+"
"Back 4 Blood","Oct 12 2021","2999.0","Back 4 Blood is a thrilling cooperative first-person shooter from the creators of the critically acclaimed Left 4 Dead franchise. Experience the intense 4 player co-op narrative campaign, competitive multiplayer as human or Ridden, and frenetic gameplay that keeps you in the action.","Mixed","(822)","Turtle Rock Studios","Warner Bros. Games, Warner Bros. Interactive Entertainment","Zombies,Online Co-Op,Multiplayer,Action,Shooter,FPS,Co-op,Gore,Horror,First-Person,Blood,Violent,Survival,Singleplayer,Adventure,PvP,Survival Horror,PvE,Roguelite,Replay Value,+"
"Risk of Rain 2: Survivors of the Void","Mar 1 2022","1499.0","None","Very Positive","(325)","Hopoo Games","Gearbox Publishing","Action,Indie,Great Soundtrack,Co-op,Action Roguelike,Multiplayer,Third-Person Shooter,Roguelike,Looter Shooter,Difficult,Singleplayer,Survival,+"
"Valve Index® Base Station","Jun 28 2019","14900.0","NA","NA","NA","NA","NA","NA"
"Vampire Survivors","Dec 17 2021","299.0","Mow down thousands of night creatures and survive until dawn! Vampire Survivors is a gothic horror casual game with rogue-lite elements, where your choices can allow you to quickly snowball against the hundreds of monsters that get thrown at you.","Overwhelmingly Positive","(14,919)","poncle","poncle","Action Roguelike,Pixel Graphics,Bullet Hell,Casual,2D,Action,Indie,RPG,Roguelite,Vampire,Action RPG,Singleplayer,Controller,Score Attack,Arcade,Early Access,Dark Fantasy,Retro,Roguelike,1980s,+"
"ARK: Survival Evolved","Aug 27 2017","989.0","Stranded on the shores of a mysterious island, you must learn to survive. Use your cunning to kill or tame the primeval creatures roaming the land, and encounter other players to survive, dominate... and escape!","Very Positive","(5,298)","Studio Wildcard, Instinct Games, Efecto Studios, Virtual Basement LLC","Studio Wildcard","Open World Survival Craft,Survival,Open World,Multiplayer,Dinosaurs,Crafting,Building,Adventure,Base Building,Co-op,Action,First-Person,Sandbox,Massively Multiplayer,Singleplayer,Early Access,RPG,Dragons,Sci-fi,Indie,+"
"Destiny 2: The Witch Queen","Feb 22 2022","3999.0","None","Mostly Positive","(144)","Bungie","Bungie","Action,Adventure,Free to Play,Looter Shooter,FPS,Multiplayer,MMORPG,Great Soundtrack,Shooter,First-Person,Atmospheric,Open World,Co-op,+"
"The Forest","Apr 30 2018","1999.0","As the lone survivor of a passenger jet crash, you find yourself in a mysterious forest battling to stay alive against a society of cannibalistic mutants. Build, explore, survive in this terrifying first person survival horror simulator.","Overwhelmingly Positive","(4,432)","Endnight Games Ltd","Endnight Games Ltd","Open World Survival Craft,Survival,Open World,Horror,Crafting,Adventure,Building,Survival Horror,First-Person,Action,Exploration,Sandbox,Atmospheric,Singleplayer,Simulation,Indie,Realistic,Gore,Early Access,Zombies,+"
"Stardew Valley","Feb 26 2016","1499.0","You've inherited your grandfather's old farm plot in Stardew Valley. Armed with hand-me-down tools and a few coins, you set out to begin your new life. Can you learn to live off the land and turn these overgrown fields into a thriving home?","Overwhelmingly Positive","(6,494)","ConcernedApe","ConcernedApe","Farming Sim,Life Sim,Pixel Graphics,RPG,Multiplayer,Relaxing,Agriculture,Simulation,Crafting,Sandbox,Indie,Building,Singleplayer,Casual,Open World,2D,Great Soundtrack,Cute,Dating Sim,Fishing,+"
"Forza Horizon 5","Nov 9 2021","5999.0","Your Ultimate Horizon Adventure awaits! Explore the vibrant and ever-evolving open world landscapes of Mexico with limitless, fun driving action in hundreds of the world’s greatest cars. Begin Your Horizon Adventure today and add to your Wishlist!","Very Positive","(3,316)","Playground Games","Xbox Game Studios","Racing,Open World,Driving,Multiplayer,Adventure,Automobile Sim,Simulation,Realistic,Exploration,Arcade,First-Person,Atmospheric,Sports,PvP,Co-op,Online Co-Op,Singleplayer,Beautiful,Action,Third Person,+"
"Call of Duty - Black Ops II Bundle","","4999.0","NA","NA","NA","NA","NA","NA"
"Solasta: Crown of the Magister - Lost Valley","Apr 14 2022","1299.0","None","Positive","(23)","Tactical Adventures","Tactical Adventures","Adventure,RPG,Strategy,Turn-Based Strategy,Team-Based,Fantasy,Indie,Tactical,Story Rich,Class-Based,Singleplayer,Turn-Based Combat,CRPG,Character Customization,Choices Matter,Turn-Based Tactics,Dungeons & Dragons,Tactical RPG,Top-Down,+"
"Valheim","Feb 2 2021","1999.0","A brutal exploration and survival game for 1-10 players, set in a procedurally-generated purgatory inspired by viking culture. Battle, build, and conquer your way to a saga worthy of Odin’s patronage!","Very Positive","(3,651)","Iron Gate AB","Coffee Stain Publishing","Open World Survival Craft,Survival,Online Co-Op,Open World,Multiplayer,Building,Crafting,Exploration,Co-op,Base Building,Sandbox,Adventure,Mythology,RPG,Sailing,Early Access,Action,Indie,PvP,Fishing,+"
"Risk of Rain 2","Aug 11 2020","2499.0","Escape a chaotic alien planet by fighting through hordes of frenzied monsters – with your friends, or on your own. Combine loot in surprising ways and master each character until you become the havoc you feared upon your first crash landing.","Overwhelmingly Positive","(3,292)","Hopoo Games","Gearbox Publishing","Third-Person Shooter,Action Roguelike,Multiplayer,Action,Roguelite,Co-op,Looter Shooter,Roguelike,Loot,Shooter,Online Co-Op,Difficult,Third Person,Indie,Survival,Singleplayer,Soundtrack,Great Soundtrack,Early Access,Bullet Hell,+"
"Dying Light 2 Stay Human","Feb 3 2022","5999.0","The virus won and civilization has fallen back to the Dark Ages. The City, one of the last human settlements, is on the brink of collapse. Use your agility and combat skills to survive, and reshape the world. Your choices matter.","Mostly Positive","(3,628)","Techland","Techland","Open World,Zombies,Co-op,Parkour,Multiplayer,Survival,Action,First-Person,Horror,Gore,Post-apocalyptic,Violent,Choices Matter,RPG,Adventure,Story Rich,Atmospheric,Singleplayer,Survival Horror,FPS,+"
"DayZ Livonia Edition","","3436.0","NA","NA","NA","NA","NA","NA"
"Red Dead Redemption 2","Dec 5 2019","5999.0","Winner of over 175 Game of the Year Awards and recipient of over 250 perfect scores, RDR2 is the epic tale of outlaw Arthur Morgan and the infamous Van der Linde gang, on the run across America at the dawn of the modern age. Also includes access to the shared living world of Red Dead Online.","Very Positive","(7,009)","Rockstar Games","Rockstar Games","Open World,Adventure,Story Rich,Western,Action,Multiplayer,Realistic,Shooter,Singleplayer,Atmospheric,Third-Person Shooter,Horses,Beautiful,Great Soundtrack,Mature,Third Person,Sandbox,Gore,First-Person,FPS,+"
"Hell Let Loose","Jul 27 2021","3999.0","Join the ever expanding experience of Hell Let Loose - a hardcore World War Two first person shooter with epic battles of 100 players with infantry, tanks, artillery, a dynamically shifting front line and a unique resource based RTS-inspired meta-game.","Very Positive","(1,725)","Black Matter Pty Ltd","Team17","Action,Shooter,World War II,FPS,Multiplayer,Realistic,War,Simulation,Tactical,Singleplayer,First-Person,Military,PvP,Massively Multiplayer,Strategy,Historical,Gore,Mature,Violent,Indie,+"
"Steam Deck","","39900.0","NA","NA","NA","NA","NA","NA"
"Steam Deck","","39900.0","NA","NA","NA","NA","NA","NA"
"Steam Deck","","39900.0","NA","NA","NA","NA","NA","NA"
"Sekiro™: Shadows Die Twice - GOTY Edition","Mar 21 2019","5999.0","Game of the Year - The Game Awards 2019 Best Action Game of 2019 - IGN Carve your own clever path to vengeance in the award winning adventure from developer FromSoftware, creators of Bloodborne and the Dark Souls series. Take Revenge. Restore Your Honor. Kill Ingeniously.","Very Positive","(2,226)","FromSoftware","Activision (Excluding Japan and Asia), FromSoftware (Japan), 方块游戏 (Asia)","Souls-like,Difficult,Action,Singleplayer,Ninja,Stealth,Adventure,Third Person,Open World,Story Rich,Atmospheric,Violent,Assassin,Dark Fantasy,Hack and Slash,Great Soundtrack,RPG,Gore,Dark,Rhythm,+"
"God of War","Jan 14 2022","4999.0","His vengeance against the Gods of Olympus years behind him, Kratos now lives as a man in the realm of Norse Gods and monsters. It is in this harsh, unforgiving world that he must fight to survive… and teach his son to do the same.","Overwhelmingly Positive","(1,461)","Santa Monica Studio","PlayStation PC LLC","Action,Adventure,Singleplayer,Story Rich,Mythology,Third Person,Combat,Violent,RPG,Fantasy,Exploration,Atmospheric,Hack and Slash,Emotional,Gore,Action RPG,Souls-like,3D,PvE,Crafting,+"
"Core Keeper","Mar 8 2022","1299.0","Explore an endless cavern of creatures, relics and resources in a mining sandbox adventure for 1-8 players. Mine, build, fight, craft and farm to unravel the mystery of the ancient Core.","Very Positive","(4,244)","Pugstorm","Fireshine Games","Early Access,Online Co-Op,Sandbox,Pixel Graphics,Adventure,2D,Procedural Generation,Dungeon Crawler,Farming Sim,Casual,Relaxing,Crafting,Cooking,Exploration,Simulation,Survival,Atmospheric,Building,Mining,Mystery,+"
"The Elder Scrolls Online - Blackwood","Jun 1 2021","989.0","The Elder Scrolls Online Collection: Blackwood is the ultimate Elder Scrolls experience and includes the base game, Blackwood Chapter, and all previous Chapters.","Mixed","(11)","Zenimax Online Studios","Bethesda Softworks","RPG,Massively Multiplayer,Multiplayer,Violent,Gore,Singleplayer,MMORPG,Open World,Fantasy,+"
"Farming Simulator 22","Nov 22 2021","4999.0","Create your farm and let the good times grow! Harvest crops, tend to animals, manage productions, and take on seasonal challenges.","Very Positive","(1,272)","Giants Software","Giants Software","Co-op,Simulation,Farming Sim,Agriculture,Moddable,Management,Sandbox,Immersive Sim,3D,Multiplayer,First-Person,Character Customization,Online Co-Op,Economy,Family Friendly,Third Person,Open World,America,Nature,Horses,+"
"BeamNG.drive","May 29 2015","2499.0","A dynamic soft-body physics vehicle simulator capable of doing just about anything.","Overwhelmingly Positive","(3,168)","BeamNG","BeamNG","Simulation,Driving,Physics,Destruction,Automobile Sim,Realistic,Open World,Sandbox,Racing,Moddable,Singleplayer,Early Access,Multiplayer,Exploration,First-Person,Third Person,Funny,Action,Adventure,Flight,+"
"Planet Zoo: Wetlands Animal Pack","Apr 12 2022","999.0","None","Very Positive","(56)","Frontier Developments","Frontier Developments","Simulation,Casual,Strategy,Building,Sandbox,Family Friendly,Resource Management,Management,+"
"Call of Duty®: Black Ops","Nov 9 2010","1999.0","The biggest first-person action series of all time and the follow-up to critically acclaimed Call of Duty®: Modern Warfare 2 returns with Call of Duty®: Black Ops.","Very Positive","(330)","Treyarch","Activision","Action,FPS,Zombies,Multiplayer,Shooter,Singleplayer,Cold War,First-Person,War,Military,Online Co-Op,Co-op,Gore,Story Rich,Controller,Adventure,Linear,Horror,Massively Multiplayer,Great Soundtrack,+"
"Deep Rock Galactic","May 13 2020","2999.0","Deep Rock Galactic is a 1-4 player co-op FPS featuring badass space Dwarves, 100% destructible environments, procedurally-generated caves, and endless hordes of alien monsters.","Overwhelmingly Positive","(1,876)","Ghost Ship Games","Coffee Stain Publishing","Co-op,PvE,FPS,Loot,Exploration,Looter Shooter,Procedural Generation,Shooter,First-Person,Class-Based,Horror,Sci-fi,Action,Space,Combat,Atmospheric,Action Roguelike,Dark,Survival,Open World,+"
"Darkest Dungeon®: Ancestral Edition","","981.0","NA","NA","NA","NA","NA","NA"
"Planet Coaster: Complete the Collection","","5546.0","NA","NA","NA","NA","NA","NA"
"STAR WARS™: The Old Republic™ - Cartel Coins","Jul 21 2020","299.0","None","['No user reviews']","0","BioWare","Electronic Arts","Massively Multiplayer,MMORPG,+"
"STAR WARS™: The Old Republic™ - Cartel Coins","Jul 21 2020","299.0","None","['No user reviews']","0","BioWare","Electronic Arts","Massively Multiplayer,MMORPG,+"
"STAR WARS™: The Old Republic™ - Cartel Coins","Jul 21 2020","299.0","None","['No user reviews']","0","BioWare","Electronic Arts","Massively Multiplayer,MMORPG,+"
"STAR WARS™: The Old Republic™ - Cartel Coins","Jul 21 2020","299.0","None","['No user reviews']","0","BioWare","Electronic Arts","Massively Multiplayer,MMORPG,+"
"STAR WARS™: The Old Republic™ - Cartel Coins","Jul 21 2020","299.0","None","['No user reviews']","0","BioWare","Electronic Arts","Massively Multiplayer,MMORPG,+"
"STAR WARS™: The Old Republic™ - Cartel Coins","Jul 21 2020","299.0","None","['No user reviews']","0","BioWare","Electronic Arts","Massively Multiplayer,MMORPG,+"
"Teardown","Oct 29 2020","1999.0","Prepare the perfect heist in this simulated and fully destructible voxel world. Tear down walls with vehicles or explosives to create shortcuts. Stack objects to reach higher. Use the environment to your advantage in the most creative way you can think of.","Overwhelmingly Positive","(1,990)","Tuxedo Labs","Tuxedo Labs","Destruction,Physics,Sandbox,Voxel,First-Person,Heist,Open World,Singleplayer,Realistic,Simulation,Action,Puzzle,Driving,Tactical,Indie,Replay Value,3D,Immersive Sim,Puzzle Platformer,Early Access,+"
"Cyberpunk 2077","Dec 9 2020","5999.0","Cyberpunk 2077 is an open-world, action-adventure RPG set in the dark future of Night City — a dangerous megalopolis obsessed with power, glamor, and ceaseless body modification.","Mostly Positive","(431,414)","CD PROJEKT RED","CD PROJEKT RED","Cyberpunk,Open World,RPG,Sci-fi,Futuristic,Singleplayer,Nudity,FPS,First-Person,Atmospheric,Story Rich,Exploration,Mature,Action,Violent,Great Soundtrack,Action RPG,Adventure,Character Customization,Immersive Sim,+"
"Garry's Mod","Nov 29 2006","999.0","Garry's Mod is a physics sandbox. There aren't any predefined aims or goals. We give you the tools and leave you to play.","Overwhelmingly Positive","(9,222)","Facepunch Studios","Valve","Sandbox,Multiplayer,Funny,Moddable,Building,Comedy,Co-op,Mod,First-Person,Physics,Simulation,Online Co-Op,FPS,Singleplayer,Action,Shooter,Animation & Modeling,Indie,Massively Multiplayer,Adventure,+"
"Terraria","May 16 2011","999.0","Dig, fight, explore, build! Nothing is impossible in this action-packed adventure game. Four Pack also available!","Overwhelmingly Positive","(10,934)","Re-Logic","Re-Logic","Open World Survival Craft,Sandbox,Survival,2D,Multiplayer,Adventure,Crafting,Pixel Graphics,Building,Exploration,Co-op,Open World,Indie,Online Co-Op,Action,RPG,Singleplayer,Replay Value,Platformer,Atmospheric,+"
